table_id|column_id|label_id|label|column_data
dataset/Dataset/data/1508377/table_1|0|57|континент|Европа Америка Азия и Океания Карибские острова Африка 
dataset/Dataset/data/2614849/table_0|0|57|континент|Принимающая страна Европа Азия и Океания Африка Америка 
dataset/Dataset/data/3972407/table_7|0|57|континент|Азия Африка Европа Океания Северная Америка Южная Америка 
dataset/Dataset/data/43650/table_1|0|57|континент|Афроевразия Америка Океания 
dataset/Dataset/data/6618950/table_3|2|57|континент|Африка Африка Африка Африка Африка Азия 
dataset/Dataset/data/7696624/table_1|0|57|континент|Африка Америка Азия Карибы Европа Океания 
dataset/Dataset/data/7927506/table_1|0|57|континент|Афроевразия Америка Океания 
dataset/Dataset/data/896840/table_1|0|57|континент|Европа Америка Океания Азия Африка 
