table_id|column_id|label_id|label|column_data
dataset/Dataset/data/952193/table_0|2|71|муниципалитет|Апиа (Apía) Бальбоа (Balboa) Белен-де-Умбрия (Belén de Umbría) Доскебрадас (Dosquebradas) Гуатика (Guatica) Ла-Селия (La Celia) Ла-Вирхиния (La Virginia) Марселья (Marsella) Мистрато (Mistrató) Перейра (Pereira) Пуэбло-Рико (Pueblo Rico) Кинчия (Quinchía) Санта-Роса-де-Кабаль (Santa Rosa de Cabal) Сантуарио (Santuario) 
dataset/Dataset/data/8085742/table_0|1|71|муниципалитет|Варесе Бусто-Арсицио Галларате Саронно Кассано-Маньяго Традате Сомма-Ломбардо Мальнате Самарате Каронно-Пертузелла 
dataset/Dataset/data/297253/table_2|1|71|муниципалитет|Плая Пласа-де-ла-Революсьон Сентро-Абана Ла-Абана-Вьеха Регла Гавана-дель-Эсте Гуанабакоа Сан-Мигель-дель-Падрон Диес-де-Октубре Серро Марьянао Ла-Лиса Бойерос Арройо-Наранхо Которро 
dataset/Dataset/data/5445405/table_1|0|71|муниципалитет|Апиуна Аскурра Бенедиту-Нову Ботувера Бруски Дотор-Педринью Гуабируба Ильота Луис-Алвис Риу-дус-Седрус Родею всего ИТОГО 
dataset/Dataset/data/1919719/table_0|4|71|муниципалитет|Bilisht, Hoçisht, Miras, Progër, Qendër Bilisht Barmash, Çlirim, Эрсека, Leskovik, Mollas, Piskal-Novoselë, Qendër Ersekë, Qendër Leskovik Drenovë, Gorë, Korçë, Lekas, Libonik, Liqenas, Maliq, Moglicë, Mollaj, Pirg, Pojan, Qendër Bulgarec, Vithkuq, Voskop, Voskopojë, Vreshtas Buçimas, Çërravë, Dardhas, Pogradec, Proptisht, Trebinjë, Udënisht, Velçan 
dataset/Dataset/data/767273/table_0|1|71|муниципалитет|Апосоль Апулько Атолинга Бенито-Хуарес Калера Каньитас-де-Фелипе-Пескадор Консепсион-дель-Оро Куаутемок Чальчиуитес Эль-Платеадо-де-Хоакин-Амаро Эль-Сальвадор Фреснильо Хенаро-Кодина Хенераль-Энрике-Эстрада Генерал-Франсиско-Мургия Генерал-Панфило-Натера Гуадалупе Уануско Хальпа Херес-де-Гарсия-Салинас Хименес-дель-Теуль Хуан-Альдама Хучипила Лорето Луис-Мойя Масапиль Мельчор-Окампо Мескиталь-дель-Оро Мигель-Ауса Момах Монте-Эскобедо Морелос Мойяуа-де-Эстрада Ночистлан-де-Мехия Нория-де-Анхелес Охокальенте Пануко Пинос Рио-Гранде Санта-Мария-де-ла-Пас Саин-Альто Сомбререте Сустикакан Табаско Тепечитлан Тепетонго Теуль-де-Гонсалес-Ортега Тлальтенанго-де-Санчес-Роман Транкосо Тринидад-Гарсия-де-ла-Кадена Вальпараисо Ветагранде Вилья-де-Кос Вилья-Гарсия Вилья-Гонсалес-Ортега Вилья-Идальго Вильянуэва Сакатекас 
dataset/Dataset/data/758444/table_0|1|71|муниципалитет|Апосоль Апулько Атолинга Бенито-Хуарес Калера Каньитас-де-Фелипе-Пескадор Консепсион-дель-Оро Куаутемок Чальчиуитес Эль-Платеадо-де-Хоакин-Амаро Эль-Сальвадор Фреснильо Хенаро-Кодина Хенераль-Энрике-Эстрада Генерал-Франсиско-Мургия Генерал-Панфило-Натера Гуадалупе Уануско Хальпа Херес-де-Гарсия-Салинас Хименес-дель-Теуль Хуан-Альдама Хучипила Лорето Луис-Мойя Масапиль Мельчор-Окампо Мескиталь-дель-Оро Мигель-Ауса Момах Монте-Эскобедо Морелос Мойяуа-де-Эстрада Ночистлан-де-Мехия Нория-де-Анхелес Охокальенте Пануко Пинос Рио-Гранде Санта-Мария-де-ла-Пас Саин-Альто Сомбререте Сустикакан Табаско Тепечитлан Тепетонго Теуль-де-Гонсалес-Ортега Тлальтенанго-де-Санчес-Роман Транкосо Тринидад-Гарсия-де-ла-Кадена Вальпараисо Ветагранде Вилья-де-Кос Вилья-Гарсия Вилья-Гонсалес-Ортега Вилья-Идальго Вильянуэва Сакатекас 
dataset/Dataset/data/936097/table_1|2|71|муниципалитет|Аипе (Aipe) Альхесирас (Algeciras) Барайя (Baraya) Кампоалегре (Campoalegre) Коломбия (Colombia) Обо (Hobo) Икира (Íquira) Нейва (Neiva) Палермо (Palermo) Ривера (Rivera) Санта-Мария (Santa María) Тельо (Tello) Теруэль (Teruel) Вильявьеха (Villavieja) Ягуара (Yaguará) Альтамира (Altamira) Аградо (Agrado) Гарсон (Garzón) Хиганте (Gigante) Питаль (Pital) Гуадалупе (Guadalupe) Тарки (Tarqui) Суаса (Suaza) Ла-Архентина (La Argentina) Ла-Плата (La Plata) Натага (Nátaga) Пайколь (Paicol) Тесалия (Tesalia) Асеведо (Acevedo) Элиас (Elías) Иснос (Isnos) Опорапа (Oporapa) Палестина (Palestina) Питалито (Pitalito) Саладобланко (Saladoblanco) Сан-Агустин (San Agustín) Тимана (Timaná) 
dataset/Dataset/data/3705003/table_0|8|71|муниципалитет|19 (5/10) 31 (2/8) Город 36 (1/21) 15 (1/10) 26 (4/13) 29 (1/15) 16 (3/8) 29 (5/10) 14 (2/5) 20 (4/7) 15 (3/5) 36 (3/9) 287 (34/121) 
dataset/Dataset/data/935284/table_0|2|71|муниципалитет|Айяпель (Ayapel) Буэнависта (Buenavista) Каналете (Canalete) Керете (Cereté) Чима (Chimá) Чину (Chinú) Сьенага-де-Оро (Ciénaga de Oro) Которра (Cotorra) Ла-Апартада (La Apartada) Лос-Кордовас (Los Córdobas) Момиль (Momil) Моньитос (Moñitos) Монтелибано (Montelíbano) Монтерия (Montería) Планета-Рика (Planeta Rica) Пуэбла-Нуэво (Pueblo Nuevo) Пуэрто-Эскондидо (Puerto Escondido) Пуэрто-Либертадор (Puerto Libertador) Пурисима (Purísima) Сахагун (Sahagún) Сан-Андрес-де-Сотавенто (San Andrés de Sotavento) Сан-Антеро (San Antero) Сан-Бернардо-дель-Вьенто (San Bernardo del Viento) Сан-Карлос (San Carlos) Сан-Хосе-де-Уре (San José de Uré) Сан-Пелайо (San Pelayo) Санта-Крус-де-Лорика (Santa Cruz de Lorica) Тьерральта (Tierralta) Тучин (Tuchín) Валенсия (Valencia) 
dataset/Dataset/data/5071317/table_1|2|71|муниципалитет|Alfonso Amadeo Bacoor Carmona Dasmariñas General Emilio Aguinaldo General Mariano Alvarez General Trias Imus Indang Kawit Magallanes Maragondon Mendez Naic Noveleta Rosario Silang Tanza Ternate 
dataset/Dataset/data/6707918/table_1|6|71|муниципалитет|Айис Торсхавнар Клаксвуйкар Клаксивуйкар Сёрвагс Вагс Мидвоагс Квивуйкар Торсхавнар Вестманна Сунда Видарайис Сумбиар Сёрвагс Гёту Гёту Рунавикар Хусавуйкар Хваннасундс Джаар Сёвар Торсхавнар Торсхавнар Хвальбиар Хвальвуйкар Хваннасундс Квивуйкар Торсхавнар Клаксвуйкар Торсхавнар Сёвар Хестс Кунойар Рунавуйкар Рунавуйкар Хальдарсвуйкар Лейрвуйкар Квивуйкар Айис Сумбиар Мидвоагс Микладальс Сёрвагс Сёвар Хваннасундс Нес Вагс Хвальвуйк Торсхавнар Хваннасундс Клаксвуйкар Торсхавнар Эстур Сунда Хваннасундс Рунавуйкар Сунда Торсхавнар Сунда Поркерис Рунавуйкар Рунавикар Саксунар Рунавикар Нес Сандавоагс Сандс Хвальбиар Айис Свуйнойар Сёвар Рунавуйкар Сёрвоагс Торсхавнар Хуса Торсхавнар Гёту Рунавуйкар Скалавуйкар Рунавуйкар Куной Квивуйкар Хусавуйкар Скопунар Скувойар Квивуйкар Скувойар Хвальвуйкар Сёвар Клаксивуйкар Сумбиар Торсхавнар Хальдасвуйкар Нес Торсхавнар Твёройрар Микладальс Твёройрар Фамьинс Твёройрар Фуглафьардар Эльдувуйкар Фуннингс Сунда Кунойар Фуглойар Фуглафьардар Хестур Ховс Торсхавнар Хосвуйкар Хуса Хусавуйкар Фуглойар Торсхавнар Рунавуйкар Сумбиар Рунавуйкар Эльдувуйкар Твёройрар Твёройрар 
dataset/Dataset/data/291251/table_0|2|71|муниципалитет|(Amealco de Bonfil) (Pinal de Amoles) (Arroyo Seco) (Cadereyta de Montes) (Colón) (Corregidora) (Ezequiel Montes) (Huimilpan) (Jalpan de Serra) (Landa de Matamoros) (El Marqués) (Pedro Escobedo) (Peñamiller) (Querétaro) (San Joaquín) (San Juan del Río) (Tequisquiapan) (Tolimán) 
dataset/Dataset/data/2961414/table_0|2|71|муниципалитет|(Ensenada) (Mexicali) (Tecate) (Tijuana) (Playas de Rosarito) 
dataset/Dataset/data/767278/table_0|1|71|муниципалитет|Акахете Акатено Акатлан-де-Осорио Акацинго Актеопан Ауакатлан Ауатлан Ауасотепек Ауэуэтитла Ахальпан Альбино-Сертуче Альхохука Альтепехи Амистлан Амосос Акистла Атемпан Атескаль Атлекисайян Атлиско Атоятемпан Ацала Ацициуакан Ацицинтла Ахутла Айотоско-де-Герреро Кальпан Кальтепек Камокуаутла Каньяда-Морелос Кахуакан Чальчикомула-де-Сесма Чапулько Chiautla Чиауцинго Чичикила Чиконкуаутла Чьетла Чигмекатитлан Чигнауапан Чигнаутла Чила Чила-де-ла-Саль Чильчотла Чинантла Коатепек Коацинго Коецала Коуекан Коронанго Кохкатлан Койомеапан Койотепек Куапиахтла-де-Мадеро Куаутемпан Куаутинчан Куаутлансинго Куайука-де-Андраде Куэцалан-дель-Прогресо Куйоако Доминго-Аренас Элосочитлан Эпатлан Эсперанса Франсиско З. Мена Генерал Фелипе Анхелес Гуадалупе Гуадалупе-Виктория Ерменегильдо-Галеана Оней Уакечула Уатлатлаука Уаучинанго Уеуетла Уэуэтлан-эль-Чико Уеуетлан-эль-Гранде Уэхоцинго Уейапан Уейтамалько Уейтлальпан Уицилан-де-Сердан Уицильтепек Искамильпа-де-Герреро Искакихтла Истакамаститлан Истепек Исукар-де-Матаморос Хальпан Холальпан Хонотла Хопала Хуан К. Бонилья Хуан-Галиндо Хуан Н. Мендес Лафрагуа Либрес Ла-Магдалена-Тлатлаукитепек Лос-Рейес-де-Хуарес Масапильтепек-де-Хуарес Мистла Молькахас Наупан Наусонтла Неальтикан Николас-Браво Нопалукан Окотепек Окойукан Олинтла Орьенталь Пауатлан Пальмар-де-Браво Пантепек Петлальсинго Пиастла Пуэбла-де-Сарагоса Кечолак Кимистлан Рафаэль-Лара-Грахалес Сан-Андрес-Чолула Сан-Антонио-Каньядо Сан-Диего-Ла-Меса-Точимильцинго Сан-Фелипе-Теотлальсинго Сан-Фелипе-Тепатлан Сан-Габриель-Чилак Сан-Грегорио-Ацомпа Сан-Херонимо-Текуанипан Сан-Херонимо-Хайякатлан Сан-Хосе-Чиапа Сан-Хосе-Миауатлан Сан-Хуан-Атенко Сан-Хуан-Ацомпа Сан-Мартин-Тесмелукан Сан-Мартин-Тотольтепек Сан-Матиас-Тлаланкалека Сан-Мигель-Ихитлан Сан-Мигель-Хохтла Сан-Николас-де-Буенос-Аирес Сан-Николас-де-лос-Ранчос Сан-Пабло-Аникано Сан-Педро-Чолула Сан-Педро-Елоихтлауакан Сан-Салвадор-эль-Сесо Сан-Салвадор-эль-Верде Сан-Салвадор-Уихколотла Сан-Себастиан-Тлакотепек Санта-Катарина-Тлальтемпан Санта-Инес-Ауатемпан Санта-Исабель-Чолула Сантьяго-Миауатлан Санто-Томас-Уейотлипан Сольтепек Текали-де-Эррера Текамачалько Текоматлан Теуакан Теуицинго Тенампулько Теопантлан Теотлалько Тепанко-де-Лопес Тепанго-де-Родригес Тепатлахко-де-Идальго Тепеака Тепемахалько Тепеохума Тепецинтла Тепеско Тепехи-де-Родригес Тепейяуалько Тепейяуалько-де-Куаутемок Тетела-де-Окампо Тетелес-де-Авила-Кастильо Тесьютлан Тлангисманалько Тилапа Тлачичука Тлакотепек-де-Бенито-Хуарес Тлакилотепек Тлауапан Тлальтенанго Тланепантла Тлаола Тлапакойя Тлапанала Тлатлаукитепек Тласко Точимилько Точтепек Тотольтепек-де-Герреро Тульсинго Тусамапан-де-Галеана Цикатлакойян Венустиано-Карранса Висенте-Герреро Хайякатлан-де-Враво Хикотепек Хикотлан Хьютетелько Хочьяпулько Хочильтепек Хочитлан-де-Висенте-Суарес Хочитлан-Тодос-Сантос Яонауак Еуальтепек Сакапала Сакапоастла Сакатлан Сапотитлан Сапотитлан-де-Мендес Сарагоса Саутла Сиуатеутла Синакатепек Сонгосотла Сокьяпан Сокитлан 
dataset/Dataset/data/5497110/table_0|0|71|муниципалитет|Антониу-Праду Бенту-Гонсалвис Карлус-Барбоза Кашиас-ду-Сул Фарропилья Флорис-да-Кунья Гарибалди Ипе Монти-Белу-ду-Сул Нова-Падуа Пинту-Бандейра Санта-Тереза Сан-Маркус всего 
dataset/Dataset/data/228922/table_0|0|71|муниципалитет|Халкида Дирфис-Месапия Эретрия Истиея-Эдипсос Каристос Кими-Аливерион Мандудион-Лимни Скирос 
dataset/Dataset/data/732452/table_0|2|71|муниципалитет|(Ahualulco) (Alaquines) (Aquismón) (Armadillo de los Infante) (Axtla de Terrazas) (Cárdenas) (Catorce) (Cedral) (Cerritos) (Cerro de San Pedro) (Charcas) (Ciudad del Maíz) (Ciudad Fernández) (Ciudad Valles) (Coxcatlán) (Ebano) (El Naranjo) (Guadalcázar) (Huehuetlán) (Lagunillas) (Matehuala) (Matlapa) (Mexquitic de Carmona) (Moctezuma) (Rayón) (Rioverde) (Salinas de Hidalgo) (San Antonio) (San Ciro de Acosta) (San Luis Potosí) (San Martín Chalchicuautla) (San Nicolás Tolentino) (Santa Catarina) (Santa María Acapulco) (Santo Domingo) (San Vicente Tancuayalab) (Soledad de Graciano Sánchez) (Tamasopo) (Tamazunchale) (Tampacan) (Tampamolón Corona) (Tamuín) (Tancanhuitz de Santos) (Tanlajás) (Tanquián de Escobedo) (Tierra Nueva) (Vanegas) (Venado) (Villa de Arista) (Villa de Arriaga) (Villa de Guadalupe) (Villa de La Paz) (Villa de Ramos) (Villa de Reyes) (Villa de Hidalgo) (Villa Juárez) (Xilitla) (Villa de Zaragoza) 
dataset/Dataset/data/936128/table_1|2|71|муниципалитет|Эль-Кастильо (El Castillo) Эль-Дорадо (El Dorado) Фуэнте-де-Оро (Fuente de Oro) Гранада (Granada) Ла-Макарена (La Macarena) Ла-Урибе (La Uribe) Леханияс (Lejanías) Мапирипан (Mapiripán) Месетас (Mesetas) Пуэрто-Конкордия (Puerto Concordia) Пуэрто-Льерас (Puerto Lleras) Пуэрто-Рико (Puerto Rico) Сан-Хуан-де-Арама (San Juan de Arama) Виста-Ермоса (Vista Hermosa) Акасиас (Acacías) Барранка-де-Упия (Barranca de Upía) Гуамаль (Guamal) Кастилья-ла-Нуэва (Castilla La Nueva) Кубарраль (Cubarral) Кумараль (Cumaral) Эль-Кальварио (El Calvario) Рестрепо (Restrepo) Сан-Карлос-де-Гуароа (San Carlos de Guaroa) Сан-Хуанито (San Juanito) Сан-Мартин (San Martín) Пуэрто-Гаитан (Puerto Gaitán) Кабуйяро (Cabuyaro) Пуэрто-Лопес (Puerto López) Вильявисенсьо (Villavicencio) 
