table_id|column_id|label_id|label|column_data
dataset/Dataset/data/8580786/table_0|3|75|национальность|Канада Германия Великобритания Великобритания Великобритания Великобритания Россия Австралия Швеция Австралия Великобритания Австралия Австралия Австралия США Бразилия Австралия Франция Франция Германия Бразилия 
dataset/Dataset/data/8769719/table_0|0|75|национальность|армяне греки украинцы и русские болгары молдаване евреи, цыгане, поляки, турки 
dataset/Dataset/data/8769719/table_1|0|75|национальность|украинцы русские болгары молдаване другие 
dataset/Dataset/data/8831142/table_0|0|75|национальность|русские якуты эвенки татары украинцы эвены другие 
dataset/Dataset/data/8833782/table_0|4|75|национальность|США Россия Великобритания Великобритания США США США 
dataset/Dataset/data/8834285/table_4|1|75|национальность|Россия Россия Либерия Россия Россия Россия Россия Россия Сенегал Россия Россия Всего 
dataset/Dataset/data/8869189/table_12|1|75|национальность|Россия Россия Россия Всего 
dataset/Dataset/data/887265/table_1|0|75|национальность|Якуты Русские Эвенки Украинцы Эвены Татары 
dataset/Dataset/data/8874132/table_6|1|75|национальность|Россия Россия Россия Россия Россия Россия Россия Россия 
dataset/Dataset/data/8967545/table_0|0|75|национальность|Литовцы Поляки Русские Белорусы Украинцы Евреи Татары Латыши Армяне Другие Не указана 
dataset/Dataset/data/92490/table_4|0|75|национальность|Всё население Армяне Русские Езиды Украинцы Персы Греки Грузины Ассирийцы Белорусы Курды Другие Не указавшие 
dataset/Dataset/data/986537/table_0|2|75|национальность|Швеция Норвегия Швейцария Швейцария Швеция 
