table_id|column_id|label_id|label|column_data
dataset/Dataset/data/5869499/table_3|2|72|награда|Премия «Империя» за лучший дебют Премия общества кинокритиков Феникса лучшему молодому актёру Премия общества кинокритиков Лас-Вегаса лучшему молодому киноактёру Премия «Спутник» самому талантливому актёру Премия «Молодой актёр» за лучший актёрский ансамбль Премия Лондонского кружка кинокритиков (новый талант) Премия MTV Movie Awards за прорыв года Премия «Сатурн» лучшему молодому актёру или актрисе Премия Гильдии киноактёров США за лучшую мужскую роль второго плана Премия Гильдии киноактёров США за лучший актёрский состав в игровом кино Премия «Молодой актёр» лучшему ведущему молодому актёру в художественном фильме Премия Ассоциации кинокритиков Юты за лучшую мужскую роль Премия Critics’ Choice Movie Awards лучшему молодому актёру Премия Critics’ Choice Movie Awards лучшему молодому актёру Премия Общества кинокритиков Финикса лучшему молодому актёру Премия «Сатурн» лучшему молодому актёру или актрисе Премия «Молодой актёр» лучшему ведущему молодому актёру в художественном фильме Премия Critics’ Choice Movie Awards лучшему молодому актёру Премия «Молодой актёр» за лучшее исполнение в международном художественном фильме Премия Critics’ Choice Movie Awards лучшему молодому актёру Премия «Молодой актёр» лучшему ведущему молодому актёру в художественном фильме Capri Exploit Award Премия «Сатурн» лучшему молодому актёру или актрисе Премия «Сатурн» лучшему молодому актёру или актрисе Премия «Молодой актёр» лучшему ведущему молодому актёру в художественном фильме Премия «Молодой актёр» за лучшее озвучивание Премия «Спутник» за лучшую мужскую роль в драматическом сериале Премия «Сатурн» лучшему телеактёру Премия «People’s Choice Award» любимому телевизионному антигерою Премия «Gold Derby Award» за лучший прорыв года Премия Critics’ Choice Movie Awards за лучшую мужскую роль в драматическом сериале Премия Critics’ Choice Movie Awards за лучшую мужскую роль в драматическом сериале Премия «Gold Derby Award» за лучшую мужскую роль в драматическом сериале Премия People’s Choice Award любимому телеактёру Премия «Fangoria Chainsaw Award» лучшему телеактёру Премия «Сатурн» лучшему телеактёру Премия «Золотой глобус» за лучшую мужскую роль в телевизионном сериале — драма 
dataset/Dataset/data/5869555/table_1|1|72|награда|Победитель проекта «Звезда танцпола» на канале MTV Лучший танцор России по мнению канала ТНТ 
dataset/Dataset/data/5894330/table_1|0|72|награда|66-я церемония премии «Эмми» 66-я церемония премии «Эмми» 66-я церемония премии «Эмми» 66-я церемония премии «Эмми» 66-я церемония премии «Эмми» 66-я творческая церемония «Эмми» 66-я творческая церемония «Эмми» 66-я творческая церемония «Эмми» 66-я творческая церемония «Эмми» 66-я творческая церемония «Эмми» 66-я творческая церемония «Эмми» 66-я творческая церемония «Эмми» 72-я церемония «Золотого глобуса» 72-я церемония «Золотого глобуса» 72-я церемония «Золотого глобуса» 72-я церемония «Золотого глобуса» Премия TCA Премия TCA Премия TCA Премия TCA Выбор телевизионных критиков Выбор телевизионных критиков Спутник Спутник Спутник Премия Гильдии киноактёров США Премия Гильдии киноактёров США Премия Гильдии сценаристов США Премия Гильдии сценаристов США Премия Гильдии режиссёров США Премия Гильдии менеджеров локаций США 
dataset/Dataset/data/589676/table_1|1|72|награда|Critics’ Choice Movie Awards Сатурн Young Artist Awards Young Artist Awards Young Artist Awards Young Artist Awards Young Artist Awards 
dataset/Dataset/data/5897053/table_0|0|72|награда|CMA Awards ACM Awards Грэмми Грэмми 
dataset/Dataset/data/5900663/table_0|2|72|награда|Венецианский кинофестиваль 1946 года — премия международного жюри критиков за лучший анимационный фильм 8-й Венецианский кинофестиваль, 1948 — Победитель в номинации International Award — Animated Film BAFTA Awards, 1958 — Номинация в категории Лучший анимационный фильм; Венецианский кинофестиваль, 1952 год — Победитель в номинациях FIPRESCI Prize и Special Jury Prize, номинация в категории — Золотой лев за режиссуру Chicago International Film Festival, 1983 — Номинация на Золотого Хьюго; Prix Louis Delluc, 1979 
dataset/Dataset/data/5901921/table_4|6|72|награда|— MVP (1999) DPOY (1999) MVP (2003) MVP (1997—1998) MVP финала (1997—2000) DPOY (2005—2006) ROY (2002) MVP (2001, 2004) MVP финала (2001—2002) MVP ASG (1999, 2001—2002) DPOY (2004) MVP (2000, 2002, 2005) MVP ASG (2005) DPOY (2000, 2002—2003) — KPSA (1999, 2006) MVP ASG (2000) 
dataset/Dataset/data/5916919/table_2|1|72|награда|Песня Года Беларуси Песня Года Беларуси Песня Года Беларуси Песня Года Беларуси Песня Года Беларуси Песня Года Беларуси Песня Года Беларуси Песня Года Беларуси Лучший исполнитель года 
dataset/Dataset/data/5916920/table_2|1|72|награда|Песня Года Беларуси Песня Года Беларуси Песня Года Беларуси Песня Года Беларуси Песня Года Беларуси Песня Года Беларуси Песня Года Беларуси Песня Года Беларуси Лучший исполнитель года 
dataset/Dataset/data/5916990/table_1|1|72|награда|MTV Movie Awards 
dataset/Dataset/data/5926570/table_0|2|72|награда|Collaborative Single of the Year Collaborative Video of the Year Song of the Year (Songwriters Award) Musical Event of the Year Music Video of the Year Single of the Year Video of the Year Single Record of the Year Vocal Event of the Year Publisher of the Year Country Awards Top 50 Songs Collaborative Video of the Year Video of the Year Country Song of the Year Best Country Duo/Group Performance International Video of the Year 
dataset/Dataset/data/5933559/table_0|2|72|награда|Video of the Year Song of the Year Publisher of the Year Music Video of the Year Female Video of the Year Video of the Year Favourite Song Favorite Country Song Choice Love Song[en] International Work of the Year Favourite International Video[en] Award-Winning Songs Song of the Year 
dataset/Dataset/data/5938712/table_2|0|72|награда|Оскар Золотой глобус Эмми Эмми Золотая малина 
dataset/Dataset/data/5939514/table_1|1|72|награда|Тони Драма Деск Прайм-таймовая премия «Эмми» Джемини Прайм-таймовая премия «Эмми» Дневная премия «Эмми» 
dataset/Dataset/data/5940398/table_5|1|72|награда|National Television Awardsruen The British Soap Awardsruen The British Soap Awardsruen Премия Лоренса Оливье Империя MTV Movie Awards 
dataset/Dataset/data/5963394/table_0|1|72|награда|«Coty American Fashion Critics award» «National Cotton Council award» «National Cotton Council award» «Gold Coast Fashion award» «Menswear award» «Hall of Fame award» «National Cotton Council award» «Print Council award» «Martha award» «Ayres Look award» «Gentlemen’s Quarterly Manstyle award» «Council of Fashion Designers of America award» 
dataset/Dataset/data/5965856/table_1|1|72|награда|Gold Derby TV Award Дневная премия «Эмми» 
dataset/Dataset/data/5966200/table_2|0|72|награда|Спутник Сатурн Сатурн Сатурн Сатурн Сатурн Сатурн Сатурн 
dataset/Dataset/data/5966207/table_1|0|72|награда|Оскар Золотой глобус Золотой глобус Эмми Золотая малина 
dataset/Dataset/data/5966277/table_1|0|72|награда|Молодой актёр Молодой актёр Молодой актёр 
dataset/Dataset/data/5966329/table_1|1|72|награда|Премия «Готэм» Прайм-тайм премия «Эмми» Прайм-тайм премия «Эмми» Прайм-тайм премия «Эмми» Прайм-тайм премия «Эмми» Американская комедийная премия Прайм-тайм премия «Эмми» Премия «Готэм» Премия союза женщин-критиков Премия канала «MTV» Прайм-тайм премия «Эмми» Прайм-тайм премия «Эмми» Премия «Выбор критиков» Прайм-тайм премия «Эмми» Прайм-тайм премия «Эмми» Прайм-тайм премия «Эмми» Прайм-тайм премия «Эмми» Прайм-тайм премия «Эмми» Прайм-тайм премия «Эмми» Прайм-тайм премия «Эмми» Премия Ассоциации телевизионных критиков Премия «Золотой глобус» Премия «Выбор телевизионных критиков» Премия «Спутник» Премия Гильдии продюсеров США Премия Гильдии режиссёров Америки Премия Гильдии сценаристов США Премия Гильдии сценаристов США Премия Гильдии сценаристов США Премия Гильдии киноактёров США Премия Гильдии киноактёров США Премия «Выбор телевизионных критиков» Премия Гильдии продюсеров США Премия Гильдии режиссёров Америки Премия Гильдии сценаристов США Премия Гильдии киноактёров США Премия Гильдии киноактёров США Премия «Золотой глобус» 
dataset/Dataset/data/5966366/table_0|1|72|награда|Дневная премия «Эмми» Дневная премия «Эмми» People’s Choice Awards Дневная премия «Эмми» Дневная премия «Эмми» Дневная премия «Эмми» Дневная премия «Эмми» Дневная премия «Эмми» Дневная премия «Эмми» 
dataset/Dataset/data/5966759/table_4|1|72|награда|Teen Choice Awards Poptastic Awards J-14’s Teen Icon Awards J-14’s Teen Icon Awards JaNEWary Awards (Disney Channel) Nickelodeon Kids' Choice Awards Common Sense Media Awards Young Artist Awards PopCrush Awards PopCrush Awards Billboard's Hottest Music Stars Under 21 Vevo's 25 Under 25 — 2012’s Must-Hear Young Artists 
dataset/Dataset/data/5966923/table_0|1|72|награда|Прайм-таймовая премия «Эмми» Online Film & Television Association Award Blockbuster Entertainment Award The Streamy Awards Hoboken International Film Festival Behind the Voice Actors Awards 
dataset/Dataset/data/5967109/table_1|1|72|награда|ALMA Awards Imagen Award 
dataset/Dataset/data/5967262/table_1|0|72|награда|Оскар Оскар Оскар Оскар Оскар Оскар BAFTA BAFTA BAFTA BAFTA Золотой глобус Золотой глобус Золотой глобус Золотой глобус Золотой глобус Золотой глобус Золотой глобус Эмми Эмми Эмми Премия Гильдии киноактёров США Премия Гильдии киноактёров США Премия Гильдии киноактёров США 
dataset/Dataset/data/5967419/table_1|1|72|награда|Teen Choice Awards 
dataset/Dataset/data/5967461/table_1|0|72|награда|«Оскар» «Оскар» «Золотой глобус» «Золотой глобус» «Золотой глобус» «Золотой глобус» «Золотой глобус» «Золотой глобус» BAFTA BAFTA «Эмми» «Эмми» «Спутник» «Спутник» «Спутник» «Спутник» Премия Гильдии киноактёров США Премия Гильдии киноактёров США Премия Гильдии киноактёров США Премия Гильдии киноактёров США Teen Choice Awards Teen Choice Awards Teen Choice Awards Teen Choice Awards Teen Choice Awards Teen Choice Awards Teen Choice Awards Teen Choice Awards Teen Choice Awards Teen Choice Awards Teen Choice Awards Teen Choice Awards Teen Choice Awards Teen Choice Awards Teen Choice Awards Teen Choice Awards Teen Choice Awards Teen Choice Awards «Молодой актёр» «Молодой актёр» «Молодой актёр» 
dataset/Dataset/data/5967518/table_1|0|72|награда|Золотой глобус Золотой глобус Золотой глобус Золотой глобус Эмми Эмми Эмми Эмми Премия Гильдии киноактёров США Премия Гильдии киноактёров США Премия Гильдии киноактёров США Спутник Спутник Золотая малина 
dataset/Dataset/data/5967670/table_1|0|72|награда|Золотой глобус Золотой глобус Эмми Премия Гильдии киноактёров США Премия Гильдии киноактёров США Премия Гильдии киноактёров США Спутник Спутник Спутник Сатурн Золотая малина Золотая малина Золотая малина Золотая малина 
dataset/Dataset/data/5967786/table_2|1|72|награда|Спутник Премия Гильдии киноактёров США Young Artist Awards Премия гильдии киноактёров США Young Artist Awards Young Artist Awards Премия гильдии киноактёров США Young Artist Awards Young Artist Awards Young Hollywood Awards Young Artist Awards Премия гильдии киноактёров США Young Artist Awards Young Artist Awards Women in Film Crystal + Lucy Awards Young Hollywood Awards Online Film & Television Association Online Film & Television Association Online Film & Television Association Gold Derby Awards Behind the Voice Actors Awards Behind the Voice Actors Awards Премия Гильдии киноактёров США 
dataset/Dataset/data/5967881/table_1|1|72|награда|YoungStar Award Saturn Award Special Achievement Award ALMA Award Золотой глобус TV Guide Award TV Guide Award Teen Choice Award Young Artist Award ALMA Award Saturn Award Blimp Award Teen Choice Award DVD Exclusive Awards Teen Choice Award Teen Choice Award Teen Choice Award Teen Choice Award Young Hollywood Award Teen Choice Award ALMA Award Выбор телевизионных критиков Saturn Award MTV Movie Award MTV Movie Award MTV Movie Award Imagen Award Blimp Award Teen Choice Award Золотая малина TV Land Award Spike Guys' Choice Awards Teen Choice Award Teen Choice Award Blimp Award Выбор народа Выбор народа Золотая малина Золотая малина Teen Choice Award ALMA Award Золотая малина ALMA Award Золотая малина Blimp Award 
dataset/Dataset/data/5968429/table_1|1|72|награда|Золотой глобус Эмми Il Gato Золотой глобус Бэмби Голливудское общество телевидения и радио Дайджест мыльных опер Дайджест мыльных опер Дайджест мыльных опер Дайджест мыльных опер TV Land Award 
dataset/Dataset/data/5968488/table_0|1|72|награда|Премия Гильдии киноактёров США Премия Гильдии киноактёров США Премия Гильдии киноактёров США TV Land Awards Спутник Спутник Премия Гильдии киноактёров США Премия Гильдии киноактёров США Премия Гильдии киноактёров США 
dataset/Dataset/data/5968493/table_1|0|72|награда|Спутник MTV Movie & TV Awards Teen Choice Awards People’s Choice Awards 
dataset/Dataset/data/5968600/table_1|1|72|награда|BAFTA Тони Тони Тони Тони Тони Эмми Эмми 
dataset/Dataset/data/5969113/table_2|1|72|награда|Imagen Award ALMA TV Guide Award Сатурн Teen Choice Awards ALMA NHMC Impact Award Teen Choice Awards Teen Choice Awards 
dataset/Dataset/data/597554/table_0|2|72|награда|Медаль «В защиту Конституции» Медаль Победы в Франко-тайской войне Медаль Чакра Мала Медаль Победы в Великой войне в Восточной Азии Рыцарь Большой ленты Рыцарь Большого креста Рыцарь-командор Командор Офицер Рыцарь Медаль «За защиту свободных граждан» 1 класса Рыцарь Большой ленты Рыцарь Большого креста Рыцарь-командор Командор Офицер Рыцарь Рыцарь Большого креста ордена Чула Чом Клао Медаль Раттанапорна Рамы IX 1 класса Рыцарь ордена Девяти камней Рыцарь ордена Рамкирати Великий Рыцарь-командор ордена Рамы Рыцарь Большого креста ордена Дирекгунабхорна Медаль Раттанапорна Рамы X 1 класса 
dataset/Dataset/data/597554/table_0|3|72|награда|Медаль «В защиту Конституции» Медаль Победы в Франко-тайской войне Медаль Чакра Мала Медаль Победы в Великой войне в Восточной Азии ордена Короны Таиланда ордена Короны Таиланда ордена Короны Таиланда ордена Короны Таиланда ордена Короны Таиланда ордена Короны Таиланда Медаль «За защиту свободных граждан» 1 класса ордена Белого слона ордена Белого слона ордена Белого слона ордена Белого слона ордена Белого слона ордена Белого слона Рыцарь Большого креста ордена Чула Чом Клао Медаль Раттанапорна Рамы IX 1 класса Рыцарь ордена Девяти камней Рыцарь ордена Рамкирати Великий Рыцарь-командор ордена Рамы Рыцарь Большого креста ордена Дирекгунабхорна Медаль Раттанапорна Рамы X 1 класса 
dataset/Dataset/data/5987779/table_0|0|72|награда|«Оскар» «Оскар» «Оскар» «Оскар» «Оскар» «Оскар» «Золотой глобус» «Золотой глобус» «Золотой глобус» «Золотой глобус» BAFTA BAFTA BAFTA BAFTA BAFTA BAFTA BAFTA «Сатурн» «Сатурн» Премия Гильдии режиссёров США Премия Гильдии режиссёров США Премия Гильдии режиссёров США Премия Гильдии режиссёров США Премия Гильдии сценаристов США Премия Гильдии сценаристов США 
dataset/Dataset/data/6004096/table_0|1|72|награда|Премия Американской ассоциации монтажёров Премия Гильдии режиссёров Америки Золотой глобус Золотой глобус Золотой глобус Премия «Спутник» Премия «Спутник» Премия «Спутник» Премия «Спутник» Премия Гильдии киноактёров США Премия Гильдии киноактёров США Премия Гильдии сценаристов США Выбор телевизионных критиков Выбор телевизионных критиков Выбор телевизионных критиков Выбор телевизионных критиков Выбор телевизионных критиков TCA Awards Прайм-таймовая премия «Эмми» Прайм-таймовая премия «Эмми» Прайм-таймовая премия «Эмми» Прайм-таймовая премия «Эмми» Прайм-таймовая премия «Эмми» Прайм-таймовая премия «Эмми» Прайм-таймовая премия «Эмми» Прайм-таймовая премия «Эмми» Прайм-таймовая премия «Эмми» Прайм-таймовая премия «Эмми» Прайм-таймовая премия «Эмми» Прайм-таймовая премия «Эмми» Прайм-таймовая премия «Эмми» 
dataset/Dataset/data/6004127/table_0|1|72|награда|Премия Американской ассоциации монтажёров Премия Гильдии режиссёров Америки Золотой глобус Золотой глобус Золотой глобус Премия «Спутник» Премия «Спутник» Премия «Спутник» Премия «Спутник» Премия Гильдии киноактёров США Премия Гильдии киноактёров США Премия Гильдии сценаристов США Выбор телевизионных критиков Выбор телевизионных критиков Выбор телевизионных критиков Выбор телевизионных критиков Выбор телевизионных критиков TCA Awards Прайм-таймовая премия «Эмми» Прайм-таймовая премия «Эмми» Прайм-таймовая премия «Эмми» Прайм-таймовая премия «Эмми» Прайм-таймовая премия «Эмми» Прайм-таймовая премия «Эмми» Прайм-таймовая премия «Эмми» Прайм-таймовая премия «Эмми» Прайм-таймовая премия «Эмми» Прайм-таймовая премия «Эмми» Прайм-таймовая премия «Эмми» Прайм-таймовая премия «Эмми» Прайм-таймовая премия «Эмми» 
