table_id|column_id|label_id|label|column_data
dataset/Dataset/data/125354/table_14|1|75|национальность|США США Великобритания США Лихтенштейн США Великобритания 
dataset/Dataset/data/125354/table_16|1|75|национальность|США Канада США США США Австрия США Франция Мексика США США Швейцария Великобритания США Бразилия США Великобритания США Великобритания Австрия США Германия Италия Великобритания Великобритания США США Великобритания США Мексика Мексика ЮАР Франция Аргентина Италия Великобритания Великобритания Швеция Финляндия Германия Бразилия США Нидерланды США США США Швейцария США США Великобритания США 
dataset/Dataset/data/125354/table_27|1|75|национальность|Германия Венгрия Италия Финляндия Австралия Италия Франция Италия Франция Германия Швеция Венесуэла Великобритания Австрия Нидерланды Индонезия Германия Венесуэла Франция Мексика Бельгия Италия Нидерланды Великобритания Бразилия Великобритания Индия Россия Великобритания Австрия Испания Япония Финляндия Польша Дания Канада Бельгия Монако Италия Швейцария Италия Великобритания Испания Швейцария Франция Япония Япония Бразилия Израиль Великобритания Франция Великобритания Франция Франция Франция Бразилия Великобритания Великобритания Австралия Испания США Мексика Бразилия Россия США Германия Италия Канада Нидерланды Германия Гонконг Малайзия Нидерланды Испания Чехия Китай Германия Индия Великобритания Япония Швейцария 
dataset/Dataset/data/125354/table_3|1|75|национальность|Германия Италия Швейцария Бельгия США Австрия Германия Франция Италия Испания Канада Канада Канада Германия Германия Германия Швеция Канада Швейцария Швейцария США Нидерланды Австрия 
dataset/Dataset/data/1255342/table_0|0|75|национальность|болгары турки греки цыгане евреи армяне другие 
dataset/Dataset/data/128307/table_23|1|75|национальность|Франция Португалия Бельгия США Аргентина ЮАР ЮАР США США Швейцария Новая Зеландия Австралия Швейцария Швейцария США Монако Франция Франция Германия Великобритания США Германия Германия Германия Австрия Германия Германия Австралия США 
dataset/Dataset/data/128307/table_6|1|75|национальность|Франция Франция Бельгия Испания Франция 
dataset/Dataset/data/128307/table_7|1|75|национальность|Германия Германия Швейцария Бразилия Швейцария 
dataset/Dataset/data/1294872/table_0|0|75|национальность|украинцы русские поляки белорусы другие национальности 
dataset/Dataset/data/1317549/table_12|3|75|национальность|КНР КНР КНР КНР КНР КНР 
dataset/Dataset/data/133623/table_0|0|75|национальность|молдаване украинцы русские гагаузы болгары румыны евреи поляки цыгане остальные Всего 
dataset/Dataset/data/139532/table_1|1|75|национальность|Украинцы Русские Белорусы Армяне Всего 
dataset/Dataset/data/1398197/table_1|0|75|национальность|Русские Карачаевцы Черкесы Абазины Ногайцы Украинцы Осетины Татары Греки Всего 
dataset/Dataset/data/1425640/table_0|0|75|национальность|русские (великороссы) русские (малороссы) карачаевцы, горские татары абазины и абхазы кабардинцы ногайцы немцы черкесы и адыгейцы другие Итого: 
dataset/Dataset/data/1427719/table_0|0|75|национальность|русские украинцы немцы другие Итого: 
dataset/Dataset/data/143633/table_1|0|75|национальность|Всё население Армяне Русские Украинцы Другие и не указавшие 
dataset/Dataset/data/147112/table_0|0|75|национальность|Всё население Армяне Русские Езиды Греки Грузины Украинцы Другие и не указавшие 
dataset/Dataset/data/155574/table_0|0|75|национальность|указали русские крымские татары украинцы татары белорусы армяне греки узбеки азербайджанцы молдаване поляки чуваши немцы болгары мордва корейцы цыгане турки таджики евреи грузины арабы другие не указали всего 
dataset/Dataset/data/160556/table_1|1|75|национальность|Украинцы Русские Венгры Немцы Цыгане Белорусы Словаки другие Всего 
dataset/Dataset/data/1673649/table_0|0|75|национальность|русские эвенки якуты украинцы эвены другие 
dataset/Dataset/data/1677281/table_0|0|75|национальность|болгары сербы югославы цыгане македонцы черногорцы хорваты словенцы горанцы бошняки русские не определились Всего 
dataset/Dataset/data/1803946/table_0|0|75|национальность|якуты русские украинцы эвенки татары эвены другие 
dataset/Dataset/data/1903110/table_0|0|75|национальность|Всё население Армяне Русские Курды Езиды Украинцы Другие и не указавшие 
dataset/Dataset/data/19100/table_1|0|75|национальность|Чуваши Русские Татары Украинцы Марийцы Мордва 
dataset/Dataset/data/2064425/table_0|0|75|национальность|Чеченцы Русские Кумыки Ногайцы Аварцы Другие Всего 
dataset/Dataset/data/20703/table_11|1|75|национальность|Родезия Италия США Франция США Португалия Нидерланды Германия США Италия Бразилия США Италия Аргентина Аргентина США Австрия Франция Франция США Бельгия ЮАР США Франция Нидерланды Италия Великобритания США Франция Великобритания США США Италия Италия Колумбия Бельгия Великобритания Германия Нидерланды Франция Франция Великобритания Великобритания Италия Франция Бельгия Марокко Франция 
dataset/Dataset/data/20703/table_15|1|75|национальность|Италия Родезия Великобритания США США Италия Великобритания Великобритания Швеция Франция Италия Италия Великобритания Великобритания Великобритания США Италия Бразилия Италия США Италия Австралия Швейцария Франция Германия Швеция Россия Аргентина Канада Франция Франция Бразилия Бразилия Бельгия Бельгия Италия Франция Италия США ЮАР Германия Бразилия Франция Нидерланды Испания США Франция Бельгия Великобритания США ЮАР Италия Франция Великобритания Великобритания Италия Великобритания 
dataset/Dataset/data/20703/table_21|1|75|национальность|Германия Нидерланды Германия Финляндия США США Германия США Великобритания Родезия Великобритания Великобритания США Новая Зеландия США Индонезия Япония Япония США США США Германия Великобритания Великобритания Великобритания США Германия Германия Великобритания Великобритания США Швейцария США Великобритания Испания США Австралия США США США США Япония Великобритания Бразилия Новая Зеландия Великобритания Великобритания Великобритания США США Германия 
dataset/Dataset/data/20703/table_5|1|75|национальность|Франция Великобритания США США Германия Аргентина Великобритания США Швейцария Испания Франция Италия США США Великобритания США Великобритания Италия США Италия Италия Австралия США США Великобритания США ЮАР США Италия Италия Италия США Великобритания Бразилия США Франция Ирландия США Бразилия Нидерланды США Бельгия ЮАР Венесуэла США США Италия Великобритания США Великобритания США Ирландия 
dataset/Dataset/data/207165/table_0|1|75|национальность|итого: 
dataset/Dataset/data/207165/table_0|0|75|национальность|русские немцы украинцы татары белорусы армяне казахи болгары итого: 
dataset/Dataset/data/20839/table_13|1|75|национальность|США США Япония Япония Япония Великобритания Италия Италия Бразилия Италия Бельгия Дания Германия Великобритания Новая Зеландия Швеция ЮАР Япония США Великобритания США 
dataset/Dataset/data/2096134/table_0|0|75|национальность|эвенки якуты русские эвены украинцы другие 
dataset/Dataset/data/2115452/table_0|0|75|национальность|Русские 
dataset/Dataset/data/2128161/table_0|0|75|национальность|якуты эвены русские эвенки украинцы юкагиры другие 
dataset/Dataset/data/2172750/table_0|0|75|национальность|Всё население Армяне Русские Греки Курды Другие 
dataset/Dataset/data/2535809/table_1|0|75|национальность|Русские Латыши Белорусы Поляки Украинцы Всего 
dataset/Dataset/data/2564609/table_0|0|75|национальность|указали русские украинцы белорусы татары армяне молдаване крымские татары азербайджанцы другие не указали всего 
dataset/Dataset/data/2606612/table_0|0|75|национальность|Чуваши Русские 
dataset/Dataset/data/265092/table_0|0|75|национальность|Русские Адыги Армяне Украинцы Татары Корейцы Цыгане Азербайджанцы Греки Белорусы Табасараны Черкесы Таджики Лезгины 
dataset/Dataset/data/273465/table_7|2|75|национальность|США Канада Финляндия США Канада Канада Канада Швеция Швейцария Россия Германия Финляндия США Швейцария Словакия Канада Канада Россия США Финляндия Швеция Канада Канада Швейцария США Канада США США Финляндия Канада Словения Канада 
dataset/Dataset/data/2789064/table_0|0|75|национальность|русские немцы украинцы цыгане армяне татары белорусы азербайджанцы итого: 
dataset/Dataset/data/2789102/table_0|0|75|национальность|русские немцы украинцы белорусы армяне татары азербайджанцы молдаване 
dataset/Dataset/data/2789135/table_0|0|75|национальность|русские немцы украинцы мордва армяне чуваши белорусы татары итого: 
dataset/Dataset/data/2789135/table_0|1|75|национальность|итого: 
dataset/Dataset/data/2789167/table_0|0|75|национальность|русские немцы украинцы белорусы татары армяне цыгане чеченцы итого: 
dataset/Dataset/data/2789167/table_0|1|75|национальность|итого: 
dataset/Dataset/data/2866543/table_0|0|75|национальность|Латыши в том числе латгальцы Русские Белорусы Украинцы Поляки Литовцы Другие всего 
dataset/Dataset/data/2870093/table_0|0|75|национальность|Латыши Русские Белорусы Украинцы Поляки Литовцы Другие всего 
dataset/Dataset/data/2872205/table_0|0|75|национальность|Латыши Русские Белорусы Украинцы Поляки Литовцы Другие всего 
dataset/Dataset/data/2873921/table_0|0|75|национальность|Латыши Русские Белорусы Украинцы Поляки Литовцы Другие всего 
dataset/Dataset/data/2883268/table_0|0|75|национальность|Латыши в том числе латгальцы Русские Белорусы Поляки Украинцы Литовцы Другие всего 
dataset/Dataset/data/2890881/table_0|0|75|национальность|Латыши Русские Белорусы Украинцы Поляки Литовцы Другие всего 
dataset/Dataset/data/3011440/table_11|1|75|национальность|Австрия Китай Китай Германия 
dataset/Dataset/data/3014632/table_1|3|75|национальность|белорус белорус поляк белорус белорус белорус немец русский белорус белорус белорус русский белорус белорус русский белорус русский белорус белорус белорус русский белорус еврей русский белорус белорус белорус белорус белорус русский белорус белорус белорус белорус белорус белорус белорус белорус русский белорус белорус белорус русский белорус белорус русский белорус белорус белорус белорус белорус белорус русский белорус белорус еврей русский еврей еврей белорус русский еврей белорус русский белорус белорус белорус белорус белорус белорус белорус еврей белорус белорус белорус белорус белорус белорус еврей еврей еврей белорус белорус еврей белорус белорус белорус белорус украинец белорус белорус белорус русский белорус белорус еврей белорус белорус белорус русский еврей еврей русский белорус белорус белорус белорус еврей белорус русский белорус белорус белорус белорус белорус белорус белорус белорус белорус белорус белорус белорус белорус белорус белорус белорус белорус белорус русский белорус белорус белорус белорус белорус белорус еврей белорус белорус белорус белорус белорус белорус белорус белорус белорус белорус белорус белоруска белорус еврей белорус белорус русский белорус белорус белорус белорус белорус белорус белорус белорус белорус белорус белорус белорус белорус еврей белорус белорус белорус белорус белорус белорус белорус белорус еврей белорус белорус белорус белорус белорус белорус белорус белорус русский белорус белорус белорус белорус белорус белорус белорус белорус белорус белорус белорус белорус русский белорус русский русский белорус белорус русский белорус белорус белорус украинец русский белорус белорус белорус белорус белорус белорус русский белорус русский еврей белорус белорус лытыш белорус белорус белорус белорус русский белорус белорус белорус белорус белорус белорус белорус белорус русский русский русский белорус белорус русский белорус белорус белорус белорус белорус русский белорус русский белорус белоруска белорус белорус русский белорус еврей белорус белоруска белорус белоруска русский белорус украинец белорус белорус белорус белорус белорус белорус белорус белорус белорус белорус белорус белорус русский белорус белорус русский белорус русский белорус белорус белорус белорус белорус белорус русский белорус белорус белорус русский белорус белорус белорус русский белорус белорус русский белорус белорус белоруска белорус белорус белорус белорус белорус белорус белорус русский белорус белорус белорус белорус русский белорус белорус белорус белорус белорус русский белорус белорус русский латыш белорус белорус белорус белорус белорус белорус белорус белорус белорус белорус белорус белорус русский белорус белорус белорус белорус белорус белорус русский поляк белорус белорус белорус белорус белорус белорус белорус белорус белорус белорус белорус еврей белорус русский белорус белорус еврей белорус белорус белорус русская белорус русский русский белорус русский белорус белорус белорус белорус русский белорус белорус русский белорус белорус белорус белорус белорус белорус белорус белорус белорус белоруска белорус русская русский белорус белорус белорус белорус белорус русский русский русский еврей белорус белорус белорус белорус белоруска русский белорус белорус белорус белорус русский белорус белорус белорус белорус белорус белорус белорус белорус белорус белорус белорус белорус белорус русский белорус белорус украинец белорус белорус белорус русский русский белорус белорус белорус белорус белорус русский белорус белорус белорус белорус белорус русский белорус белорус 
dataset/Dataset/data/3218363/table_8|1|75|национальность|Франция Франция Франция Франция 
dataset/Dataset/data/3218363/table_9|1|75|национальность|Гвинея Бразилия Сенегал Республика Конго Франция 
dataset/Dataset/data/3418493/table_0|0|75|национальность|Казахи Немцы Русские Татары Украинцы Прочие нации Итого по району 
dataset/Dataset/data/3418575/table_0|1|75|национальность|итого: 
dataset/Dataset/data/3418575/table_0|0|75|национальность|русские немцы украинцы армяне белорусы азербайджанцы татары алтайцы итого: 
dataset/Dataset/data/3432718/table_0|0|75|национальность|Русские Украинцы Армяне Адыгейцы Татары Белорусы Мордва Немцы 
dataset/Dataset/data/3448551/table_0|0|75|национальность|указали русские украинцы крымские татары татары цыгане белорусы молдаване армяне узбеки корейцы другие не указали всего 
dataset/Dataset/data/34620/table_0|0|75|национальность|Чуваши Русские Марийцы 
dataset/Dataset/data/35197/table_1|0|75|национальность|указали русские украинцы татары крымские татары белорусы азербайджанцы корейцы армяне молдаване турки другие не указали всего 
dataset/Dataset/data/354328/table_0|0|75|национальность|указали русские украинцы белорусы татары армяне узбеки чуваши молдаване грузины крымские татары мордва болгары осетины другие не указали всего 
dataset/Dataset/data/356784/table_0|0|75|национальность|Казахи Немцы Русские Татары Украинцы Прочие нации Итого по району 
dataset/Dataset/data/358653/table_0|0|75|национальность|Казахи Немцы Русские Татары Украинцы Прочие нации Итого по району 
dataset/Dataset/data/36276/table_0|0|75|национальность|Чуваши Русские 
dataset/Dataset/data/3682255/table_1|2|75|национальность|Туцзя и Мяо Лаху, Ва, Буланы и Дайцы Мяо, И и Гэлао Дун, Яо, Мяо 
dataset/Dataset/data/3698450/table_0|1|75|национальность|— другие итого: 
dataset/Dataset/data/3698450/table_0|0|75|национальность|казахи русские киргизы татары узбеки немцы чеченцы уйгуры украинцы корейцы турки греки дунгане азербайджанцы белорусы таджики курды другие итого: 
