table_id|column_id|label_id|label|column_data
dataset/Dataset/data/7433757/table_1|0|72|награда|Почётное звание «Гвардейская» Почётное наименование «Львовский» Орден Красного Знамени Орден Богдана Хмельницкого II степени 
dataset/Dataset/data/7435968/table_0|0|72|награда|Орден Красного Знамени 
dataset/Dataset/data/7451724/table_0|1|72|награда|NightMoves Award AVN Award AVN Award Spank Bank Award Spank Bank Award Spank Bank Award Spank Bank Technical Award XBIZ Award AVN Award AVN Award Spank Bank Award Spank Bank Award Spank Bank Award Spank Bank Award Spank Bank Award Spank Bank Award AVN Award Spank Bank Award Spank Bank Award Spank Bank Award Spank Bank Award Spank Bank Award Spank Bank Award Spank Bank Award Spank Bank Technical Award 
dataset/Dataset/data/7452277/table_1|0|72|награда|Мисс Конгениальность 
dataset/Dataset/data/7466734/table_1|1|72|награда|Драма Деск Тони Награда Лиги Драмы Lucille Lortel Award Грэмми Daytime Emmy Award 
dataset/Dataset/data/7469959/table_5|1|72|награда|Kids' Choice Awards Аргентина Kids' Choice Awards Колумбия Kids' Choice Awards Аргентина Kids' Choice Awards Аргентина Kids' Choice Awards Колумбия Tú Awards Tú Awards Kids' Choice Awards Мексика 
dataset/Dataset/data/748772/table_1|2|72|награда|Кавалер Большого креста ордена Изабеллы Католической Кавалер ордена Дружбы 1 степени Кавалер цепи ордена Гражданских заслуг Кавалер ордена Первого президента Туркмении Сапармурата Туркменбаши Великого Кавалер ордена Золотого орла Почётный рыцарь Большого креста ордена Бани Кавалер ордена Звезды Палестины Кавалер ордена князя Ярослава Мудрого 1 степени 
dataset/Dataset/data/748772/table_1|3|72|награда|Кавалер Большого креста ордена Изабеллы Католической Кавалер ордена Дружбы 1 степени Кавалер цепи ордена Гражданских заслуг Кавалер ордена Первого президента Туркмении Сапармурата Туркменбаши Великого Кавалер ордена Золотого орла Почётный рыцарь Большого креста ордена Бани Кавалер ордена Звезды Палестины Кавалер ордена князя Ярослава Мудрого 1 степени 
dataset/Dataset/data/7495324/table_0|1|72|награда|CMT Music Awards Academy of Country Music Awards iHeartRadio Music Awards Country Music Association Awards iHeartRadio Music Awards iHeartRadio Music Awards CMT Music Awards CMT Music Awards Grammy Awards Academy of Country Music Awards 
dataset/Dataset/data/7499524/table_0|1|72|награда|Золотой граммофон (Москва, Санкт-Петербург) 20 лучших песен Песня года Золотой граммофон (Москва, Санкт-Петербург) Премия Piter FM Шансон года Песня года Золотой граммофон (Москва, Санкт-Петербург) Премия Piter FM Премия Муз-ТВ Шансон года Песня года Золотой граммофон (Москва, Санкт-Петербург) Шансон года Золотой граммофон (Санкт-Петербург) Шансон года Золотой граммофон (Санкт-Петербург) Шансон года Шансон года Реальная премия MusicBox Российская национальная музыкальная премия Звезды дорожного радио Реальная премия MusicBox 
dataset/Dataset/data/7528121/table_3|1|72|награда|KBS Drama Awards KBS Drama Awards Baeksang Arts Awards KBS Drama Awards KBS Drama Awards MBC Drama Awards Asia Model Awards KBS Drama Awards KBS Drama Awards Asia Model Awards Style Icon Awards Korea Drama Awards APAN Star Awards SBS Drama Awards Korea Drama Awards Korea Drama Awards Asia Model Awards Korean Cable TV Awards Paeksang Arts Awards APAN Star Awards Korea Drama Awards Asia Artist Awards 
dataset/Dataset/data/7530379/table_0|1|72|награда|GameSpot Best of E3 2012 Editors' Choice Awards The Daily Telegraphʼs E3 2012: Best in show The Electric Playgroundʼs Best of E3 Winners Electronic Gaming Monthly Presents: The Best of E3 2012 Electronic Gaming Monthly Presents: The Best of E3 2012 Destructoid's Best of E3 2012 Destructoid's Best of E3 2012 Destructoid's Best of E3 2012 Destructoid's Best of E3 2012 PlayStation Universe’s E3 2012 Awards PlayStation Universe’s E3 2012 Awards PlayStation Universe’s E3 2012 Awards Cheat Code Central’s The Best of E3 2012 Cheat Code Central’s The Best of E3 2012 Game Critics Awards: Best of E3 2012 Game Critics Awards: Best of E3 2012 Game Critics Awards: Best of E3 2012 Game Critics Awards: Best of E3 2012 Game Critics Awards: Best of E3 2012 2012 Spike Video Game Awards 4th Annual Inside Gaming Awards Games 2014 Games of the Year and Other Awards 31st Golden Joystick Awards 31st Golden Joystick Awards 31st Golden Joystick Awards 31st Golden Joystick Awards 31st Golden Joystick Awards 31st Golden Joystick Awards International Business Timesʼ Five Best Video Games of 2013 Good Game Awards 2013 Good Game Awards 2013 Timeʼs Top 10 Video Games of 2013 5th Annual Inside Gaming Awards 5th Annual Inside Gaming Awards 5th Annual Inside Gaming Awards 5th Annual Inside Gaming Awards 5th Annual Inside Gaming Awards 5th Annual Inside Gaming Awards Cheat Code Central’s 7th Annual Cody Awards Cheat Code Central’s 7th Annual Cody Awards Cheat Code Central’s 7th Annual Cody Awards Cheat Code Central’s 7th Annual Cody Awards Cheat Code Central’s 7th Annual Cody Awards Cheat Code Central’s 7th Annual Cody Awards Cheat Code Central’s 7th Annual Cody Awards Cheat Code Central’s 7th Annual Cody Awards Spike VGX 2013 Spike VGX 2013 Spike VGX 2013 Spike VGX 2013 Spike VGX 2013 Spike VGX 2013 Slant Magazineʼs 25 Best Video Games of 2013 Daily Mirrorʼs Top games of 2013 GameSpot's Game of the Year 2013 Awards GameSpot's Game of the Year 2013 Awards Canada.com’s Top video games of 2013 Forbesʼs Best Video Game Shooters of 2013 Game Revolution's Best of 2013 Awards Game Revolution's Best of 2013 Awards Game Revolution's Best of 2013 Awards CNET's 15 best video games of 2013 The New Zealand Herald’s 2013 in review Digital Spy's best games of 2013 Entertainment Weeklyʼs Top 10 Videogames of 2013 The Guardianʼs Top 25 video games of 2013 Wiredʼs Top 10 Best Videogames of 2013 IGN Australia’s Top 12 Games of 2013 Hardcore Gamerʼs Game of the Year Awards 2013 Hardcore Gamerʼs Game of the Year Awards 2013 Hardcore Gamerʼs Game of the Year Awards 2013 Hardcore Gamerʼs Game of the Year Awards 2013 Hardcore Gamerʼs Game of the Year Awards 2013 Hardcore Gamerʼs Game of the Year Awards 2013 Hardcore Gamerʼs Game of the Year Awards 2013 Hardcore Gamerʼs Game of the Year Awards 2013 Hardcore Gamerʼs Game of the Year Awards 2013 Hardcore Gamerʼs Game of the Year Awards 2013 Hardcore Gamerʼs Game of the Year Awards 2013 Hardcore Gamerʼs Game of the Year Awards 2013 The A.V. Clubʼs Readers' Poll PlayStation Blog Game of the Year Awards Destructoid's Best of 2013 Destructoid's Best of 2013 Destructoid's Best of 2013 Destructoid's Best of 2013 Destructoid's Best of 2013 Destructoid's Best of 2013 Destructoid's Best of 2013 Destructoid's Best of 2013 Giant Bomb's 2013 Game of the Year Awards Giant Bomb's 2013 Game of the Year Awards Giant Bomb's 2013 Game of the Year Awards Giant Bomb's 2013 Game of the Year Awards Giant Bomb's 2013 Game of the Year Awards Ars Technica 20 best video games of 2013 Edge Awards 2013 Edge Awards 2013 Edge Awards 2013 EGMʼs Best of 2013 EGMʼs Best of 2013: Reader’s Choice Kotakuʼs Game of the Year 2013 Kotakuʼs Game of the Year 2013 The Daily Telegraph Video Game Awards 2013 The Daily Telegraph Video Game Awards 2013 The Daily Telegraph Video Game Awards 2013 The Daily Telegraph Video Game Awards 2013 The Daily Telegraph Video Game Awards 2013 The Daily Telegraph Video Game Awards 2013 The Daily Telegraph Video Game Awards 2013 The Daily Telegraph Video Game Awards 2013 The Daily Telegraph Video Game Awards 2013 The Daily Telegraph Video Game Awards 2013 VideoGamer.com Game of the Year 2013 GameSpot People’s Choice Joystiq Top of 2013 GameTrailers Game of the Year Awards 2014 GameTrailers Game of the Year Awards 2014 GameTrailers Game of the Year Awards 2014 GameTrailers Game of the Year Awards 2014 GameTrailers Game of the Year Awards 2014 GameTrailers Game of the Year Awards 2014 Game Informer Best of 2013 Awards Game Informer Best of 2013 Awards Game Informer Best of 2013 Awards Game Informer Readers' Choice Best of 2013 Awards Game Informer Readers' Choice Best of 2013 Awards Game Informer Readers' Choice Best of 2013 Awards Fourth Annual Metacritic User Poll IGN's Best of 2013 IGN's Best of 2013 IGN's Best of 2013 IGN's Best of 2013 IGN's Best of 2013 IGN's Best of 2013 IGN's Best of 2013 IGN's Best of 2013 IGN's Best of 2013 IGN's Best of 2013 IGN's Best of 2013 IGN's Best of 2013 IGN's Best of 2013 VG247 Community Games of the Year The Escapist Awards 2013 The Escapist Awards 2013 The Escapist Awards 2013 Polygonʼs Games of the Year 2013 GamesRadar's Game of the year 2013 41st Annie Awards 66th Writers Guild of America Awards 17th Annual DICE Awards 17th Annual DICE Awards 17th Annual DICE Awards 17th Annual DICE Awards 17th Annual DICE Awards 17th Annual DICE Awards 17th Annual DICE Awards 17th Annual DICE Awards 17th Annual DICE Awards 17th Annual DICE Awards 17th Annual DICE Awards 17th Annual DICE Awards 17th Annual DICE Awards 13th Annual National Academy of Video Game Trade Reviewers Awards 13th Annual National Academy of Video Game Trade Reviewers Awards 13th Annual National Academy of Video Game Trade Reviewers Awards 13th Annual National Academy of Video Game Trade Reviewers Awards 13th Annual National Academy of Video Game Trade Reviewers Awards 13th Annual National Academy of Video Game Trade Reviewers Awards 13th Annual National Academy of Video Game Trade Reviewers Awards 13th Annual National Academy of Video Game Trade Reviewers Awards 13th Annual National Academy of Video Game Trade Reviewers Awards 13th Annual National Academy of Video Game Trade Reviewers Awards 13th Annual National Academy of Video Game Trade Reviewers Awards 13th Annual National Academy of Video Game Trade Reviewers Awards 13th Annual National Academy of Video Game Trade Reviewers Awards 13th Annual National Academy of Video Game Trade Reviewers Awards 13th Annual National Academy of Video Game Trade Reviewers Awards 13th Annual National Academy of Video Game Trade Reviewers Awards 13th Annual National Academy of Video Game Trade Reviewers Awards 2014 SXSW Gaming Awards 2014 SXSW Gaming Awards 2014 SXSW Gaming Awards 2014 SXSW Gaming Awards 2014 SXSW Gaming Awards 2014 SXSW Gaming Awards 2014 SXSW Gaming Awards 10th British Academy Video Games Awards 10th British Academy Video Games Awards 10th British Academy Video Games Awards 10th British Academy Video Games Awards 10th British Academy Video Games Awards 10th British Academy Video Games Awards 10th British Academy Video Games Awards 10th British Academy Video Games Awards 10th British Academy Video Games Awards 10th British Academy Video Games Awards 14th Annual Game Developers Choice Awards 14th Annual Game Developers Choice Awards 14th Annual Game Developers Choice Awards 14th Annual Game Developers Choice Awards 14th Annual Game Developers Choice Awards 2014 Golden Joystick Awards 2014 Golden Joystick Awards The Game Awards 2014 The Game Awards 2014 GameSpot's Game of the Year 2014 Awards GameSpot's Game of the Year 2014 Awards Hardcore Gamerʼs Game of the Year 2014 Awards Hardcore Gamerʼs Game of the Year 2014 Awards Hardcore Gamerʼs Game of the Year 2014 Awards 67th Writers Guild of America Awards IGN AU Black Beta Select Awards 2014 IGN AU Black Beta Select Awards 2014 PlayStation Official Magazine — UK Hall of Fame 15th Annual Game Developers Choice Awards 11th British Academy Video Games Awards 11th British Academy Video Games Awards 2015 SXSW Gaming Awards 2015 SXSW Gaming Awards 2015 SXSW Gaming Awards 
dataset/Dataset/data/7533216/table_0|1|72|награда|BMI London Awards BMI Pop Awards Teen Choice Awards 
dataset/Dataset/data/7533788/table_0|1|72|награда|AVN Award AVN Award AVN Award Spank Bank Award Spank Bank Award Spank Bank Award Spank Bank Award Spank Bank Award Spank Bank Technical Award Spank Bank Award Spank Bank Award Spank Bank Award Spank Bank Award Spank Bank Award Spank Bank Technical Award AVN Award AVN Award Spank Bank Award Spank Bank Award Spank Bank Award Spank Bank Award Spank Bank Award Spank Bank Award 
dataset/Dataset/data/7546141/table_3|2|72|награда|Music Video of the Year 
dataset/Dataset/data/7551526/table_0|2|72|награда|Award Vocal Duo of the Year Top New Vocal Duo or Group of the Year Vocal Duo of the Year Album of the Year Single Record of the Year Song of the Year Vocal Duo of the Year Album of the Year Top Vocal Duo Entertainer of the Year Entertainer of the Year Top Vocal Duo Song of the Year Album of the Year Single Record of the Year Entertainer of the Year Top Vocal Duo Song of the Year Album of the Year Single Record of the Year Video of the Year Vocal Duo or Group of the Year Entertainer of the Year Entertainer of the Year Top Vocal Duo or Group Song of the Year Vocal Event of the Year Top Vocal Duo or Group Top Vocal Duo Entertainer of the Year Entertainer of the Year Video of the Year Top Vocal Duo Album of the Year Single Record of the Year Song of the Year Top Vocal Duo Entertainer of the Year Home Depot Humanitarian Award Top Vocal Duo Entertainer of the Year Single Record of the Year Song of the Year Album of the Year Top Vocal Duo Entertainer of the Year Top Vocal Duo Song of the Year Entertainer of the Year Single Record of the Year Video of the Year Top Vocal Duo Home Depot Humanitarian Award Vocal Event of the Year Entertainer of the Year Album of the Year Video of the Year Top Vocal Duo Top Vocal Duo Vocal Event of the Year Top Vocal Duo Vocal Event of the Year Milestone Award 
dataset/Dataset/data/7570312/table_0|0|72|награда|ЖАРА Music Awards Новое Радио Awards Премия Муз-ТВ Премия Муз-ТВ Реальная премия MusicBox Реальная премия MusicBox Российская национальная музыкальная премия «Виктория» Российская национальная музыкальная премия «Виктория» Culture Music Awards Culture Music Awards Culture Music Awards Culture Music Awards Glamour M1 Music Awards M1 Music Awards M1 Music Awards M1 Music Awards MTV Europe Music Awards YUNA YUNA YUNA YUNA YUNA YUNA YUNA YUNA YUNA YUNA ZD Awards ZD Awards ZD Awards ZD Awards ZD Awards ZD Awards ZD Awards ZD Awards 
dataset/Dataset/data/7589986/table_0|1|72|награда|AVN Award Inked Award AVN Award Spank Bank Award Spank Bank Award XBIZ Award XBIZ Award 
dataset/Dataset/data/75904/table_0|3|72|награда|Кавалер Большого креста ордена Христа Кавалер Большой цепи ордена Инфанта дона Энрике 
dataset/Dataset/data/75904/table_0|2|72|награда|Кавалер Большого креста ордена Христа Кавалер Большой цепи ордена Инфанта дона Энрике 
dataset/Dataset/data/7590683/table_56|2|72|награда|Favorite Female Musical Performer Favorite Combined Forces 
dataset/Dataset/data/7621690/table_0|0|72|награда|Academy Awards Золотой глобус Grammy Awards Grammy Awards Grammy Awards Grammy Awards Georgia Film Critics Association Gold Derby Awards Guild of Music Supervisors Awards Guild of Music Supervisors Awards Hollywood Music in Media Awards Houston Film Critics Society Los Angeles Online Film Critics Society Satellite Awards British Academy Film Awards Critics' Choice Movie Awards St. Louis Film Critics Association 
dataset/Dataset/data/7634677/table_1|0|72|награда|Почётное звание «Гвардейская» Почётное наименование «Шепетовская» Почётное наименование «Васильковская» Орден Ленина Орден Красного Знамени Орден Суворова II степени Орден Кутузова II степени 
dataset/Dataset/data/764797/table_2|0|72|награда|Приз принца Уэльского:(чемпион Конференции Принца Уэльского) Приз Кларенса Кэмпбелла:(чемпион Конференции Кларенса Кэмпбелла) Арт Росс Трофи:(наибольшее количество очков в регулярном чемпионате) Билл Мастертон Трофи:(за спортивное мастерство и преданность хоккею) Колдер Трофи:(лучший новичок НХЛ) Конн Смайт Трофи:(самый ценный игрок плей-офф) Фрэнк Дж. Селки Трофи:(лучший нападающий оборонительного плана) Харт Трофи:(самый ценный игрок регулярного чемпионата) Джек Адамс Авард:(лучший тренер НХЛ) Джеймс Норрис Трофи:(лучший защитник НХЛ) Леди Бинг Трофи:(за мастерство и джентльменское поведение на льду) Лестер Пирсон Авард:(самый ценный игрок по мнению профсоюза хоккеистов) Везина Трофи:(лучший вратарь НХЛ) Приз Лестера Патрика:(за выдающиеся заслуги и вклад в развитие хоккея в США) 
dataset/Dataset/data/764797/table_2|1|72|награда|Монреаль Канадиенс Нью-Йорк Айлендерс Брайан Тротье, Нью-Йорк Айлендерс Серж Савар, Монреаль Канадиенс Бобби Смит, Миннесота Норт Старз Боб Гейни, Монреаль Канадиенс Боб Гейни, Монреаль Канадиенс Брайан Тротье, Нью-Йорк Айлендерс Эл Эрбур, Нью-Йорк Айлендерс Дени Потвен, Нью-Йорк Айлендерс Боб Макмиллан, Атланта Флэймз Марсель Дион, Лос-Анджелес Кингз Кен Драйден и Мишель Ларок, Монреаль Канадиенс Бобби Орр 
dataset/Dataset/data/7654303/table_1|1|72|награда|Дневная премия «Эмми» Дневная премия «Эмми» 
dataset/Dataset/data/7656979/table_0|1|72|награда|AVN Award XBIZ Europa Award XBIZ Europa Award 
dataset/Dataset/data/7658273/table_1|0|72|награда|Почётное звание «Гвардейская» Почётное наименование «Белоцерковская» Почётное наименование «Берлинская» Орден Ленина Орден Красного Знамени Орден Суворова II степени Орден Кутузова II степени 
dataset/Dataset/data/7667141/table_2|1|72|награда|Молодой актёр Молодой актёр 
dataset/Dataset/data/7671419/table_0|1|72|награда|AVN Award NightMoves Award Spank Bank Award Spank Bank Award Spank Bank Award Spank Bank Award Spank Bank Award Spank Bank Award Spank Bank Award Spank Bank Technical Award Spank Bank Technical Award XBIZ Award XRCO Award AVN Award AVN Award Spank Bank Award Spank Bank Award Spank Bank Award Spank Bank Award Spank Bank Award Spank Bank Award Spank Bank Award Spank Bank Award Spank Bank Award Spank Bank Award Spank Bank Award Spank Bank Award Spank Bank Award Spank Bank Technical Award 
dataset/Dataset/data/7680928/table_0|2|72|награда|Кавалер Тройного ордена как Президент Португалии Кавалер Большой цепи Гроссмейстер Гроссмейстер Кавалер Большого креста Гроссмейстер ордена Святого Беннета Ависского Гроссмейстер Военного ордена Святого Якова и Меча Гроссмейстер ордена Инфанта дона Энрике Кавалер Большой цепи Гроссмейстер Гроссмейстер ордена Заслуг Гроссмейстер ордена Народного образования Гроссмейстер ордена Предпринимательских заслуг 
dataset/Dataset/data/7680928/table_0|3|72|награда|Кавалер Тройного ордена как Президент Португалии Военного Ордена Башни и Меча, Доблести, Верности и Заслуг Военного Ордена Башни и Меча, Доблести, Верности и Заслуг ордена Христа ордена Христа Гроссмейстер ордена Святого Беннета Ависского Гроссмейстер Военного ордена Святого Якова и Меча Гроссмейстер ордена Инфанта дона Энрике ордена Свободы ордена Свободы Гроссмейстер ордена Заслуг Гроссмейстер ордена Народного образования Гроссмейстер ордена Предпринимательских заслуг 
dataset/Dataset/data/768268/table_2|0|72|награда|Кубок Стэнли: Президентский кубок: Приз принца Уэльского: Приз Кларенса Кэмпбелла: Арт Росс Трофи: Билл Мастертон Трофи: Колдер Трофи: Конн Смайт Трофи: Фрэнк Дж. Селки Трофи: Харт Мемориал Трофи: Джек Адамс Эворд: Джеймс Норрис Трофи: Кинг Клэнси Трофи: Леди Бинг Трофи: Лестер Пирсон Эворд: Морис Ришар Трофи: НХЛ плюс/минус Эворд: Роджер Крозье Эворд: Везина Трофи: Уильям М. Дженнингс Трофи: Лестер Патрик Трофи: 
dataset/Dataset/data/7686316/table_0|0|72|награда|Премия «Artios» Премия Австралийской академии кинематографа и телевидения Премия Австралийской академии кинематографа и телевидения Премия Австралийской академии кинематографа и телевидения Премия Австралийской академии кинематографа и телевидения Премия Австралийской академии кинематографа и телевидения Премия Австралийской академии кинематографа и телевидения Премия Австралийской академии кинематографа и телевидения Международный кинофестиваль «Camerimage» Международный кинофестиваль в Чикаго Премия «Золотой глобус» Премия «Золотой глобус» Премия «Выбор критиков» Голливудские награды за музыку в средствах информации Humanitas Prize Международный кинофестиваль в Милл-Вэлли Международный кинофестиваль в Сан-Диего Премия «Спутник» Премия «Спутник» Премия «Спутник» Премия «Спутник» 
dataset/Dataset/data/7692579/table_2|0|72|награда|13 10 6 4 4 3 3 
dataset/Dataset/data/77204/table_0|3|72|награда|Суверен ордена Великого Бадра Суверен ордена короля Абдель-Азиза ибн Сауда Суверен ордена короля Файсала 
dataset/Dataset/data/77204/table_0|2|72|награда|Суверен ордена Великого Бадра Суверен ордена короля Абдель-Азиза ибн Сауда Суверен ордена короля Файсала 
