table_id|column_id|label_id|label|column_data
dataset/Dataset/data/3419114/table_2|1|72|награда|Венецианский кинофестиваль Национальное общество кинокритиков США Золотой глобус Science fiction magazine Сатурн Blockbuster Entertainment Awards ALMA American Veterans Award Imagen Foundation Awards Золотой глобус GLAAD ALMA 
dataset/Dataset/data/3420941/table_5|1|72|награда|Тренер сезона английской Премьер-лиги Тренер года по версии LMA Игрок месяца АПЛ в декабре Гол месяца в ноябре по версии MOTD и журнала Match Игрок 3-го раунда Кубка Англии Лучшее приобретение сезона по версии тренеров АПЛ Футболист года в Северо-Восточной Англии Член «команды года» Премьер-лиги по версии ПФА Гол сезона по версии MOTD 
dataset/Dataset/data/3422187/table_16|0|72|награда|Игрок года Игрок года по версии игроков Лучший гол года Молодой игрок года Игрок года резервной команды Игрок года Академии Игрок года женской команды Гигант «Эвертона» 
dataset/Dataset/data/3432497/table_0|1|72|награда|Золотой граммофон (Москва, Санкт-Петербург) 20 лучших песен Песня года Золотой граммофон (Москва, Санкт-Петербург) Премия Piter FM Шансон года Песня года Золотой граммофон (Москва, Санкт-Петербург) Премия Piter FM Премия Муз-ТВ Шансон года Песня года Золотой граммофон (Москва, Санкт-Петербург) Шансон года Золотой граммофон (Санкт-Петербург) Шансон года Золотой граммофон (Санкт-Петербург) Шансон года Шансон года Реальная премия MusicBox Российская национальная музыкальная премия Звезды дорожного радио Реальная премия MusicBox 
dataset/Dataset/data/3446175/table_0|1|72|награда|«Стопудовый хит» «Песня года — Россия» «Песня года — Украина» «Бомба года» 
dataset/Dataset/data/3447159/table_0|1|72|награда|AVN Award AVN Award AVN Award 
dataset/Dataset/data/3464631/table_1|1|72|награда|Молодой актёр Молодой актёр 
dataset/Dataset/data/3464632/table_1|1|72|награда|Молодой актёр Молодой актёр 
dataset/Dataset/data/3467361/table_1|1|72|награда|«Grand Jury Award» кинофестиваля «Аутфест» Прайм-тайм премия «Эмми» Премия Гильдии киноактёров США Teen Choice Award Online Film & Television Association Award Online Film & Television Association Award Online Film & Television Association Award Прайм-тайм премия «Эмми» Премия Гильдии киноактёров США Премия Гильдии киноактёров США Премия Гильдии киноактёров США Online Film & Television Association Award Gold Derby Awards Gold Derby Awards Премия Гильдии киноактёров США TV Land Award Спутник Независимый дух Сатурн Women’s Image Network Awards 
dataset/Dataset/data/3470186/table_1|1|72|награда|Спутник Выбор народа Золотой глобус Золотой глобус ADG Excellence in Production Design Award Премия Гильдии сценаристов США Молодой актёр TV Guide Award Выбор телевизионных критиков Выбор телевизионных критиков Выбор телевизионных критиков Выбор телевизионных критиков Teen Choice Award Teen Choice Award Teen Choice Award Teen Choice Award Teen Choice Award Teen Choice Award Teen Choice Award Ассоциация телевизионных критиков Прайм-тайм премия «Эмми» Прайм-тайм премия «Эмми» Прайм-тайм премия «Эмми» Прайм-тайм премия «Эмми» Прайм-тайм премия «Эмми» Выбор народа Выбор народа Золотой глобус Золотой глобус 
dataset/Dataset/data/3471526/table_2|1|72|награда|Teen Choice Awards Teen Choice Awards Молодой актёр Teen Choice Awards Teen Choice Awards Breckenridge Festival of Film San Diego Film Festival NewNowNext Awards Teen Choice Awards Teen Choice Awards People's Choice Awards 
dataset/Dataset/data/3474860/table_0|1|72|награда|AVN Award AVN Award XBIZ Award AVN Award XBIZ Award 
dataset/Dataset/data/3483938/table_0|1|72|награда|The Voice 
dataset/Dataset/data/3484464/table_1|0|72|награда|Золотой глобус Золотой глобус Золотой глобус Золотой глобус Премия Гильдии киноактёров США Премия Гильдии киноактёров США Премия Гильдии киноактёров США BAFTA Сатурн Сатурн ALMA Awards ALMA Awards ALMA Awards ALMA Awards ALMA Awards ALMA Awards ALMA Awards ALMA Awards Kids Choice Awards Kids Choice Awards Kids Choice Awards Kids Choice Awards Kids Choice Awards Kids Choice Awards Kids Choice Awards Kids Choice Awards Kids Choice Awards Kids Choice Awards MTV Movie Awards MTV Movie Awards MTV Movie Awards MTV Movie Awards MTV Movie Awards MTV Movie Awards MTV Movie Awards MTV Movie Awards MTV Movie Awards MTV Movie Awards MTV Movie Awards MTV Movie Awards MTV Movie Awards MTV Movie Awards MTV Movie Awards MTV Movie Awards MTV Movie Awards Mexico Teen Choice Awards Teen Choice Awards Teen Choice Awards Teen Choice Awards Teen Choice Awards Teen Choice Awards Teen Choice Awards Teen Choice Awards Teen Choice Awards Teen Choice Awards Teen Choice Awards Teen Choice Awards Teen Choice Awards Teen Choice Awards Teen Choice Awards Peoples Choice Awards Peoples Choice Awards Peoples Choice Awards Peoples Choice Awards Peoples Choice Awards Золотая малина Золотая малина Золотая малина Золотая малина Золотая малина Золотая малина 
dataset/Dataset/data/3487351/table_1|1|72|награда|Телевизионный фестиваль в Монте-Карло TV Choice Awards 
dataset/Dataset/data/3489946/table_1|3|72|награда|Президентский орден «Сияние» Лента ордена Республики Сербия Орден «Достык» I степени Орден Александра Невского Почётный знак «За укрепление мира и дружбы народов» Орден «Друг Азербайджана» (Редакция журнала «Мой Азербайджан») 
dataset/Dataset/data/3489946/table_1|2|72|награда|Президентский орден «Сияние» Лента ордена Республики Сербия Орден «Достык» I степени Орден Александра Невского Почётный знак «За укрепление мира и дружбы народов» Орден «Друг Азербайджана» (Редакция журнала «Мой Азербайджан») 
dataset/Dataset/data/3492159/table_0|1|72|награда|Всемирная премия фэнтези Bram Stoker Awards Премия Хьюго Bram Stoker Awards 
dataset/Dataset/data/3497375/table_1|1|72|награда|Молодой актёр Молодой актёр Молодой актёр Молодой актёр Молодой актёр Молодой актёр Behind the Voice Actors Awards Behind the Voice Actors Awards Behind the Voice Actors Awards Behind the Voice Actors Awards 
dataset/Dataset/data/3506207/table_0|1|72|награда|Дневная премия «Эмми» Дневная премия «Эмми» 
dataset/Dataset/data/3510449/table_1|2|72|награда|Song of the Year Creative Voice Award 
dataset/Dataset/data/3510449/table_14|2|72|награда|Best International Artist Best International Artist 
dataset/Dataset/data/3510449/table_21|2|72|награда|Alumni Woodie Performing Woodie 
dataset/Dataset/data/3510449/table_34|2|72|награда|Best International Act 
dataset/Dataset/data/3510449/table_35|2|72|награда|USA’s Character Approved Award for Musician 
dataset/Dataset/data/3510449/table_8|2|72|награда|Best International Album of the Year 
dataset/Dataset/data/3525964/table_0|0|72|награда|«Ариете» («овен») 
dataset/Dataset/data/3535336/table_7|2|72|награда|Лучшая песня в видео-игре 
dataset/Dataset/data/3554103/table_0|2|72|награда|Bogart's Battle of the Bands MTV's Favorite Breakthrough Band of 2011 Revolvers 100 Greatest Living Rock Stars 2011 Revolvers 20 Best Albums of 2011 Revolvers Golden God Awards: Best New Band 2011 Revolvers Song of the Year 2011 WGRD’s 2011 Favorite Listener Band of The Year Alternative Press: Band of the Year Award Alternative Press: Drummer of the Year Award Revolvers Golden God Awards: Most Dedicated Fans 2012 Revolvers Golden God Awards: Best Vocalist 2012 Revolvers Golden God Awards: Best Guitarists 2012 Kerrang! Award for Best Album 2012 Kerrang! Award for Best Live Band 2012 Kerrang! Award for Hottest Male 2012 Kerrang! Award for Hottest Male 2012 Kerrang! Award for Best Single 2012 Loudwire Cage Match: Black Veil Brides vs. Halestorm Loudwire Cage Match: Black Veil Brides vs. HIM Loudwire Cage Match: Black Veil Brides vs. Coheed and Cambria Loudwire Cage Match: Black Veil Brides vs. Asking Alexandria Loudwire Cage Match: Black Veil Brides vs. Bullet for My Valentine Revolvers Golden Gods Awards: Song of the Year 2013 Revolvers Golden Gods Awards: Most Dedicated Fans 2013 Relentless Kerrang! Awards 2013: Best live band Alternative Press 2013 Readers Poll: Best Live Band Loudwire Most Dedicated Fans of 2013 Alternative Press: Drummer of the Year Award 
dataset/Dataset/data/3562394/table_1|0|72|награда|Оскар Выбор критиков Независимый дух Премия Гильдии киноактёров США Премия Гильдии киноактёров США Спутник Спутник Международный кинофестиваль в Санта Барбаре Сатурн Сатурн Сатурн 
dataset/Dataset/data/356285/table_0|2|72|награда|Медаль «Астана» Медаль «10 лет независимости Республики Казахстан» Орден «Парасат» Медаль «10 лет Парламенту Республики Казахстан» Медаль «10 лет Астане» Орден искусств и литературы Медаль «20 лет независимости Республики Казахстан» Серебряная медаль Межпарламентской Ассамблеи Содружеств Независимых Государств «МПА СНГ. 20 лет» Медаль НДП «Нур Отан» «Белсенді қызметі үшін» Медаль Конституционного Совета Республики Казахстан «За вклад в укрепление конституционной законности» Медаль «20 лет тенге» Орден «Барыс» II степени Медаль «20 лет Ассамблеи народа Казахстана» Медаль «20 лет Конституции Республики Казахстан» Медаль «25 лет независимости Республики Казахстан» Медаль Межпарламентской Ассамблеи Содружеств Независимых Государств «МПА СНГ. 25 лет» Орден «Содружество» Медаль «20 лет Астане» 
dataset/Dataset/data/356285/table_0|3|72|награда|Медаль «Астана» Медаль «10 лет независимости Республики Казахстан» Орден «Парасат» Медаль «10 лет Парламенту Республики Казахстан» Медаль «10 лет Астане» Орден искусств и литературы Медаль «20 лет независимости Республики Казахстан» Серебряная медаль Межпарламентской Ассамблеи Содружеств Независимых Государств «МПА СНГ. 20 лет» Медаль НДП «Нур Отан» «Белсенді қызметі үшін» Медаль Конституционного Совета Республики Казахстан «За вклад в укрепление конституционной законности» Медаль «20 лет тенге» Орден «Барыс» II степени Медаль «20 лет Ассамблеи народа Казахстана» Медаль «20 лет Конституции Республики Казахстан» Медаль «25 лет независимости Республики Казахстан» Медаль Межпарламентской Ассамблеи Содружеств Независимых Государств «МПА СНГ. 25 лет» Орден «Содружество» Медаль «20 лет Астане» 
dataset/Dataset/data/3580747/table_2|0|72|награда|Орден Красного Знамени 
dataset/Dataset/data/3580762/table_2|0|72|награда|Орден Красного Знамени 
dataset/Dataset/data/3584512/table_0|0|72|награда|Золотой глобус Золотой глобус Золотой глобус Эмми Эмми Эмми Эмми Эмми Эмми Эмми Эмми Эмми Тони Тони Тони Тони 
dataset/Dataset/data/3588217/table_0|1|72|награда|Джемини Джемини 
dataset/Dataset/data/3592381/table_1|2|72|награда|Teen Choice Award Teen Choice Award 
dataset/Dataset/data/3613929/table_0|2|72|награда|Орден короля Абдель-Азиза ибн Сауда 1 класса 
dataset/Dataset/data/3613929/table_0|3|72|награда|Орден короля Абдель-Азиза ибн Сауда 1 класса 
dataset/Dataset/data/3616698/table_2|1|72|награда|Evening Standard Award Премия Лоренса Оливье Тони Драма Деск Премия британского независимого кино Тони 
dataset/Dataset/data/3616733/table_0|0|72|награда|Золотой орёл Золотой орёл ТЭФИ ТЭФИ ТЭФИ народная премия «Телезвезда» (Украина) народная премия «Телезвезда» (Украина) народная премия «Телезвезда» (Украина) 
dataset/Dataset/data/3636436/table_1|1|72|награда|Премия «Спутник» Scream Awards Премия Гильдии киноактёров США Scream Awards Scream Awards Scream Award 
dataset/Dataset/data/3638824/table_1|1|72|награда|Награда Немецкой ассоциации кинокритиков Кинофестиваль им. Макса Офюльса Награда Немецкой ассоциации кинокритиков Награда Немецкой ассоциации кинокритиков Награда Немецкой ассоциации кинокритиков Берлинский кинофестиваль 
dataset/Dataset/data/3641742/table_0|0|72|награда|Gourmand World Cookbook Awards Gourmand World Cookbook Awards Gourmand World Cookbook Awards 
dataset/Dataset/data/3654048/table_1|1|72|награда|Лос-Анджелес среднюю школу Disney Channel New Years Bowl-A-Thon Премия NAACP Молодой актёр Poptastic! Награды Poptastic! Награды Poptastic! Награды Poptastic! Награды Poptastic! Награды Poptastic! Награды Poptastic! Награды Teen Choice Awards 
dataset/Dataset/data/3662803/table_22|2|72|награда|International Female Artist International Newcomer International/National Album of the Year International/National Song of the Year 
dataset/Dataset/data/3662803/table_23|2|72|награда|Outstanding Picture Editing for a Special (Single or Multi-Camera) Outstanding Variety, Music Or Comedy Special 
dataset/Dataset/data/3662803/table_46|2|72|награда|Always Now, Forever Next Award 
dataset/Dataset/data/3662803/table_59|2|72|награда|The Record of the Year The Record of the Year The Record of the Year 
dataset/Dataset/data/3666365/table_2|0|72|награда|Премия Сесиля Б. Де Милля 
dataset/Dataset/data/369401/table_1|0|72|награда|BAFTA TV BAFTA TV Тони 
dataset/Dataset/data/3701525/table_1|2|72|награда|Песня месяца (сентябрь) Выбор тинейджеров Главная премия (Bonsang) 
dataset/Dataset/data/3719835/table_0|2|72|награда|31 28 28 27 26 25 25 25 23 22 22 22 22 20 20 20 20 
dataset/Dataset/data/3722067/table_1|1|72|награда|«Песня года» «Премия Муз-ТВ» «Премия Муз-ТВ» «Премия RU.TV 2012» «Премия RU.TV 2012» «Премия RU.TV 2012» 
dataset/Dataset/data/3728840/table_0|1|72|награда|Фестиваль Сан-Ремо Фестиваль Сан-Ремо Фестиваль Сан-Ремо Wind Music Awards TRL Awards Premio Videoclip Italiano MTV Europe Music Awards Premio Videoclip Italiano Wind Music Awards TRL Awards TRL Awards Lunezia Award 
dataset/Dataset/data/3738873/table_0|1|72|награда|Golden Ear Award (The Absolute Sound) 2000 1. Preis Audio: Goldenes Ohr 2010 (недоступная ссылка) 3. Preis Stereoplay: Leserwahl Stereoplay Highlights 2010 (недоступная ссылка) 
dataset/Dataset/data/3742496/table_3|2|72|награда|MTV Russia Music Awards — Лучший хип-хоп-исполнитель MTV Russia Music Awards — Лучший исполнитель, вышедший из интернет-сети Премия Муз-ТВ 2009 — Лучший хип-хоп проект Russian Street Awards — Альбом года Russian Street Awards — Саундтрек года Премия Муз-ТВ 2010 — Песня года Премия Муз-ТВ 2010 — Лучший хип-хоп проект Премия Муз-ТВ 2010 — Лучший дуэт Премия Муз-ТВ 2010 — Лучший альбом Премия Муз-ТВ 2010 — Лучшее видео Премия RU.TV 2011 — Лучший хип-хоп хит Премия Муз-ТВ 2011 — Лучший хип-хоп проект Премия Муз-ТВ 2011 — Лучший дуэт Russian Urban Music Awards — в культуру Премия Муз-ТВ 2012 — Лучший хип-хоп-проект Журнал GQ: Люди года — Музыкант года Премия RU.TV 2012 — Лучший хип-хоп хит Премия Муз-ТВ 2013 — Лучший хип-хоп-проект MTV Europe Music Awards — Лучший российский исполнитель Премия Муз-ТВ 2014 — Лучший хип-хоп проект Премия RU.TV 2015 — Лучший RnB проект Премия Муз-ТВ 2015 — Лучший хип-хоп проект Российская национальная музыкальная премия — Лучший хип-хоп проект Премия RU.TV 2016 — Лучший саундтрек Премия RU.TV 2016 — Лучший Hip-Hop проект Премия Муз-ТВ 2016 — Лучший хип-хоп проект GQ: Люди года — Музыкант года Премия RU.TV 2017 — Лучший Хип-Хоп проект Премия Муз-ТВ 2017 — Лучший хип-хоп проект Премия Муз-ТВ 2017 — Лучший дуэт Премия Муз-ТВ 2017 — Лучшее видео GQ: Люди года — Музыкант года Пятая Реальная премия MusicBox — Хип-Хоп проект года Пятая Реальная премия MusicBox — Песня года Премия Золотой Граммофон — 2017 Российская национальная музыкальная премия — Лучший хип-хоп проект Российская национальная музыкальная премия — Концерт года 
dataset/Dataset/data/3752542/table_0|1|72|награда|Satellite Awards SAG Awards 
dataset/Dataset/data/375585/table_0|0|72|награда|Колдер ТрофиНовичок года Сборная новичков НХЛ Первая сборная всех звёзд НХЛ Участник Матча всех звёзд НХЛ Вторая сборная всех звёзд НХЛ Морис Ришар ТрофиЛучший снайпер Билл Мастертон ТрофиВысокое спортивное мастерство и верность хоккею Обладатель Кубка Стэнли 
dataset/Dataset/data/3765711/table_0|3|72|награда|«Albums of the Year» «Albums of the Year» «Albums of the Year» «Albums You Must Hear Before You Die» «100 Greatest Rock Albums Ever» «The 500 Greatest Albums of All Time» 1001 Albums You Must Hear Before You Die «The 200 Greatest Albums of the 80s» 
dataset/Dataset/data/3770175/table_0|0|72|награда|Международный кинофестиваль в Монреале 
dataset/Dataset/data/3801981/table_2|3|72|награда|Рыцарь Большого креста ордена Святых Маврикия и Лазаря Рыцарь ордена Святого Януария Рыцарь Большого креста Константиновского ордена Святого Георгия Рыцарь Большого ордена Князя Даниила I 
dataset/Dataset/data/3801981/table_2|2|72|награда|Рыцарь Большого креста ордена Святых Маврикия и Лазаря Рыцарь ордена Святого Януария Рыцарь Большого креста Константиновского ордена Святого Георгия Рыцарь Большого ордена Князя Даниила I 
dataset/Dataset/data/3814572/table_0|0|72|награда|Почетное звание «Гвардейский» Орден Красного Знамени Орден Александра Невского Почётное наименование «Познанский» Орден Кутузова III степени 
dataset/Dataset/data/3818499/table_0|2|72|награда|Лучший актёр второго плана Лучший актёр второго плана Лучший актёр второго плана Лучший актёр Лучший актёр GQ Man Of The Year Award 2008 Лучший актёр Лучший актёр 
dataset/Dataset/data/3831635/table_0|0|72|награда|Молодёжные Президентский кубок (в составе Дрюммонвилль Вольтижерс) Жан Беливо Трофи Вторая сборная всех звёзд QMJHL Лучший показатель плюс/минус в QMJHL Мишель Бриер Мемориал Трофи Майк Босси Трофи Первая сборная всех звёзд QMJHL Фрэнк Дж. Селки Трофи Серебряный призёр Молодёжного чемпионата мира (в составе мол. сборной Канады) Чемпион мира (в составе сборной Канады) 
dataset/Dataset/data/3834698/table_1|3|72|награда|Почётный работник прокуратуры Медаль «За безупречную службу» 1, 2 и 3 степени Нагрудный знак «20 лет прокуратуре Казахстана» Нагрудный знак «15 лет полиции Казахстана» Нагрудный знак «20 лет полиции Казахстана» Нагрудный знак «20 лет Внутренним войскам Казахстана» 
dataset/Dataset/data/3834698/table_1|2|72|награда|Почётный работник прокуратуры Медаль «За безупречную службу» 1, 2 и 3 степени Нагрудный знак «20 лет прокуратуре Казахстана» Нагрудный знак «15 лет полиции Казахстана» Нагрудный знак «20 лет полиции Казахстана» Нагрудный знак «20 лет Внутренним войскам Казахстана» 
