table_id|column_id|label_id|label|column_data
dataset/Dataset/data/3698463/table_0|0|75|национальность|казахи русские курды татары узбеки киргизы украинцы немцы азербайджанцы корейцы чеченцы уйгуры таджики белорусы турки греки другие итого: 
dataset/Dataset/data/3802265/table_0|0|75|национальность|Русские Армяне Цыгане Украинцы Адыгейцы Белорусы Курды Грузины Узбеки Лезгины Татары 
dataset/Dataset/data/3843617/table_1|0|75|национальность|Всего узбеки каракалпаки казахи туркмены русские корейцы татары украинцы башкиры киргизы молдаване белорусы другие 
dataset/Dataset/data/4003121/table_0|0|75|национальность|указали русские крымские татары украинцы татары белорусы цыгане турки мордва корейцы молдаване армяне узбеки поляки болгары другие не указали всего 
dataset/Dataset/data/4046972/table_0|1|75|национальность|Англия Англия Англия Англия Англия Англия Англия Англия Англия Англия Англия Ирландия Норвегия Англия 
dataset/Dataset/data/4183763/table_1|0|75|национальность|Сербы Боснийцы Черногорцы Югославы Хорваты Венгры Македонцы Албанцы Словенцы Буневцы Русские Украинцы Не определившиеся 
dataset/Dataset/data/4270936/table_0|0|75|национальность|Латыши Русские Белорусы Украинцы Поляки Литовцы Другие всего 
dataset/Dataset/data/4354547/table_0|1|75|национальность|Украинцы Русские Белорусы Греки Всего 
dataset/Dataset/data/4537832/table_0|0|75|национальность|Болгария Венгрия Германия Чехословакия Бразилия Чили Аргентина Великобритания Гондурас Тунис Швейцария Япония Итого 
dataset/Dataset/data/4557472/table_0|0|75|национальность|Перу США Италия Колумбия Австралия Испания Всего 
dataset/Dataset/data/4615088/table_5|1|75|национальность|Бразилия Франция Бразилия Уругвай Швеция 
dataset/Dataset/data/477289/table_3|1|75|национальность|Русские Украинцы Белорусы Греки Евреи Татары Армяне Азербайджанцы Грузины Другие Всего 
dataset/Dataset/data/4863109/table_1|2|75|национальность|США США США США США США США США / Венгрия США / Венгрия США США Багамские Острова США США 
dataset/Dataset/data/506025/table_0|1|75|национальность|Украинцы Русские Белорусы Азербайджанцы Татары Всего 
dataset/Dataset/data/5097767/table_0|0|75|национальность|указали русские украинцы белорусы татары чуваши крымские татары армяне узбеки молдаване грузины азербайджанцы мордва болгары поляки осетины другие не указали всего 
dataset/Dataset/data/5097783/table_0|0|75|национальность|указали русские украинцы крымские татары татары белорусы мордва другие не указали всего 
dataset/Dataset/data/5097830/table_0|0|75|национальность|указали русские украинцы белорусы крымские татары татары другие не указали всего 
dataset/Dataset/data/5097837/table_0|0|75|национальность|указали русские украинцы крымские татары татары белорусы армяне другие не указали всего 
dataset/Dataset/data/5177063/table_0|0|75|национальность|русские (великороссы) русские (малороссы) карачаевцы, горские татары абазины и абхазы кабардинцы ногайцы немцы черкесы и адыгейцы другие Итого: 
dataset/Dataset/data/53128/table_0|0|75|национальность|указали русские украинцы крымские татары татары армяне белорусы евреи азербайджанцы греки узбеки поляки корейцы молдаване болгары арабы грузины караимы крымчаки другие не указали всего 
dataset/Dataset/data/5448095/table_0|1|75|национальность|Украинцы Русские Белорусы Татары Армяне Греки Всего 
dataset/Dataset/data/545219/table_0|3|75|национальность|Россия Россия Россия Россия Россия Россия Россия Бразилия Россия Россия Россия Россия Россия Испания Бразилия Россия Россия Россия 
dataset/Dataset/data/5598223/table_1|2|75|национальность|США США США США США США США США / Венгрия США / Венгрия США США Багамские Острова США США 
dataset/Dataset/data/5611443/table_1|2|75|национальность|США Бразилия США США США США США США США США США США США США США США США США Багамские Острова США Австралия США 
dataset/Dataset/data/5612052/table_1|2|75|национальность|Китай США США США США США США США США США Австралия США США США США США США США США США США США США США США США 
dataset/Dataset/data/5620379/table_1|2|75|национальность|США США США США США США США США США Матч не состоялся из-за проведения летних Олимпийских игр 2008 года в Пекине США США США Матч не состоялся из-за проведения летних Олимпийских игр 2012 года в Лондоне США США США Матч не состоялся из-за проведения летних Олимпийских игр 2016 года в Рио-де-Жанейро США США США Матч не состоялся из-за проведения летних Олимпийских игр 2020 года в Токио, которые из-за глобальной пандемии коронавирусной инфекции COVID-19 были перенесены на следующий год Матч не состоится из-за проведения летних Олимпийских игр 2020 года в Токио 
dataset/Dataset/data/5638041/table_0|0|75|национальность|Гибралтарцы Британцы Марокканцы Испанцы Прочие европейцы Прочие 
dataset/Dataset/data/5638041/table_1|0|75|национальность|Гибралтарцы Британцы Испанцы Марокканцы Прочие европейцы Прочие 
dataset/Dataset/data/5744908/table_0|4|75|национальность|русский украинец русский русский русский украинец русский русский еврей украинец русский украинец украинец украинец татарин украинец казах таджик узбек русский грузин русский русский калмык 
dataset/Dataset/data/5763541/table_2|2|75|национальность|Россия Россия Словакия Россия Россия Россия Россия Финляндия Россия Россия Россия Россия Россия Канада Россия Россия Финляндия Швеция Швеция Россия Финляндия Россия Россия Россия 
dataset/Dataset/data/59064/table_0|0|75|национальность|указали русские крымские татары украинцы татары белорусы армяне азербайджанцы поляки узбеки другие не указали всего 
dataset/Dataset/data/6011489/table_11|4|75|национальность|Канада США Канада США Чехия Россия 
dataset/Dataset/data/6134604/table_0|0|75|национальность|Латыши Русские Белорусы Украинцы Поляки Литовцы Другие всего 
dataset/Dataset/data/619109/table_1|0|75|национальность|русские украинцы узбеки белорусы казахи азербайджанцы татары армяне таджики грузины молдаване литовцы туркмены киргизы немцы чуваши латыши башкиры евреи мордва поляки эстонцы чеченцы удмурты марийцы аварцы осетины лезгины корейцы каракалпаки буряты кабардинцы якуты болгары даргинцы греки коми кумыки крымские татары уйгуры цыгане ингуши турки тувинцы гагаузы калмыки венгры карачаевцы курды коми-пермяки румыны карелы адыгейцы лакцы абхазы табасараны балкарцы хакасы ногайцы алтайцы дунгане финны черкесы персы ненцы абазины таты эвенки белуджи ассирийцы ханты талыши рутульцы цахуры агулы эвены шорцы чехи чукчи вепсы нанайцы китайцы коряки словаки манси удины арабы долганы афганцы нивхи албанцы селькупы вьетнамцы ульчи испанцы монголы кубинцы сербы караимы ительмены удэгейцы саамы народы Индии и Пакистана эскимосы чуванцы крымчаки итальянцы нганасаны юкагиры кеты орочи ижора голландцы хорваты тофалары алеуты французы японцы негидальцы австрийцы англичане американцы ливы энцы ороки шведы норвежцы бельгийцы баски крызы другие всего 
dataset/Dataset/data/6416249/table_3|0|75|национальность|китайцы цыгане башкиры мордва грузины чеченцы якуты (саха) аварцы удмурты латыши литовцы лезгины ингуши эстонцы вьетнамцы марийцы турки не указана прочие народы Итого 
dataset/Dataset/data/6416249/table_5|0|75|национальность|чеченцы китайцы литовцы хакасы латыши удмурты аварцы тувинцы лезгины ингуши греки эстонцы алтайцы марийцы осетины якуты (саха) селькупы не указавшие национальность прочие народы Итого 
dataset/Dataset/data/6460784/table_0|0|75|национальность|Чуваши Русские Татары Мордва Марийцы 
dataset/Dataset/data/6514458/table_0|0|75|национальность|указали русские украинцы крымские татары татары цыгане белорусы молдаване армяне узбеки корейцы другие не указали всего 
dataset/Dataset/data/652312/table_0|0|75|национальность|Поляки Белорусы Литовцы Украинцы Русские Американцы Татары Цыгане Немцы Русины Англичане Силезцы Лемки Кашубы другие национальности национальность не установлена либо без национальной принадлежности Всего 
dataset/Dataset/data/6539933/table_1|0|75|национальность|русские немцы украинцы армяне таджики татары азербайджанцы узбеки итого: 
dataset/Dataset/data/6710803/table_0|0|75|национальность|указали русские крымские татары украинцы татары белорусы армяне азербайджанцы поляки узбеки другие не указали всего 
dataset/Dataset/data/6806174/table_0|1|75|национальность|Китай Украина Австрия Германия 
dataset/Dataset/data/6901221/table_0|0|75|национальность|Русские Казахи Узбеки Украинцы Татары Корейцы Азербайджанцы Финны Немцы Таджики прочие 
dataset/Dataset/data/6961017/table_7|1|75|национальность|Всего 
dataset/Dataset/data/711814/table_0|0|75|национальность|русские казахи татары украинцы немцы азербайджанцы чуваши армяне итого: 
dataset/Dataset/data/711814/table_0|1|75|национальность|итого: 
dataset/Dataset/data/7248216/table_0|0|75|национальность|Русские Латыши Белорусы Другие 
dataset/Dataset/data/7328704/table_5|1|75|национальность|Англия Италия Англия Австрия Венгрия Италия Италия Венгрия Венгрия Италия Италия Венгрия Италия Италия Италия Италия Италия Италия Италия Англия Венгрия Италия Швеция Венгрия Италия Аргентина Италия Албания Испания Аргентина Италия Аргентина Италия Швеция Италия Италия Швеция Швеция Италия Швеция Италия Италия Италия Союзная республика Югославия Италия Аргентина Швеция Италия Чехия Италия Италия Германия Италия Италия Италия Италия Италия Испания Чехия Италия Франция Италия Италия Италия Португалия Португалия 
dataset/Dataset/data/7374520/table_0|6|75|национальность|Шорец Русский/кореец Русский Ингуш Русский Русский Мокша Аварец Русский Русский Русский Русский Чеченец Русский Лезгин Русский Русский Манси Русский Русский Русский Осетин Молдованин/кореец Русский/казах Армянин Чеченец Русская Русская 
dataset/Dataset/data/75770/table_1|0|75|национальность|украинцы русские болгары молдаване другие 
dataset/Dataset/data/76092/table_5|1|75|национальность|Англия Италия Англия Австрия Венгрия Италия Италия Венгрия Венгрия Италия Италия Венгрия Италия Италия Италия Италия Италия Италия Италия Англия Венгрия Италия Швеция Венгрия Италия Аргентина Италия Албания Испания Аргентина Италия Аргентина Италия Швеция Италия Италия Швеция Швеция Италия Швеция Италия Италия Италия Союзная республика Югославия Италия Аргентина Швеция Италия Чехия Италия Италия Германия Италия Италия Италия Италия Италия Испания Чехия Италия Франция Италия Италия Италия Португалия Португалия 
dataset/Dataset/data/7628467/table_0|2|75|национальность|Япония Кения США 
dataset/Dataset/data/7716580/table_0|1|75|национальность|Украинцы Русские Белорусы Татары Молдаване Всего 
dataset/Dataset/data/7781352/table_0|3|75|национальность|Франция Великобритания Франция Германия 🇮🇹 Италия Австралия Бельгия 
dataset/Dataset/data/7787791/table_0|2|75|национальность|Великобритания Великобритания Великобритания Эфиопия Австралия Великобритания Великобритания Коста-Рика Бельгия Эфиопия Япония Великобритания Великобритания США США США Кения США Великобритания США Кения ЮАР Мексика Австралия Кения Кения Кения Кения Португалия Кения Кения Кения Эритрея Эфиопия Кения Кения Кения Эритрея Кения Кения 
dataset/Dataset/data/7814582/table_1|2|75|национальность|Австралия США Австралия Австралия Австралия Австралия Австралия Австралия Австралия Австралия Австралия Австралия Австралия Австралия Австралия Австралия Австралия Австралия Австралия Австралия Австралия Австралия Австралия Австралия Австралия США / Австралия Австралия Австралия США Австралия США Австралия 
dataset/Dataset/data/7863583/table_0|3|75|национальность|ГДР США Великобритания Россия Великобритания Великобритания ЮАР США Великобритания Франция ЮАР Швеция Хорватия ЮАР Франция ЮАР Франция США 
dataset/Dataset/data/7870863/table_0|3|75|национальность|Венгрия США США Германия США США США США США США США США США Франция США США Австралия Австралия Австралия США Бразилия Франция США США США Австралия США США США США США США США США ЮАР США США США США США Россия Австралия Нидерланды Франция Франция Австралия Франция Австралия Франция Бразилия 
dataset/Dataset/data/7915973/table_1|0|75|национальность|указали русские украинцы татары крымские татары белорусы азербайджанцы корейцы армяне молдаване турки другие не указали всего 
dataset/Dataset/data/8002060/table_1|2|75|национальность|Австралия Австралия Австралия Австралия Австралия Австралия Австралия Австралия Австралия Австралия Австралия Австралия Австралия Австралия Австралия Австралия Австралия Австралия Австралия Австралия Австралия Австралия Австралия Австралия Австралия Австралия Австралия Австралия США / Австралия США / Австралия Австралия Австралия Австралия Австралия США / Австралия Франция Австралия 
dataset/Dataset/data/8004075/table_0|3|75|национальность|ЮАР США Ямайка Гренада США Ботсвана Куба США Великобритания США США ЮАР США Великобритания США США Кот-д’Ивуар Канада Чехия США США Великобритания Бельгия США США Австралия США 
dataset/Dataset/data/8025699/table_1|2|75|национальность|США США США США США США США США США США США США США 
dataset/Dataset/data/8043799/table_0|3|75|национальность|Германия Коста-Рика Коста-Рика США Австралия Франция Италия Италия Швеция Швеция 
dataset/Dataset/data/8044425/table_0|0|75|национальность|указали русские крымские татары украинцы татары белорусы греки армяне узбеки поляки азербайджанцы молдаване болгары ногайцы немцы турки другие не указали всего 
dataset/Dataset/data/8086772/table_0|0|75|национальность|указали русские украинцы крымские татары татары армяне белорусы евреи азербайджанцы греки узбеки поляки корейцы молдаване болгары арабы грузины караимы крымчаки другие не указали всего 
dataset/Dataset/data/8166528/table_0|0|75|национальность|указали русские крымские татары украинцы татары белорусы греки узбеки турки болгары армяне поляки молдаване азербайджанцы немцы другие не указали всего 
dataset/Dataset/data/8289163/table_12|1|75|национальность|Великобритания Дания Дания Франция Швейцария США Великобритания Великобритания США Австралия Великобритания США Великобритания США США Новая Зеландия Великобритания Великобритания Новая Зеландия Франция США Венесуэла Италия США Франция Италия США Аргентина Бразилия Австрия Великобритания Великобритания Франция Италия Великобритания США Германия Бразилия Бразилия США Аргентина Аргентина Испания Германия Италия Франция США США Бельгия Германия Италия Швейцария Франция Великобритания Португалия Италия Колумбия Италия Великобритания Бразилия Великобритания Великобритания США Италия США Италия Аргентина ЮАР США США Великобритания Бельгия Франция 
dataset/Dataset/data/8289163/table_3|1|75|национальность|Германия Италия Швейцария Бельгия США Австрия Германия Франция Италия Испания Канада Канада Канада Германия Германия Германия Швеция Канада Швейцария Швейцария США Нидерланды Австрия 
dataset/Dataset/data/8388348/table_3|1|75|национальность|Англия Испания Испания 
dataset/Dataset/data/8487434/table_1|4|75|национальность|США 
dataset/Dataset/data/849379/table_0|0|75|национальность|якуты эвенки русские эвены другие 
dataset/Dataset/data/8513527/table_1|0|75|национальность|словаки чехи поляки русины русские не указана 
dataset/Dataset/data/8524147/table_1|0|75|национальность|словаки цыгане немцы не указана 
dataset/Dataset/data/8524152/table_1|0|75|национальность|цыгане словаки украинцы поляки немцы чехи русины не указана 
dataset/Dataset/data/8541951/table_1|0|75|национальность|словаки цыгане чехи русины поляки немцы моравы украинцы венгры хорваты не указана 
