table_id|column_id|label_id|label|column_data
dataset/Dataset/data/3831443/table_0|2|89|персонаж|Grandpa Krank/Pizza Guy/Uncle Zooter Аппа/Moмo Клаус Хайсслер Эйс Палмеро, Губер, Джонни Хитсвелл Перри Утконос/Агент «Пи», эпизодические персонажи Бигфут Щенок Бастер Клоны, Сэси Тиин, Онаконда Фарр, Босск, Оруба Хатт, Зитон Модж, Russo-ISC, Биф, королева Карина, адмирал Тренч, Ти Ва, Тай-Сен Che Зомби-нацист, голова Гитлера Кико, Визгиз Перри-Утконос/агент Пи/Перри-Уткоборг Slythe, Ro-Bear-Bill Полковник Франкенхаймер Рид Ричардс/Мистер Фантастик Уги/Пабу/Нага/Тарлок/Поки/Бум-Мла/Мула/Лефти/Перчик Поросёнок Пухля Лев/Жуконожка Рекс, Вольф, Грегор, Кассиус Константин Со́бак, Перри Утконос/Агент «Пи», Дерек, Джош, Джерри, поросенок Лолы Сандергард Даффи Дак/Белка Сквикс/Белый медведь/Дантист Кураф Манду Перри Утконос/Агент «Пи» Бракованная партия, клоны 
dataset/Dataset/data/500678/table_0|0|89|персонаж|Матиасу Миллеру Александру Сергеевичу Пушкину(статья) 55-му пехотному Подольскому полку(статья) 
dataset/Dataset/data/309133/table_2|0|89|персонаж|Ёж Соник, Метал Соник Майлз «Тейлз» Прауэр Ехидна Наклз Ёж Шэдоу Летучая мышь Руж E-123 Омега Эми Роуз Крольчиха Крим Кот Биг Хамелеон Эспио Пчела Чарми Крокодил Вектор Доктор Эггман Омочао 
dataset/Dataset/data/3281078/table_1|3|89|персонаж|Асмодей рассказчик принц Джаред рассказчик губернатор Северус Инвикт Тракс полковник Грегор Хаха Saker полковник Маел Радек Saker 
dataset/Dataset/data/5496668/table_0|3|89|персонаж|н/д н/д н/д н/д н/д н/д н/д н/д 
dataset/Dataset/data/4436504/table_1|0|89|персонаж|Carbon Crash (Albino Bandicoot) Real Velo, Nash, Krunk, Geary, Zam, Zem, Big Norm, Small Norm N. Trance Pasadena O’Possum, Von Clutch Rilla Roo Spyro the Dragon Yaya panda Megumi, Ami, Liz, Isabella Baby Crash, Baby Coco Baby Cortex, Baby Nefarious Tropy Mega-Mix Iron Checkpoint Crate 
dataset/Dataset/data/8284399/table_0|3|89|персонаж|сам себя Сэм Шон Талли Стивен Ги Ла Трусс Дэймон Алекс в серии «Счастливые джинсы» Джорджи-гёрл Александр Перри Майкл паренёк в клубе в 4 серии 1 сезона член банды работник Брайтон-Рент доставщик пиццы в 5 серии 2 сезона 
dataset/Dataset/data/3120633/table_0|0|89|персонаж|Йожи, цыган-скрипач;в русском переводе часто называется «Сандор» Зорика Ионель Болеску Петер Драготин, отец Зорики, помещик (трансильванский боярин) Илона Каэтан Димитриану Иоланта, племянница Драготина 
dataset/Dataset/data/4422780/table_0|3|89|персонаж|н/д н/д н/д н/д н/д н/д н/д весь сезон с 14 эпизода 
dataset/Dataset/data/8716761/table_2|3|89|персонаж|Кошка Кул Кид Потато Уилл Тоффман Бесси Хиггенботтом Король Джулиан Оптимус Прайм Гуфи Шкипер Кот в шляпе Безумный Шляпник Миссис Колдрон Ковальски Сквидвард Тентаклс Мистер Пинг Хьюанг Дэн Хондо Онака Пёс Дадли Дарт Мол Пег Джемайма Паддлдак Себастьян Винклеплотц Кот Сабрина Спеллман[en] Король Джулиан Дарт Бэйн[en] Хакер Мисс Крапива Капитан Гуф Борода Мэр Ласки Мистер Крокер Кот в сапогах[en] и Сино Король Джулиан Турбо Блинки Король Джулиан, Панчо Сквикс Морт/Умный Морт/Мортикус Хан и Тэд Спайк[en] Губка Боб Квадратные Штаны Мастер Эон Эйприлкот, Мадам Блубэрри, Джуниор Аспарагус, Лиза Аспарагус and Найт Пони Морт/Бабуля Морт и Умный Морт Сплаш и Миссис Тиди Иккинг Порки Пиг Микки Маус Старый Джир и Каз Тилли Грин Мама 
dataset/Dataset/data/7579474/table_0|0|89|персонаж|Вилли Пад-Пад Белла ди Монетти Кайзер Фрэнк Стрит Бен Мама 
dataset/Dataset/data/5691470/table_0|2|89|персонаж|Тулси Михир Вирани Кавита Смрити ведущая Сита гость (вместе с Сакши Танвар[en]) Ума Васудха Сусхант Шарма Шарда Вринда ведущая (вместе с Сакши Танвар) продюсер Манибен Джаманкумар Патель ведущая Свати 
dataset/Dataset/data/5026973/table_0|3|89|персонаж|н/д н/д н/д н/д н/д н/д н/д н/д 
dataset/Dataset/data/3272212/table_0|0|89|персонаж|Миямото Мусаси/Кадзуманосукэ Кирю Горохати Мадзима Сасаки Кодзиро Ито Иттосай Сэйдзюро Ёсиока Гион Тодзи Такэси Кидо Таинственный монах Марумэ Нагаёси Ёсиро Таю Харука Libido Waterfall 
dataset/Dataset/data/5936479/table_0|2|89|персонаж|Пер молодой человек Фредди Лассе 
dataset/Dataset/data/4064100/table_0|4|89|персонаж|Ричард Уинтерс и Герберт Собел Ричард Уинтерс Альберт Блайт Денвер Рэндлмен Ричард Уинтерс Юджин Роу Карвуд Липтон Дэвид Вебстер Льюис Никсон Ричард Уинтерс 
dataset/Dataset/data/6677106/table_0|2|89|персонаж|Хонорка Анка Зоська Малиновска Элжбета Зоська Ева, связная девушка в баре Сандра-Стефания 
dataset/Dataset/data/4452460/table_1|3|89|персонаж|Гэкка Хёка Гинка Юка Кёка Тика Ока Тэйка 
dataset/Dataset/data/634517/table_0|3|89|персонаж|Фогг, Паспарту, мистер Фикс Фогг, Паспарту, мистер Фикс Фогг, Паспарту, мистер Фикс Фогг, Паспарту, мистер Фикс, лорд Мэйз Фогг, Паспарту, мистер Фикс Фогг, Паспарту, мистер Фикс Фогг, Паспарту, мистер Фикс, лорд Мэйз, Белинда Мэйз 
dataset/Dataset/data/6680592/table_0|2|89|персонаж|коллега Каси Генри Анджей Врубель Кшиштоф Яцек Роберт Марек Сыкут Витольд в молодости актёр в театре Ян Малецкий Томек немецкий велосипедист Людвик Прайски, учитель химии Швагер/Швагровский Герберт Роман Наторски поручик Никита Андреевич Обозов Ян, отец Яника Анджей Годек Ян Малецкий Ян поэт Милениуш Скорек Жендзян Игорь (2000) Клеменс Марек Зелиньский рассказчик/полковник Михал Венборек Пётр учитель Яблоновский Веслав Роса профессор Гонсовски профессор Гонсовски Богдан «Моцарт» Кузняр Войцех Павел Фабиански (2014) Липский 
dataset/Dataset/data/2152727/table_1|5|89|персонаж|Агент Смит Доминико Танзини Рик Манчини Бертран Морт Карл Макриди Юки 
dataset/Dataset/data/8809977/table_1|1|89|персонаж|Скуби-Ду / Шэгги Роджерс Фред Джонс Дафни Блэйк Велма Динкли 
dataset/Dataset/data/4935575/table_0|0|89|персонаж|Джи Каллен Кенси Блай Марти Дикс Эрик Бил Нелл Джонс Хетти Ланг Сэм Ханна Оуэн Грейнджер 
dataset/Dataset/data/6779687/table_0|0|89|персонаж|Кендалл Найт Карлос Гарсия Джеймс Даймонд Логан «Гортензий» Митчелл Густаво Рок Кэти Найт Келли Уэйнрайт Миссис Дженнифер Найт Артур Гриффин Камилла Робертс Люси Стоун Джо Тейлор Реджинальд Биттерс Тайлер Мама Тайлера Парень с гитарой Будда Боб Мисс Коллинз Дженнифер Мерседес Грифин Рэйчел Стефани Кинг Маркос Хоук Фудзисаки Оззи Кларк Дак Зевон Эд Бегли-младший Джетт Стетсон Товарняк Роберта Доктор Голливуд Тед Гарсия Мистер Икс Группа Обдул водитель Джо Дженни Тинклер 
dataset/Dataset/data/1883385/table_0|1|89|персонаж|Доктор Кэл Лайтман — может различить правду и ложь на основе анализа поведения человека: мимики лица, телодвижений, голоса и речи. Лайтман может сразу определить, что человек лжёт, по нервному жесту, по углу бровей, по изменению интонации в голосе. Анализируя мимику, он может узнать, что человек чувствует в данный момент — от скрытого недовольства до сексуального влечения и ревности. Но Лайтман также понимает, что его способности — это одновременно и дар, и проклятие в его личной жизни, и если постоянно ловить кого-либо на лжи, то это может сильно подорвать родственные отношения. Доктор Лайтман — главный в мире специалист по определению лжи и обмана; учёный, изучающий мимику лица и язык тела для определения не только самого факта лжи, но и причин этого. Лайтман возглавляет команду экспертов «The Lightman Group», которые помогают ФБР, государственным органам и местной полиции в решении самых запутанных случаев. Разведен, воспитывает дочь-подростка, поддерживает отношения с бывшей женой. Он занялся изучением теории лжи после того, как его мать покончила с собой. С ней была сделана запись, где она беседует с психологом. Тогда-то Лайтман и догадался замедлить плёнку и увидел микровыражение муки на её лице. Постоянно пересматривает эту запись. Доктор Джиллиан Фостер — одарённый психолог и психотерапевт, эксперт команды Лайтмана. Она приносит сбалансированность в это партнёрство, так как рассматривает каждый случай в целом, в то время как Лайтман концентрируется на отдельных деталях. Ему необходимы её способности к убеждению и пониманию поведения людей, — неважно, осознаёт он это или нет. Владеет гипнозом. Была замужем: супруги удочеряли ребёнка, но биологическая мать вернула младенца. В конце концов, Джиллиан устала заниматься самовнушением, что её брак в порядке, и развелась. Илай Локер — ведущий исследователь в команде Лайтмана, которому настолько неприятна ложь, что он живёт по собственному принципу «радикальной честности». Он всегда говорит то, что думает и, естественно, часто расплачивается за это. В конце первого сезона Локер обманул Лайтмана, и хотя впоследствии он признался в обмане, босс сделал его неоплачиваемым стажёром. Риа Торрес — эксперт в команде Лайтмана. Талантливо проницательна, но, в отличие от предыдущих, не имеет психологического образования: её способности «читать людей» пока что не развиты в должной степени. В одной из серий Лайтман предполагает, что Рию в детстве бил её отец, и, пытаясь уловить его настроение, она и научилась читать эмоции (а её сводная младшая сестра — искусно врать, скрывая свои). 
dataset/Dataset/data/2968338/table_0|3|89|персонаж|Столе Петтерен Йорген Кристоффер Рейдар Кельнер Рогер Йостейн Лассе Ларс Эгиль Эркки Йорма Кристиан врач Хэппи Чэпмэн Кай Йон сын директора цирка голос по телефону Кнут Педерсен пчела Сусуму Фроде Мюллер / Йонна Карл Ванг парикмахер Том Кай Косс (КК) Франк Кристиансен Бротен Грегор Финиш Х Финиш Хельге Петер Юнас полицейский Терье Орхейм Уильям Sören Laurell-Wall Вилльям театральный инструктор Sidekick Zombie Доктор Проктор Йохан Кристиан Айкорд Мёрфи Давид (42 года) Ким мужчина Кьетил Нильс Дельбрук Кристиан Айкорд 
dataset/Dataset/data/5962565/table_0|2|89|персонаж|Томас Симонсен М-р Смит в молодости второй полицейский Ян Эрик Вульффс Артур Джонни Ольсен (2000-2003) Клаус Йохансен, отец Иды Билл Карстен Сков Торбен тренер Томаса Атос (озвучивание) Стин Кольд (2007) отец Альберта Стин Кольд Йон детектив Стин Кольд Горак (озвучивание) Стин Кольд Деннис директор 
dataset/Dataset/data/1833862/table_1|0|89|персонаж|Маленький Принц Летчик Роза Лис Обитатели планет 
dataset/Dataset/data/6606071/table_0|2|89|персонаж|Алинка (2006) Зося (2007) Юлька (2006) Михалина Юлия Копацка Наталья Краль ученица Кароля Тося Анелка Марта Кася Тося 
dataset/Dataset/data/8849173/table_0|0|89|персонаж|Санни Старскаут Иззи Мунбоу Пипп Петалс Хитч Зипп Шторм Филлис Королева Хейвен Спраут Альфабиттл Аргайл 
dataset/Dataset/data/3711907/table_1|1|89|персонаж|Детектив Пе́рес О́льга Кинта́на Би́лли Миге́ль Осва́льдо Роса́лес Детектив Мальдона́до Ха́йме Олива́рес Игна́сио Кабе́сас Ла́ура Олива́рес Аль Га́то Педро Гусма́н Пе́дро Ко́ртес Хе́а Море́тти Кори́на Эми́ль Ро́хас «Эль И́ндио» Оли́вия Кло́стер Лу́дрес де Порти́льо Ма́рио Порти́льо Экто́р Баро́н 
dataset/Dataset/data/5261074/table_1|0|89|персонаж|Джафар Джаббарлы Азиз Алиев Микаил Мушфиг Матлаб Гулиев Зюльфи Гаджиев Гаджи Зейналабдин Тагиев Джалил Мамедкулизаде Гейдар Алиев 
dataset/Dataset/data/8232203/table_9|1|89|персонаж|Зайка Панда Попугай Волк Львёнок Олень Лев 
dataset/Dataset/data/3078268/table_2|0|89|персонаж|Ёж Соник Ястреб Джет Майлз «Тейлз» Прауэр Ласточка Вейв Ехидна Наклз Альбатрос Шторм Эми Роуз Доктор Эггман Крольчиха Крим Летучая мышь Руж Ёж Шэдоу Ёж Сильвер Кошка Блейз SCR-HD, SCR-GP Чао Чиз 
dataset/Dataset/data/2008465/table_0|1|89|персонаж|Ванесса Турнбилл Брэд Хилари Якобс Бобби Дуг Раффи Карутерс Рик Стефенс Хестер Райан Джим Пилонски Дэмиен Огл Паули Морелли Касси Вулф Марта детектив Люси Картер мистер Дриветт продюсер оригинального фильма режиссёр оригинального фильма Forensic Supervisor Lecturer Vanessa’s Manager Репортёр Репортёр Репортёр 
dataset/Dataset/data/5290060/table_0|0|89|персонаж|Аситака Сан Кая Госпожа Эбоси Гондза Токи Дзико-Бо Моро Оккотонуси Коруку Хи-сама Волки Волки 
dataset/Dataset/data/1615233/table_2|0|89|персонаж|Ёж Соник Майлз «Тейлз» Прауэр Ехидна Наклз Эми Роуз Кот Биг E-102 Гамма Доктор Эггман, Метал Соник (меню) Ехидна Тикал Ехидна Пачакамак Другие персонажи 
dataset/Dataset/data/3197036/table_0|0|89|персонаж|Балто Дженна Коди Дюк Борис Стелла Дипси Мэл Дасти Кёрби 
dataset/Dataset/data/368968/table_6|3|89|персонаж|Трубадур Дюк осьминог Октавиан Франц фон Вейротер 
dataset/Dataset/data/2177326/table_2|0|89|персонаж|Барака Безликий Горо Джакс Джарек Джатаака Джейд Джемини Джонни Кейдж Кабал Кано Киа Кинтаро Китана Куан Чи Кун Лао Лю Кан Милина Нуб Сайбот Райдэн Рептилия Саб-Зиро Сарина Скорпион Смоук Соня Блейд Тасия Тремор Фудзин Шан Цзун Шао Кан Шиннок Эрмак 
dataset/Dataset/data/3975730/table_0|0|89|персонаж|Слэм Брэдли Алый мститель Бэтмен Комиссар Джеймс Гордон Джо Чилл Хьюго Стрэйндж Робин Глиноликий (Базиль Карло) Пингвин Двуликий Траляля и Труляля Загадочник Красный колпак Светлячок Бэтмены всех стран Марсианский охотник Бэтвумен Календарный человек Бэт-Майт Глиноликий (Мэтт Хэйген) Кэтмен Блокбастер Мастер ключей Бэтгёрл (Барбара Гордон) Джейсон Бард Мэн-Бэт Талия аль Гул Харви Баллок Лесли Томпкинс Калькулятор Руперт Торн Сильвер Ст.-Клауд Глиноликий (Престон Пэйн) Макси Зевс Убийца Крок Оникс Чревовещатель (Арнольд Уэскер) Крысолов Анархия Рене Монтойя Стефани Браун Криспус Аллен Саша Бордо Нисса Раатко Чревовещатель (Пэйтон Райли) Куклодел Шарлотта Риверс Джилл Хэмптон 
dataset/Dataset/data/6618481/table_0|2|89|персонаж|тётя Мэй Паркер дядя Бен Паркер (камео) Дэннис Кэррадайн Дональд Менкен Джей Джона Джеймсон (камео) Джин ДеВольфф Дмитрий Смердяков / Хамелеон (камео) Гвен Стэйси (упоминание) 
dataset/Dataset/data/1670935/table_0|0|89|персонаж|Мужской персонаж 1 Мужской персонаж 2 Женский персонаж 1 Женский персонаж 2 Мужской подросток Женский подросток Пожилой мужчина Пожилая женщина Ребёнок Малыш и новорождённый Образ смерти 
dataset/Dataset/data/848668/table_1|0|89|персонаж|Граф Альмавива Фигаро Розина Бартоло Базилио 
dataset/Dataset/data/254834/table_0|3|89|персонаж|Тибальт Видаль Клайв Обадий Слоуп Симон мистер Браунлоу рассказчик Круп Димитри / голос RADA Ганс Грубер Эд Жак Ру Израэль Йетс Колин Эллиот Марстон Джеми шериф Ноттингема Синклер допрашивающий Лукас Харт Третий Дуайт Биллингс Фридрих Антон Месмер О’Хара полковник Брэндон Григорий Распутин Имон де Валера Living Tyde режиссёр, сценарист, эпизодическая роль Дэвид Вайнберг Дэвид Фридман Метатрон доктор Лазарус, Александр Дейн капитан Джон Фаллон Джо (озвучивание) Фил Аллен человек йоркширец Джон Гиссинг продюсер профессор Северус Снегг профессор Северус Снегг король Филипп (озвучивание) Гарри профессор Северус Снегг доктор Альфред Блэлок (озвучивание) профессор Северус Снегг Марвин (озвучивание) Антуан Риши Алекс Хьюз профессор Северус Снегг судья Тёрпин Эли Майклсон Стивен Спурье профессор Северус Снегг (озвучивание) гусеница Абсолем (озвучивание) Он профессор Северус Снегг Ноэль Оделл (озвучивание) (озвучивание) профессор Северус Снегг рассказчик (озвучивание) лорд Лайонел Шабандар Хилли Кристал (англ.)русск. президент Рональд Рейган Карл Хоффмайстер Тодд режиссёр, король Людовик XIV генерал Фрэнк Бенсон Абсолем (озвучивание) 
dataset/Dataset/data/5261074/table_0|0|89|персонаж|Нариман Нариманов Насими Гейдар Алиев Низами Гянджеви Узеир Гаджибеков 
dataset/Dataset/data/3390417/table_1|0|89|персонаж|Зангиев Далсим Роленто Юань Сакура 
