table_id|column_id|label_id|label|column_data
dataset/Dataset/data/8001762/table_1|0|89|персонаж|Райдер Гончик Маршал Рокки Зума Крепыш Скай Капитан Палтус Эверест Трекер Мэр Гудвей Француа Палтус Джейк Алекс Фермерша Юми Так Элла Мэр Хамдингер Гарольд Хамдингер Рекс Дикий Кот 
dataset/Dataset/data/172338/table_0|1|89|персонаж|Билли Ло Билли Ло-2 Джим Маршалл Доктор Лэнд Энн Моррис Штейнер Стик исполнитель из Пекинской оперы Карл Миллер Паскуаль (архивные кадры) Хаким (архивные кадры) Кольт (архивные кадры) Джон Лок Ям 
dataset/Dataset/data/7498009/table_0|0|89|персонаж|Сэт. Главный герой серии, начинающий колдун. Мели. Подруга Сэта. Док. Начальник Мели. Альма. Однорукая наставница Сэта, его приемная мать. Мистер Бобли. Ручная летучая мышь Мели. Драгунов. Капитан корабля инквизиции. Гримм. Охотник за немезидами. Мастер Лорд Маджести. Глава города колдунов. Яага. Учитель Сэта в городе колдунов. Мисс Мэльба. Возлюбленная Дока. Торк Фон Теппес Ульмина Баглиорэ Лизелоттэ Сантори Пиодан Босс Рассказчик 
dataset/Dataset/data/296578/table_0|0|89|персонаж|Бэмби Великий Князь Мина Мать Бэмби Фэлин Ронно Друг Филин Топотун Цветочек Сурок Дикобраз Сёстры Топотуна 
dataset/Dataset/data/1017689/table_0|0|89|персонаж|Гисли сын Кислого Ауд Торгрим Торкель сын Кислого Асгерд Вестейн Эйольв Серый Тордис дочь Кислого Бёрк Толстяк Хельги 
dataset/Dataset/data/2154442/table_0|0|89|персонаж|Ранго Ларс Бобитта Присцилла Мэр Броненосец Гремучка Джейк Док Мерримак Бальтазар дух Дикого Запада плохой Билл раненая птица 
dataset/Dataset/data/8800575/table_1|1|89|персонаж|Скуби-Ду / Шэгги Роджерс Фред Джонс Дафни Блэйк Велма Динкли Винсент Ван Хельсинг Брэм Джаспер Пубелль Тулли Лита Рутлэнд 
dataset/Dataset/data/5474850/table_0|1|89|персонаж|Пегги Картер Эдвин Джарвис Джек Томпсон Дэниэл Суза Роджер Дули 
dataset/Dataset/data/6568711/table_2|5|89|персонаж|Кэти Армстронг Кэти Армстронг 
dataset/Dataset/data/6543654/table_1|2|89|персонаж|И-кун и Томо Кунагиса Канамэ Ибуки и Синъя Сакаки Маки Химэна Аканэ Сонояма Акари Тига, Хикари Тига и Тэруко Тига Яёй Сасироно 
dataset/Dataset/data/4674722/table_0|2|89|персонаж|Сандра (2 эпизода) Сидни Ли Гретчен Фарра Ванесса Хоуп Тайлер Греншоу (эпизод) миссис Кребтри (эпизод) журналистка Трейси (6 эпизодов) Тара Гамильтон Алисия Джеймс (эпизод) Жасмин 
dataset/Dataset/data/432450/table_2|2|89|персонаж|Карен Лайт Глория 
dataset/Dataset/data/8232203/table_15|1|89|персонаж|Белый орёл Ананас Пингвин Крокодил Розовая пантера Банан Единорог Лама Заяц Солнце Носорог Змея Неваляшка 
dataset/Dataset/data/6629085/table_0|1|89|персонаж|Пегги Картер Эдвин Джарвис Джек Томпсон Дэниэл Суза Роджер Дули 
dataset/Dataset/data/7230197/table_0|1|89|персонаж|Антон Аня / Валая Наташа Фан Пеле Бело, Черно амазонка Ю амазонка Во амазонка Бу мама Антона капитан полиции начальник полиции распределитель работ сержант полиции бедуин бородач с Таймс-сквер жена бородача влюблённая девочка Бюргер-отец Бюргер-дочь девочка с респиратором фанатка Пеле брюнетка болельщица болельщица спортивный комменатор краснолицый охранник 
dataset/Dataset/data/6681737/table_0|2|89|персонаж|Анне-Метте Метте Лисбет Лиза 
dataset/Dataset/data/5002310/table_5|3|89|персонаж|адвокат Билли Флин (вокальные партии) исполнение вокальных партий Крысиный Король Алладин попугай Кики 
dataset/Dataset/data/2689530/table_0|1|89|персонаж|Agent Michael Hailey Dr. Daniel Cassian Dr. Edward Marcase Dr. Kimberly Shiroma Dr. Brian Taft 
dataset/Dataset/data/4766589/table_2|2|89|персонаж|танкистка командир Уокер Айша Тайлер 
dataset/Dataset/data/552455/table_0|0|89|персонаж|Мужской персонаж 1 Мужской персонаж 2 Женский персонаж 1 Женский персонаж 2 Мужской подросток Женский подросток Пожилой мужчина Пожилая женщина Ребёнок Малыш и новорождённый Образ смерти 
dataset/Dataset/data/8879715/table_0|2|89|персонаж|Барток Форте Люмьер Барнаби Крукедман Тигра Фа Мулан Мэри Лэмб Мария Фёдоровна Белль Анастасия Николаевна Хогарт Хьюс Шейла Брофловски Джейн Портер Рамсес II Зира 
dataset/Dataset/data/7040075/table_4|1|89|персонаж|Рэй Стентс Питер Венкман Уинстон Зедмор Зефирный Человек (только играет; озвучивает Ллойд Алквист) Кэри Байрон Тори Белечи Бонни Паркер Джульетта Капулетти Эллен Дедженерес Опра Уинфри Квентин Тарантино Стэнли Кубрик Конфуций 
dataset/Dataset/data/4718122/table_0|0|89|персонаж|Айзек Кларкa Большой Папочка Данте Джек и Декстерb Зевсa «Злой» Коул Макграт Коул Макграт Кратос Кэтa Нарико Нейтан Дрейк Параппа Полковник Радек Принцесса Обжора Райдэн Рэтчет и Кланкb Сладкоежка Слай Купер Спайк Сэкбой Сэр Дэниэль Фортескью Торо Иноуэ Хэйхати Мисима Эмметт Грейвзa 
dataset/Dataset/data/6549925/table_0|3|89|персонаж|Малу Ана Мария Роза 
dataset/Dataset/data/8379993/table_0|0|89|персонаж|Орико «Окко» Сэки Мацуки Акино Макото «Ури-Бо» Татэури Минэко Сэки 
dataset/Dataset/data/6289030/table_0|2|89|персонаж|дежурный бассейна (2005) Ральф Геллерт (2015) (1999) Фред Эйзенманн (2003) Тассило (2002) Бен Келлер Оле Фрэнк Мольтке народная милиция Фред, коллега Джо боксёр Себастьян Гартманн шарфюрер Йенне фельдмаршал Брандт Бидерманн — оберкапо Исмаил 
dataset/Dataset/data/236547/table_0|0|89|персонаж|Фродо Бэггинс Арагорн Гэндальф Серый / Гэндальф Белый Сэмуайз Гэмджи Мериадок Брендибак (Мерри) Перегрин Тук (Пиппин) Леголас Гимли, сын Глоина Голлум / Смеагол (образ и голос) Саруман Белый Теоден Эовин Эомер Грима Гнилоуст Элронд Арвен Фарамир Галадриэль Халдир из Лориена Хама Гамлинг Теодред Мадрил Боромир (режиссёрская версия) Маухур Орк из мордора Углук Гришнак Дэнетор (режиссёрская версия) 
dataset/Dataset/data/2473696/table_1|1|89|персонаж|Ана Лусия Лусия Селия Эспередиана Анастасия Дона Бента Лаура 
dataset/Dataset/data/7767096/table_0|2|89|персонаж|Минна Лагер София Лейна Анна-Карин Анна Клара Мия Дженни Малена Нина Фриск Сесилия Алготсдоттер глава фирмы грамзаписи Сесилия Алготсдоттер Ханна Мария Сесилия Алготсдоттер фрёкен Бритта Анна Сага Норе́н Элизабет Малин Мама мальчика 
dataset/Dataset/data/7336676/table_0|0|89|персонаж|Кун Мирай отец мама таинственный человек/собака Бабушка дедушка молодой прадедушка робот 
dataset/Dataset/data/1129152/table_2|0|89|персонаж|Барака Безликий Горо Джакс Джарек Джатаака Джейд Джемини Джонни Кейдж Кабал Кано Киа Кинтаро Китана Куан Чи Кун Лао Лю Кан Милина Нуб Сайбот Райдэн Рептилия Саб-Зиро Сарина Скорпион Смоук Соня Блейд Тасия Тремор Фудзин Шан Цзун Шао Кан Шиннок Эрмак 
dataset/Dataset/data/4118122/table_0|2|89|персонаж|Иоганн Фридрих Струэнзе Каролина Матильда Великобританская Кристиан VII Уве Хёх-Гульдберг Йохан Хартманн (датск.)русск. Юлиана Мария Брауншвейг-Вольфенбюттельская Фредерик VI Эневольд Брандт Наташа Луиза фон Плессен (англ.)русск. Иоганн Хартвиг Эрнст фон Бернсторфф Шак Карл Ранцау (датск.)русск. министр Августа Саксен-Готская Дитлеф (англ.)русск. 
dataset/Dataset/data/214271/table_0|0|89|персонаж|Большая Птица (англ. Big Bird) Влас и Еник / Берт и Эрни (англ. Bert and Ernie) Граф фон Знак (англ. Count von Count) Гровер (англ. Grover) Лягушонок Кермит (англ. Kermit the Frog) Коржик (англ. Cookie Monster) Оскар (англ. Oscar the Grouch) Элмо (англ. Elmo) Эбби Кадабби (англ. Abby Cadabby) 
dataset/Dataset/data/4312470/table_0|0|89|персонаж|Бильбо Бэггинс Гэндальф Серый Галадриэль Торин Дубощит Леголас Зелёный Лист Тауриэль Балин Бофур Глоин, отец Гимли Дори Нори Кили Фили Двалин Оин Бомбур Ори Бифур Радагаст Бурый Некромант (озвучка) Смауг, дракон (образ и голос) Трандуил Беорн Бард Лучник Бургомистр Эсгарота Азог Больг Баин Алфрид Галион, дворецкий Трандуила Камео 
dataset/Dataset/data/8058627/table_0|0|89|персонаж|Святой Без-Кишок Мать-Природа Мисс Америка Леди Бомж (Эвелин Кейс) Граф Клеветник мистер Уиттиер мистер Уиттиер мистер Уиттиер Герцог Вандальский (Терри Флетчер) миссис Кларк миссис Кларк миссис Кларк миссис Кларк Директриса Отказ Преподобный Безбожник Хваткий Сват Сестра Виджиланте Повар Убийца(Ричард Талбот) Товарищ Злыдня Агент Краснобай(Юджин Дентон) Недостающее Звено Графиня Предвидящая(Клер Аптон) Обмороженная Баронесса(мисс Лерой) Мисс Апчхи (Лиза Нунан) 
dataset/Dataset/data/5027022/table_0|3|89|персонаж|н/д н/д н/д н/д н/д н/д н/д н/д 
dataset/Dataset/data/3372996/table_0|0|89|персонаж|Уилл Маккензи Саймон Купер Джей Картрайт Нэйл Сазерлэнд Генри Ллойд-Хьюз 
dataset/Dataset/data/2507292/table_0|2|89|персонаж|Леонид Виктор Тимур Роман Виноградов, сын Кати Макс опер Макс Богушев Олег Гера Егор Шипов, брат Андрея Данила Орлов, сын совладельца клуба Гай Гаал Гай Гаал Александр («Штык»), глава неонацистской группировки Майк (его страх — правда) Васяня Салех Серажетдинов («Татарин») Анатолий Бессонов, рецидивист по кличке «Бес» Антон Николай Кравчук, отец Насти и брат Оли Антон Баткин Пётр Фёдорович Басманов, воевода Николай Волков, стриптизёр Сёма Иван Новицкий Антон Виталий, менеджер торгового центра парашютист Морис Андрей Громов, капитан Фёдор Петров, актёр, друг Игоря Градского Николай Кравчук, отец Насти и брат Оли Лёша, студент Иван Павел Нечаев, молодой революционер, беглый каторжник Вячеслав, сын Ильинского дядя Костя Николай Кравчук, отец Насти Пётр Ерёмин Артём Цыганов Федот Евграфович Васков, старшина, комендант разъезда Макар, турист из Новосибирска Андрей Андрей Стольский, жених Саши Гайдуковой, художник Андрей Николаевич Петров, капитан ледокола «Михаил Громов» Яковлев / Колычев, бретёр, отставной офицер, подпоручик Родион Стоцкий, оперуполномоченный милиции Андрей, оперуполномоченный полиции Максим Минаев, учёный Кирилл Витальевич, редактор Родион Стоцкий Николай Кравчук, отец Насти Юрий Владимир Вешняков Олег Костин, майор КГБ 
dataset/Dataset/data/680694/table_2|0|89|персонаж|Филеас Фогг Жан Паспарту Мистер Фикс Белинда Мэйз Лорд Мэйз 
dataset/Dataset/data/6496338/table_1|2|89|персонаж|доктор Ватсон, инспектор Лестрейд сеньор Альварес Торрес Михаил Семёнович Шполянский, большевистский агент 
dataset/Dataset/data/5953795/table_0|2|89|персонаж|Леонид Виктор Тимур Роман Виноградов, сын Кати Макс опер Макс Богушев Олег Гера Егор Шипов, брат Андрея Данила Орлов, сын совладельца клуба Гай Гаал Гай Гаал Александр («Штык»), глава неонацистской группировки Майк (его страх — правда) Васяня Салех Серажетдинов («Татарин») Анатолий Бессонов, рецидивист по кличке «Бес» Антон Николай Кравчук, отец Насти и брат Оли Антон Баткин Пётр Фёдорович Басманов, воевода Николай Волков, стриптизёр Сёма Иван Новицкий Антон Виталий, менеджер торгового центра парашютист Морис Андрей Громов, капитан Фёдор Петров, актёр, друг Игоря Градского Николай Кравчук, отец Насти и брат Оли Лёша, студент Иван Павел Нечаев, молодой революционер, беглый каторжник Вячеслав, сын Ильинского дядя Костя Николай Кравчук, отец Насти Пётр Ерёмин Артём Цыганов Федот Евграфович Васков, старшина, комендант разъезда Макар, турист из Новосибирска Андрей Андрей Стольский, жених Саши Гайдуковой, художник Андрей Николаевич Петров, капитан ледокола «Михаил Громов» Яковлев / Колычев, бретёр, отставной офицер, подпоручик Родион Стоцкий, оперуполномоченный милиции Андрей, оперуполномоченный полиции Максим Минаев, учёный Кирилл Витальевич, редактор Родион Стоцкий Николай Кравчук, отец Насти Юрий Владимир Вешняков Олег Костин, майор КГБ 
dataset/Dataset/data/2759683/table_2|0|89|персонаж|Филеас Фогг Жан Паспарту Мистер Фикс Белинда Мэйз Лорд Мэйз 
dataset/Dataset/data/8047967/table_5|2|89|персонаж|Dr. Eggman, Professor Gerald Robotnik Dr. Eggman Dr. Eggman Dr. Eggman Dr. Eggman Dr. Eggman Dr. Eggman Dr. Eggman Dr. Eggman Dr. Eggman Dr. Eggman Dr. Eggman, Classic Eggman Dr. Eggman Dr. Eggman 
dataset/Dataset/data/7851144/table_0|0|89|персонаж|Сэт. Главный герой серии, начинающий колдун. Мели. Подруга Сэта. Док. Начальник Мели. Альма. Однорукая наставница Сэта, его приемная мать. Мистер Бобли. Ручная летучая мышь Мели. Драгунов. Капитан корабля инквизиции. Гримм. Охотник за немезидами. Мастер Лорд Маджести. Глава города колдунов. Яага. Учитель Сэта в городе колдунов. Мисс Мэльба. Возлюбленная Дока. Торк Фон Теппес Ульмина Баглиорэ Лизелоттэ Сантори Пиодан Босс Рассказчик 
dataset/Dataset/data/6887215/table_0|3|89|персонаж|Моника Саломея монахиня клерк женщина с телефоном польская работница Люцина Нехай Рената Жемба-Крашевская Ирэн Дрыва клиентка отеля 
dataset/Dataset/data/2508672/table_0|3|89|персонаж|Луиза 
dataset/Dataset/data/5261052/table_1|0|89|персонаж|Джафар Джаббарлы Азиз Алиев Микаил Мушфиг Матлаб Гулиев Зюльфи Гаджиев Гаджи Зейналабдин Тагиев Джалил Мамедкулизаде Гейдар Алиев 
dataset/Dataset/data/912072/table_0|4|89|персонаж|Таша Яр погибает, её место на посту офицера службы безопасности занимает лейтенант Ворф. Дейта обнаруживает своего брата, Лора. Доктор Беверли Крашер уходит, её заменяет Кэтрин Пуласки. Джорди Ла Форж повышен до лейтенанта и продвинут до должности главного инженера. Гайнан поступает на борт «Энтерпрайза». Джорджи ла Форж повышен до лейтенант-коммандера. Ворф повышен до лейтенанта. Беверли Крашер возвращается на борт «Энтерпрайза». К экипажу Энтерпрайза присоединяется медсестра Алиссиа Огава. Дейта создаёт андроидку Лал и считает её своей дочерью. Уэсли Крашер поступает в академию звёздного флота. Ворф узнаёт о том, что у него есть сын, Александр Роженко. Лейтенант Ро Ларен поступает на борт Энтерпрайза. Александр Роженко поступает на борт Энтерпрайза. Майлз Эдвард О'Брайн покидает Энтерпрайз, чтобы нести дальнейшую службу на борту станции «Далёкий космос 9» Уильям Райкер узнаёт о существовании своего «близнеца», Томаса Райкера. Диана Трой повышена до коммандера. Уэсли Крашер покидает Академию Звёздного флота. Ро Ларен оставляет Энтерпрайз и присоединяется к повстанческой организации «Маки». 
dataset/Dataset/data/312509/table_2|0|89|персонаж|Навсикая Асбер Ксяна Учитель Юпа Обаба Куротава Джиль Мито Гол Гикури Император Ластель Вождь Физита Мать Ластель Рассказчик 
dataset/Dataset/data/1957194/table_1|0|89|персонаж|Ёж Шэдоу Ёж Соник Блэк Дум Доктор Эггман, Джеральд Роботник Командир G.U.N. Мария Роботник, секретарь Майлз «Тейлз» Прауэр Ехидна Наклз Эми Роуз Летучая мышь Руж E-123 Омега Солдаты G.U.N. Крокодил Вектор Хамелеон Эспио Пчела Чарми Президент Крольчиха Крим 
dataset/Dataset/data/5431969/table_1|2|89|персонаж|Анна 
dataset/Dataset/data/6263316/table_0|0|89|персонаж|Джейкоб Марли Артур Хевишем Гонория Барбери Амелия Хевишем Френсис Барбери Меривезер Компейсон Боб Кретчет Эбенезер Скрудж Билл Сайкс Питер Кретчет Дедушка Эдвард Барбери Нэнси Фейгин Капитан Джеймс Хоудон Марта Кретчет Джон Бенет Нелл Эмили Кретчет Сайлас Вегг Джаггерз Мистер Бамбл Миссис Бамбл Малыш Тим Миссис Гемп Дейзи Фенни Биггетивич Инспектор Баккет Мистер Винус Мэри Сержант Джордж Сэр Лестер Дедлок Метью Покет Констебль Дафф Ловкий Плут Томас Грендгринд Салли Компейсон Оливер Твист Реверенд Криспаркл Майор Бегсток Лоутен 
dataset/Dataset/data/866680/table_0|0|89|персонаж|Герцог Мантуанский Риголетто Джильда Спарафучиле Маддалена Джованна Граф Монтероне Кавалер Марулло Маттео Борса Граф Чепрано Графиня Чепрано Офицер Паж герцогини 
