table_id|column_id|label_id|label|column_data
dataset/Dataset/data/4432458/table_0|0|102|провинция|Гуанси-Чжуанский АР Гуанси-Чжуанский АР Гуанси-Чжуанский АР Гуанси-Чжуанский АР Гуанси-Чжуанский АР Гуанси-Чжуанский АР Гуанси-Чжуанский АР Гуанси-Чжуанский АР Гуанси-Чжуанский АР Гуанси-Чжуанский АР Провинция Юньнань Гуанси-Чжуанский АР Гуанси-Чжуанский АР Гуанси-Чжуанский АР Гуанси-Чжуанский АР Гуанси-Чжуанский АР Гуанси-Чжуанский АР Гуанси-Чжуанский АР Гуанси-Чжуанский АР Гуанси-Чжуанский АР Гуанси-Чжуанский АР Гуанси-Чжуанский АР Гуанси-Чжуанский АР Гуанси-Чжуанский АР Гуанси-Чжуанский АР Гуанси-Чжуанский АР Гуанси-Чжуанский АР Гуанси-Чжуанский АР Гуанси-Чжуанский АР Гуанси-Чжуанский АР Гуанси-Чжуанский АР Гуанси-Чжуанский АР Провинция Юньнань Гуанси-Чжуанский АР Гуанси-Чжуанский АР Гуанси-Чжуанский АР Гуанси-Чжуанский АР Гуанси-Чжуанский АР Гуанси-Чжуанский АР Гуанси-Чжуанский АР Гуанси-Чжуанский АР Гуанси-Чжуанский АР Гуанси-Чжуанский АР Провинция Юньнань Гуанси-Чжуанский АР Провинция Юньнань Гуанси-Чжуанский АР Гуанси-Чжуанский АР Провинция Гуандун Гуанси-Чжуанский АР Гуанси-Чжуанский АР Гуанси-Чжуанский АР Гуанси-Чжуанский АР Провинция Юньнань Гуанси-Чжуанский АР Гуанси-Чжуанский АР Гуанси-Чжуанский АР Гуанси-Чжуанский АР Провинция Гуандун Гуанси-Чжуанский АР Гуанси-Чжуанский АР Гуанси-Чжуанский АР Гуанси-Чжуанский АР Гуанси-Чжуанский АР Гуанси-Чжуанский АР Гуанси-Чжуанский АР Гуанси-Чжуанский АР Гуанси-Чжуанский АР Провинция Юньнань Гуанси-Чжуанский АР Провинция Гуандун Провинция Гуандун Гуанси-Чжуанский АР Гуанси-Чжуанский АР Провинция Юньнань Гуанси-Чжуанский АР Гуанси-Чжуанский АР Провинция Юньнань Провинция Гуандун Гуанси-Чжуанский АР Гуанси-Чжуанский АР Гуанси-Чжуанский АР Провинция Юньнань Провинция Гуандун Провинция Юньнань Гуанси-Чжуанский АР Провинция Гуйчжоу Гуанси-Чжуанский АР Провинция Гуандун Гуанси-Чжуанский АР Гуанси-Чжуанский АР Гуанси-Чжуанский АР Остальной Китай 
dataset/Dataset/data/2156906/table_0|0|102|провинция|Булькиемде Сангие Сисили Зиро 
dataset/Dataset/data/711962/table_2|0|102|провинция|Алава Бискайя Гипускоа 
dataset/Dataset/data/7834301/table_0|7|102|провинция|1. Кьети 2. Л’Акуила 3. Пескара 4. Терамо Аоста 1. Бари м.г. 2. Барлетта-Андрия-Трани 3. Бриндизи 4. Лечче 5. Фоджа 6. Таранто 1. Матера 2. Потенца 1. Катандзаро 2. Козенца 3. Кротоне 4. Реджо-ди-Калабрия 5. Вибо-Валентия 1. Авеллино 2. Беневенто 3. Казерта 4. Неапольм.г. 5. Салерно 1. Болоньям.г. 2. Феррара 3. Форли-Чезена 4. Модена 5. Парма 6. Пьяченца 7. Равенна 8. Реджо-нель-Эмилия 9. Римини 1. Гориция 2. Порденоне 3. Триестм.г. 4. Удине 1. Фрозиноне 2. Латина 3. Риети 4. Римм.г. 5. Витербо 1. Генуям.г. 2. Империя 3. Специя 4. Савона 1. Бергамо 2. Брешиа 3. Комо 4. Кремона 5. Лекко 6. Лоди 7. Мантуя 8. Миланм.г. 9. Монца-э-Брианца 10. Павия 11. Сондрио 12. Варезе 1. Анкона 2. Асколи-Пичено 3. Фермо 4. Мачерата 5. Пезаро-э-Урбино 1. Кампобассо 2. Изерния 1. Алессандрия 2. Асти 3. Бьелла 4. Кунео 5. Новара 6. Туринм.г. 7. Вербано-Кузьо-Оссола 8. Верчелли 1. Кальярим.г. 2. Нуоро 3. Ористано 4. Сассари 5. Южная Сардиния 1. Агридженто 2. Кальтаниссетта 3. Катаниям.г. 4. Энна 5. Мессинам.г. 6. Палермом.г. 7. Рагуза 8. Сиракуза 9. Трапани 1. Больцано 2. Тренто 1. Ареццо 2. Флоренциям.г. 3. Гроссето 4. Ливорно 5. Лукка 6. Масса-Каррара 7. Пиза 8. Пистоя 9. Прато 10. Сиена 1. Перуджа 2. Терни 1. Беллуно 2. Падуя 3. Ровиго 4. Тревизо 5. Венециям.г. 6. Верона 7. Виченца 93 (107 — c 14 метрополитенскими городами) 
dataset/Dataset/data/2205565/table_0|1|102|провинция|Амнатчарен Бурирам Бынгкан (провинция) (создана в 2011 году) Каласин Кхонкэн Лей Махасаракхам Мукдахан Накхонпханом Накхонратчасима Нонгбуалампху Нонгкхай Ройет Саконнакхон Сисакет Сурин Убонратчатхани Удонтхани Чайяпхум Ясотхон Всего 
dataset/Dataset/data/1985333/table_2|3|102|провинция|Анзянг Биньзыонг Донгнай Лонган Куангнам Куангнинь Ниньбинь Нгеан Тханьхоа Зялай 
dataset/Dataset/data/2154403/table_2|1|102|провинция|Британская Колумбия Онтарио Квебек Онтарио Британская Колумбия 
dataset/Dataset/data/5188739/table_2|0|102|провинция|1 Качапоаль 1 Качапоаль 1 Качапоаль 1 Качапоаль 1 Качапоаль 1 Качапоаль 1 Качапоаль 1 Качапоаль 1 Качапоаль 1 Качапоаль 1 Качапоаль 1 Качапоаль 1 Качапоаль 1 Качапоаль 1 Качапоаль 1 Качапоаль 1 Качапоаль 2 Карденаль-Каро 2 Карденаль-Каро 2 Карденаль-Каро 2 Карденаль-Каро 2 Карденаль-Каро 2 Карденаль-Каро 3 Кольчагуа 3 Кольчагуа 3 Кольчагуа 3 Кольчагуа 3 Кольчагуа 3 Кольчагуа 3 Кольчагуа 3 Кольчагуа 3 Кольчагуа 3 Кольчагуа 
dataset/Dataset/data/4346779/table_0|2|102|провинция|Пусан Кёнсан-Пукто Чолла-Намдо Кёнсан-Пукто 
dataset/Dataset/data/1224812/table_0|1|102|провинция|Центральная Коппербелт Восточная Луапула Лусака Мучинга Северная Северо-Западная Южная Западная Всего 
dataset/Dataset/data/3009019/table_0|0|102|провинция|Кэйкидо Тюсэй-хокудо Тюсэй-нандо Дзэнра-хокудо Дзэнра-нандо Кэйсё-хокудо Кэйсё-нандо Кокайдо Хэйан-нандо Хэйан-хокудо Когэндо Канкё-нандо Канкё-хокудо Итого 
dataset/Dataset/data/202999/table_0|0|102|провинция|Чхунчхондо Канвондо Кёнгидо Кёнсандо Хамгёндо Хванхэдо Чолладо Пхёнандо 
dataset/Dataset/data/642386/table_1|1|102|провинция|Гориция Порденоне Триест Удине 
dataset/Dataset/data/1623810/table_8|3|102|провинция|Сураттани Трат Нонтхабури 
dataset/Dataset/data/1729011/table_0|2|102|провинция|Квебек Онтарио Онтарио Онтарио Квебек Альберта Ньюфаундленд и Лабрадор Альберта Квебек 
dataset/Dataset/data/1337842/table_0|0|102|провинция|Гуандун Хунань Ляонин Хубэй Шаньси Сычуань 
dataset/Dataset/data/8097179/table_2|1|102|провинция|Северная Голландия Южная Голландия Северный Брабант Оверэйссел Лимбург Утрехт Гелдерланд Гронинген Фрисландия 
dataset/Dataset/data/2602423/table_0|1|102|провинция|Ламбаеке (Lambayeque) Ферреньяфе (Ferreñafe) Чиклайо (Chiclayo) 
dataset/Dataset/data/2142309/table_0|1|102|провинция|Даниэль-Алькидес-Каррион (Daniel Alcides Carrión) Оксапампа (Oxapampa) Паско (Pasco) 
dataset/Dataset/data/2053444/table_0|1|102|провинция|Арекипа Камана Каравели Кастилья Кайльома Кондесуйос Ислай Ла-Уньон 
dataset/Dataset/data/4395090/table_0|1|102|провинция|Восточный Миндоро Западный Миндоро Мариндуке Палаван Ромблон 
dataset/Dataset/data/4232475/table_0|2|102|провинция|Ниньтхуан Ниньтхуан Ниньтхуан Ниньтхуан Ниньтхуан Ниньтхуан Ниньтхуан Ниньтхуан 
dataset/Dataset/data/7311677/table_2|2|102|провинция|Манитоба Альберта Онтарио Манитоба 
dataset/Dataset/data/707705/table_2|0|102|провинция|Алава Бискайя Гипускоа 
dataset/Dataset/data/2289787/table_0|1|102|провинция|Басилан Магинданао Сулу Тави-Тави Южный Ланао Всего 
dataset/Dataset/data/1079014/table_0|0|102|провинция|Онтарио Квебек Британская Колумбия Альберта Манитоба Саскачеван Новая Шотландия Нью-Брансуик Ньюфаундленд и Лабрадор Остров Принца Эдуарда Северо-Западные территории Юкон Нунавут Канада 
