table_id|column_id|label_id|label|column_data
dataset/Dataset/data/1345341/table_0|2|102|провинция|Онтарио Британская Колумбия Альберта Манитоба Саскачеван Новая Шотландия Нью-Брансуик Ньюфаундленд и Лабрадор Остров Принца Эдуарда Юкон 
dataset/Dataset/data/4121568/table_0|0|102|провинция|Анжу Артуа Беарн Берри Бигорр Бресс Бретань Бюже (фр.)русск. Веле Виваре Генеральные штаты Бургундии (фр.)русск. Дофине Жеводан Камбреси (фр.)русск. Керси Корсика Лабур Ла Марш Лангедок Лимузен Макон Марсан Мэн Небузан (фр.)русск. Нижняя Наварра Нормандия Овернь Орлеане Перигор Прованс Руэрг Суль (фр.)русск. Турень Фландрия Франш-Конте Фуа Четыре Долины (фр.)русск. Шароле Эльзас Эно 
dataset/Dataset/data/5187502/table_0|0|102|провинция|Барселона Таррагона Льейда Жирона 
dataset/Dataset/data/825626/table_2|0|102|провинция|1 Антофагаста 1 Антофагаста 1 Антофагаста 1 Антофагаста 2 Эль-Лоа 2 Эль-Лоа 2 Эль-Лоа 3 Токопилья 3 Токопилья 
dataset/Dataset/data/135045/table_0|0|102|провинция|Бергамо Брешиа Комо Кремона Лекко Лоди Мантуя Милан Монца-э-Брианца Павия Сондрио Варесе 
dataset/Dataset/data/1206335/table_1|0|102|провинция|Алдзник (арм. Աղձնիք) Айрарат (арм. Այրարատ) Арцах (арм. Արցախ) Высокая Армения, Бардзр Хайк(арм. Բարձր Հայք) Гугарк (арм. Գուգարք) Корчайк (арм. Կորճայք) Мокк (арм. Մոկք) Парскаайк, Нор Ширакан(арм. Պարսկահայք, Նոր Շիրական) Сюник (арм. Սյունիք) Тайк (арм. Տայք) Туруберан (арм. Տուրուբերան) Утик (арм. Ուտիք) Васпуракан (арм. Վասպուրական) Цопк, Четвёртая Армения (арм. Ծոփք, Չորրորդ Հայք) Пайтакаран (арм. Փայտակարան) Всего: 15 провинций (нахангов) 
dataset/Dataset/data/1505276/table_1|2|102|провинция|Центральная Симбу Истерн Хайлендс Восточная Новая Британия Восточный Сепик Энга Залив Маданг Манус Милн-Бей Моробе Новая Ирландия Оро Автономный регион Бугенвиль Саутерн-Хайлендс Западная (Флай) Уэстерн-Хайлендс Западная Новая Британия Сандаун (Западный Сепик) Национальный столичный округ Хела Дживака Всего 
dataset/Dataset/data/6232911/table_1|0|102|провинция|Манитоба Саскачеван Британская Колумбия Канада Альберта Онтарио Новая Шотландия Квебек Нью-Брансуик Ньюфаундленд и Лабрадор Остров Принца Эдуарда Команда по приглашению (Team Wildcard) Северное Онтарио Юкон/ Северо-Западные территории 
dataset/Dataset/data/1383412/table_0|1|102|провинция|Алессандрия Асти Бьелла Кунео Новара Турин Вербано-Кузьо-Оссола Верчелли всего 
dataset/Dataset/data/2699882/table_0|1|102|провинция|Центральная/Ува Северо-Западная/Северо-Центральная Ува/Восточная Восточная Сабарагамува/Ува Восточная Восточная/Ува Центральная/Северо-Центральная Северо-Центральная Северо-Центральная/Восточная Центральная Южная провинция Ува/Центральная Северо-Центральная Северо-Центральная Центральная Восточная Западная Центральная Северо-Центральная 
dataset/Dataset/data/743625/table_3|0|102|провинция|1Исла-де-Паскуа 2 Лос-Андес 2 Лос-Андес 2 Лос-Андес 2 Лос-Андес 3 Петорка 3 Петорка 3 Петорка 3 Петорка 3 Петорка 4 Кильота 4 Кильота 4 Кильота 4 Кильота 4 Кильота 5 Сан-Антонио 5 Сан-Антонио 5 Сан-Антонио 5 Сан-Антонио 5 Сан-Антонио 5 Сан-Антонио 6 Сан-Фелипе-де-Аконкагуа 6 Сан-Фелипе-де-Аконкагуа 6 Сан-Фелипе-де-Аконкагуа 6 Сан-Фелипе-де-Аконкагуа 6 Сан-Фелипе-де-Аконкагуа 6 Сан-Фелипе-де-Аконкагуа 7 Вальпараисо 7 Вальпараисо 7 Вальпараисо 7 Вальпараисо 7 Вальпараисо 7 Вальпараисо 7 Вальпараисо 8 Марга-Марга 8 Марга-Марга 8 Марга-Марга 8 Марга-Марга 
dataset/Dataset/data/5390708/table_0|3|102|провинция|Восточная, Центральная Восточная Прибрежная Прибрежная Рифт-Валли Прибрежная Ньянза 
dataset/Dataset/data/8539226/table_0|0|102|провинция|Гуандун Хунань Ляонин Хубэй Шаньси Сычуань 
dataset/Dataset/data/5187296/table_1|0|102|провинция|1 Айсен 1 Айсен 1 Айсен 2 Капитан-Прат 2 Капитан-Прат 2 Капитан-Прат 3 Койайке 3 Койайке 4 Хенераль-Каррера 4 Хенераль-Каррера 
dataset/Dataset/data/8265625/table_55|1|102|провинция|Альберта Британская Колумбия Саскачеван Остров Принца Эдуарда Северное Онтарио Квебек Манитоба Нью-Брансуик Ньюфаундленд и Лабрадор Новая Шотландия Онтарио 
dataset/Dataset/data/1303470/table_1|0|102|провинция|1 Антарктика-Чилена 1 Антарктика-Чилена 2 Магальянес 2 Магальянес 2 Магальянес 2 Магальянес 3 Тьерра-дель-Фуэго 3 Тьерра-дель-Фуэго 3 Тьерра-дель-Фуэго 4 Ультима-Эсперанса 4 Ультима-Эсперанса 
dataset/Dataset/data/896640/table_0|8|102|провинция|Рибатежу Бейра-Литорал Алту-Алентежу Бейра-Литорал Бейра-Алта Рибатежу Алту-Алентежу Бейра-Литорал Алгарве Бейра-Литорал Байшу-Алентежу Эштремадура Алгарве Байшу-Алентежу Траз-уж-Монтиш и Алту-Дору Рибатежу Алту-Алентежу Эштремадура Алгарве Эштремадура Эштремадура Бейра-Алта Рибатежу Байшу-Алентежу Рибатежу Алту-Алентежу Траз-уж-Монтиш и Алту-Дору Эштремадура Дору-Литорал Минью Бейра-Литорал Бейра-Литорал Бейра-Литорал Минью Траз-уж-Монтиш и Алту-Дору Дору-Литорал Алту-Алентежу Алту-Алентежу Эштремадура Дору-Литорал Байшу-Алентежу Минью Эштремадура Бейра-Литорал Байшу-Алентежу Бейра-Литорал Рибатежу Эштремадура Алту-Алентежу Траз-уж-Монтиш и Алту-Дору Минью Траз-уж-Монтиш и Алту-Дору Бейра-Литорал Бейра-Литорал Минью Дору-Литорал Траз-уж-Монтиш и Алту-Дору Алту-Алентежу Алту-Алентежу Минью Байшу-Алентежу Минью Минью Бейра-Алта Бейра-Литорал Минью Алту-Алентежу Бейра-Литорал Алгарве Дору-Литорал Рибатежу Бейра-Байша Бейра-Алта Бейра-Литорал Минью Минью Бейра-Алта Траз-уж-Монтиш и Алту-Дору Траз-уж-Монтиш и Алту-Дору Алгарве Траз-уж-Монтиш и Алту-Дору Рибатежу Траз-уж-Монтиш и Алту-Дору Траз-уж-Монтиш и Алту-Дору Бейра-Алта Алту-Алентежу Минью Бейра-Алта Бейра-Литорал Рибатежу Дору-Литорал Байшу-Алентежу Бейра-Алта Бейра-Байша Бейра-Литорал Минью Эштремадура Эштремадура Минью Алту-Алентежу Бейра-Литорал Траз-уж-Монтиш и Алту-Дору Бейра-Алта Рибатежу Эштремадура Бейра-Литорал Бейра-Байша Дору-Литорал Алту-Алентежу Байшу-Алентежу Бейра-Алта Алгарве Бейра-Байша Бейра-Литорал Бейра-Литорал Рибатежу Рибатежу Алту-Алентежу Байшу-Алентежу Алгарве Алгарве Траз-уж-Монтиш и Алту-Дору Бейра-Литорал Эштремадура Дору-Литорал Бейра-Литорал Алгарве Эштремадура Эштремадура Дору-Литорал Бейра-Алта Бейра-Алта Алту-Алентежу Бейра-Литорал Дору-Литорал Бейра-Байша Траз-уж-Монтиш и Алту-Дору Дору-Литорал Эштремадура Бейра-Литорал Бейра-Алта Траз-уж-Монтиш и Алту-Дору Минью Байшу-Алентежу Бейра-Литорал Траз-уж-Монтиш и Алту-Дору Бейра-Литорал Траз-уж-Монтиш и Алту-Дору Траз-уж-Монтиш и Алту-Дору Бейра-Алта Эштремадура Траз-уж-Монтиш и Алту-Дору Минью Траз-уж-Монтиш и Алту-Дору Бейра-Литорал Алту-Алентежу Эштремадура Алту-Алентежу Алгарви Байшу-Алентежу Алту-Алентежу Алту-Алентежу Бейра-Алта Траз-уж-Монтиш и Алту-Дору Бейра-Литорал Эштремадура Бейра-Алта Алту-Алентежу Эштремадура Бейра-Литорал Байшу-Алентежу Эштремадура Бейра-Байша Бейра-Литорал Бейра-Алта Бейра-Литорал Бейра-Литорал Алгарве Байшу-Алентежу Бейра-Литорал Эштремадура Эштремадура Бейра-Литорал Дору-Литорал Минью Дору-Литорал Эштремадура Траз-уж-Монтиш и Алту-Дору Бейра-Литорал Бейра-Алта Бейра-Байша Дору-Литорал Бейра-Алта Бейра-Литорал Эштремадура Бейра-Алта Минью Дору-Литорал Бейра-Литорал Минью Минью Рибатежу Алту-Алентежу Алту-Алентежу Алгарве Дору-Литорал Эштремадура Бейра-Байша Алту-Алентежу Алту-Алентежу Дору-Литорал Траз-уж-Монтиш и Алту-Дору Рибатежу Траз-уж-Монтиш и Алту-Дору Бейра-Алта Рибатежу Алгарви Бейра-Литорал Траз-уж-Монтиш и Алту-Дору Бейра-Алта Бейра-Алта Дору-Литорал Траз-уж-Монтиш и Алту-Дору Рибатежу Дору-Литорал Байшу-Алентежу Рибатежу Бейра-Алта Бейра-Литорал Эштремадура Бейра-Алта Эштремадура Бейра-Алта Минью Бейра-Алта Байшу-Алентежу Бейра-Байша Эштремадура Алгарви Байшу-Алентежу Эштремадура Дору-Литорал Эштремадура Алту-Алентежу Бейра-Литорал Бейра-Литорал Траз-уж-Монтиш и Алту-Дору Алгарве Бейра-Алта Минью Рибатежу Бейра-Алта Траз-уж-Монтиш и Алту-Дору Эштремадура Рибатежу Бейра-Алта Дору-Литорал Алгарве Минью Дору-Литорал Байшу-Алентежу Рибатежу Бейра-Литорал Бейра-Алта Бейра-Литорал Бейра-Алта Траз-уж-Монтиш и Алту-Дору Алту-Алентежу Бейра-Байша Траз-уж-Монтиш и Алту-Дору Рибатежу Алту-Алентежу Алту-Алентежу Рибатежу Дору-Литорал Минью Бейра-Литорал Алту-Алентежу 
dataset/Dataset/data/745309/table_1|1|102|провинция|Жужуй, Сальта, Тукуман, Катамарка, Ла-Риоха Формоса, Чако, Сантьяго-дель-Эстеро Мисьонес, Энтре-Риос, Корриентес Сан-Хуан, Мендоса, Сан-Луис Кордова, Санта-Фе, Ла-Пампа, Буэнос-Айрес Рио-Негро, Неукен, Чубут, Санта-Крус, Огненная Земля 
dataset/Dataset/data/6272775/table_0|1|102|провинция|Фрисландия Утрехт Оверэйссел Зеландия Лимбург Зеландия Зеландия Северный Брабант Гелдерланд Северный Брабант Лимбург Северный Брабант Зеландия Северный Брабант Зеландия Южная Голландия Зеландия Зеландия Фрисландия Гронинген Гелдерланд Северный Брабант Оверэйссел Гелдерланд Лимбург Гелдерланд Северный Брабант Северный Брабант Северный Брабант Гелдерланд Гелдерланд Гелдерланд Северный Брабант Гелдерланд Фрисландия Гелдерланд Оверэйссел Гелдерланд Зеландия Зеландия Оверэйссел Лимбург Северная Голландия Южная Голландия Южная Голландия Оверэйссел Зеландия Оверэйссел Утрехт Лимбург Гелдерланд Зволле Северная Голландия Северная Голландия Утрехт Оверэйссел Лимбург Гелдерланд Утрехт Южная Голландия Фрисландия Южная Голландия Северный Брабант Южная Голландия Оверэйссел Южная Голландия Лимбург Южная Голландия Гелдерланд Южная Голландия Южная Голландия Северный Брабант Фрисландия Северная Голландия Зеландия Лимбург Северная Голландия Северная Голландия Фрисландия Гелдерланд Гелдерланд Утрехт Утрехт Зеландия Северный Брабант Северная Голландия Южная Голландия Южная Голландия Лимбург Гелдерланд Гелдерланд Зеландия Гелдерланд Северный Брабант Южная Голландия Оверэйссел 
dataset/Dataset/data/81247/table_0|1|102|провинция|Кальяри Нуоро Ористано Сассари Южная Сардиния 
dataset/Dataset/data/7280881/table_5|5|102|провинция|Саскачеван Альберта Британская Колумбия Саскачеван Новая Шотландия Альберта Квебек Британская Колумбия Онтарио Саскачеван 
dataset/Dataset/data/2909532/table_0|2|102|провинция|Эдзо Муцу Муцу Муцу Муцу Муцу Муцу Муцу Муцу Муцу Муцу Муцу Муцу Муцу Муцу Муцу Дэва Дэва Дэва Дэва Дэва Дэва Дэва Дэва Дэва Этиго Этиго Этиго Этиго Этиго Этиго 
dataset/Dataset/data/1118273/table_0|0|102|провинция|Ганьсу Ганьсу Гуйчжоу Гуйчжоу Гуйчжоу Хубэй Хунань Гирин Цинхай Цинхай Цинхай Цинхай Цинхай Цинхай Сычуань Сычуань Сычуань Синьцзян-Уйгурский автономный район Синьцзян-Уйгурский автономный район Синьцзян-Уйгурский автономный район Синьцзян-Уйгурский автономный район Синьцзян-Уйгурский автономный район Юньнань Юньнань Юньнань Юньнань Юньнань Юньнань Юньнань Юньнань 
dataset/Dataset/data/3600712/table_0|4|102|провинция|Альберта Альберта Альберта Альберта Альберта Альберта Альберта Альберта Альберта Альберта Альберта Альберта Альберта Альберта Альберта Альберта Альберта Альберта Альберта Альберта Альберта Альберта Альберта Альберта Альберта Альберта Альберта Альберта Британская Колумбия Британская Колумбия Британская Колумбия Британская Колумбия Британская Колумбия Британская Колумбия Британская Колумбия Британская Колумбия Британская Колумбия Британская Колумбия Британская Колумбия Британская Колумбия Британская Колумбия Британская Колумбия Британская Колумбия Британская Колумбия Британская Колумбия Британская Колумбия Британская Колумбия Британская Колумбия Британская Колумбия Британская Колумбия Британская Колумбия Британская Колумбия Британская Колумбия Британская Колумбия Британская Колумбия Британская Колумбия Британская Колумбия Британская Колумбия Британская Колумбия Британская Колумбия Британская Колумбия Британская Колумбия Британская Колумбия Британская Колумбия Квебек Квебек Квебек Квебек Квебек Квебек Квебек Квебек Квебек Квебек Квебек Квебек Квебек Квебек Квебек Квебек Квебек Квебек Квебек Квебек Квебек Квебек Квебек Квебек Квебек Квебек Квебек Квебек Квебек Квебек Квебек Квебек Квебек Квебек Квебек Квебек Квебек Квебек Квебек Квебек Квебек Квебек Квебек Квебек Квебек Квебек Квебек Квебек Квебек Квебек Квебек Квебек Квебек Квебек Квебек Квебек Квебек Квебек Квебек Квебек Квебек Квебек Квебек Квебек Квебек Квебек Квебек Квебек Квебек Квебек Квебек Квебек Квебек Квебек Квебек Манитоба Манитоба Манитоба Манитоба Манитоба Манитоба Манитоба Манитоба Манитоба Манитоба Манитоба Манитоба Манитоба Манитоба Новая Шотландия Новая Шотландия Новая Шотландия Новая Шотландия Новая Шотландия Новая Шотландия Новая Шотландия Новая Шотландия Новая Шотландия Новая Шотландия Новая Шотландия Нью-Брансуик Нью-Брансуик Нью-Брансуик Нью-Брансуик Нью-Брансуик Нью-Брансуик Нью-Брансуик Нью-Брансуик Нью-Брансуик Нью-Брансуик Ньюфаундленд и Лабрадор Ньюфаундленд и Лабрадор Ньюфаундленд и Лабрадор Ньюфаундленд и Лабрадор Ньюфаундленд и Лабрадор Ньюфаундленд и Лабрадор Ньюфаундленд и Лабрадор Онтарио Онтарио Онтарио Онтарио Онтарио Онтарио Онтарио Онтарио Онтарио Онтарио Онтарио Онтарио Онтарио Онтарио Онтарио Онтарио Онтарио Онтарио Онтарио Онтарио Онтарио Онтарио Онтарио Онтарио Онтарио Онтарио Онтарио Онтарио Онтарио Онтарио Онтарио Онтарио Онтарио Онтарио Онтарио Онтарио Онтарио Онтарио Онтарио Онтарио Онтарио Онтарио Онтарио Онтарио Онтарио Онтарио Онтарио Онтарио Онтарио Онтарио Онтарио Онтарио Онтарио Онтарио Онтарио Онтарио Онтарио Онтарио Онтарио Онтарио Онтарио Онтарио Онтарио Онтарио Онтарио Онтарио Онтарио Онтарио Онтарио Онтарио Онтарио Онтарио Онтарио Онтарио Онтарио Онтарио Онтарио Онтарио Онтарио Онтарио Онтарио Онтарио Онтарио Онтарио Онтарио Онтарио Онтарио Онтарио Онтарио Онтарио Онтарио Онтарио Онтарио Онтарио Онтарио Онтарио Онтарио Онтарио Онтарио Онтарио Онтарио Онтарио Онтарио Онтарио Онтарио Онтарио Онтарио Остров Принца Эдуарда Остров Принца Эдуарда Остров Принца Эдуарда Остров Принца Эдуарда Саскачеван Саскачеван Саскачеван Саскачеван Саскачеван Саскачеван Саскачеван Саскачеван Саскачеван Саскачеван Саскачеван Саскачеван Саскачеван Саскачеван Нунавут Северо-Западные территории Юкон 
dataset/Dataset/data/1267700/table_1|0|102|провинция|1 Антарктика-Чилена 1 Антарктика-Чилена 2 Магальянес 2 Магальянес 2 Магальянес 2 Магальянес 3 Тьерра-дель-Фуэго 3 Тьерра-дель-Фуэго 3 Тьерра-дель-Фуэго 4 Ультима-Эсперанса 4 Ультима-Эсперанса 
