table_id|column_id|label_id|label|column_data
dataset/Dataset/data/7877957/table_0|3|114|район|Волоколамский Волоколамский Волоколамский Волоколамский Волоколамский Волоколамский Волоколамский Волоколамский Воскресенский Воскресенский Воскресенский Воскресенский Воскресенский Воскресенский Дмитровский Дмитровский Дмитровский Дмитровский Дмитровский Дмитровский Дмитровский Дмитровский Дмитровский Дмитровский Дмитровский Егорьевский Егорьевский Егорьевский Егорьевский Егорьевский Зарайский Зарайский Зарайский Зарайский Зарайский Истринский Истринский Истринский Истринский Истринский Истринский Истринский Истринский Истринский Истринский Истринский Истринский Истринский Истринский Каширский Каширский Каширский Каширский Каширский Каширский Каширский Клинский Клинский Клинский Клинский Клинский Клинский Клинский Клинский Коломенский Коломенский Коломенский Коломенский Коломенский Коломенский Коломенский Коломенский Коломенский Красногорский Красногорский Красногорский Красногорский Ленинский Ленинский Ленинский Ленинский Ленинский Ленинский Ленинский Ленинский Ленинский Ленинский Ленинский Ленинский Ленинский Ленинский Лотошинский Лотошинский Лотошинский Луховицкий Луховицкий Луховицкий Луховицкий Луховицкий Луховицкий Луховицкий Луховицкий Люберецкий Люберецкий Люберецкий Люберецкий Люберецкий Можайский Можайский Можайский Можайский Можайский Можайский Можайский Можайский Можайский Можайский Можайский Мытищинский Мытищинский Мытищинский Наро-Фоминский Наро-Фоминский Наро-Фоминский Наро-Фоминский Наро-Фоминский Наро-Фоминский Наро-Фоминский Наро-Фоминский Наро-Фоминский Наро-Фоминский Наро-Фоминский Наро-Фоминский Наро-Фоминский Наро-Фоминский Ногинский Ногинский Ногинский Ногинский Ногинский Ногинский Ногинский Ногинский Ногинский Ногинский Одинцовский Одинцовский Одинцовский Одинцовский Одинцовский Одинцовский Одинцовский Одинцовский Одинцовский Одинцовский Одинцовский Одинцовский Одинцовский Одинцовский Одинцовский Одинцовский Озёрский Озёрский Озёрский Орехово-Зуевский Орехово-Зуевский Орехово-Зуевский Орехово-Зуевский Орехово-Зуевский Орехово-Зуевский Орехово-Зуевский Орехово-Зуевский Орехово-Зуевский Орехово-Зуевский Орехово-Зуевский Орехово-Зуевский Орехово-Зуевский Павлово-Посадский Павлово-Посадский Павлово-Посадский Павлово-Посадский Павлово-Посадский Павлово-Посадский Подольский Подольский Подольский Подольский Подольский Подольский Подольский Подольский Подольский Подольский Подольский Пушкинский Пушкинский Пушкинский Пушкинский Пушкинский Пушкинский Пушкинский Пушкинский Пушкинский Пушкинский Раменский Раменский Раменский Раменский Раменский Раменский Раменский Раменский Раменский Раменский Раменский Раменский Раменский Раменский Раменский Раменский Раменский Раменский Раменский Раменский Раменский Рузский Рузский Рузский Рузский Рузский Рузский Рузский Сергиево-Посадский Сергиево-Посадский Сергиево-Посадский Сергиево-Посадский Сергиево-Посадский Сергиево-Посадский Сергиево-Посадский Сергиево-Посадский Сергиево-Посадский Сергиево-Посадский Сергиево-Посадский Сергиево-Посадский Серебряно-Прудский Серебряно-Прудский Серебряно-Прудский Серебряно-Прудский Серпуховский Серпуховский Серпуховский Серпуховский Серпуховский Серпуховский Серпуховский Солнечногорский Солнечногорский Солнечногорский Солнечногорский Солнечногорский Солнечногорский Солнечногорский Солнечногорский Солнечногорский Солнечногорский Солнечногорский Ступинский Ступинский Ступинский Ступинский Ступинский Ступинский Ступинский Талдомский Талдомский Талдомский Талдомский Талдомский Талдомский Талдомский Талдомский Чеховский Чеховский Чеховский Чеховский Чеховский Шатурский Шатурский Шатурский Шатурский Шатурский Шатурский Шатурский Шаховской Шаховской Шаховской Шаховской Щёлковский Щёлковский Щёлковский Щёлковский Щёлковский Щёлковский Щёлковский Щёлковский Щёлковский Щёлковский 
dataset/Dataset/data/7905797/table_0|0|114|район|Аргаяшский Каслинский Красноармейский Кунашакский Кыштымский Сосновский Далматовский Катайский 
dataset/Dataset/data/794979/table_1|0|114|район|Каларский Нюкжинский Тунгокоченский Тунгиро-Олёкминский 
dataset/Dataset/data/795788/table_0|0|114|район|Козловский Лихославльский Максатихинский Новокарельский Рамешковский 
dataset/Dataset/data/8175099/table_0|5|114|район|Шанхай Аньхой Фуцзянь Цзянсу Шаньдун Цзянси Чжэцзян Пекин Таньцзинь Хэбэй Шаньси Внутренняя Монголия Хэйлунцзян Гирин Ляонин Ганьсу Цинхай Шэньси Синьцзян Нинся Гуандун Хайнань Хэнань Хубэй Хунань Гуанси Гонконг Макао Чунцин Гуйчжоу Сычуань Юньнань Тибет 
dataset/Dataset/data/8180153/table_1|2|114|район|Анадырский (центр — посёлок Ново-Марьинский), Большерецкий (из бывших Соболевской и Большерецкой волостей; центр — село Большерецк), Карагинский (центр — село Тиличики), Пенжинский (центр — село Каменское), Петропавловский (город Петропавловск-Камчатский), Усть-Камчатский (центр — село Усть-Камчатское), Тигильский (центр — село Тигиль), Чукотский (центр — пост Уэлен) 
dataset/Dataset/data/8180157/table_4|0|114|район|Иркутск Ангарск Бодайбо Братск Зима Нижнеудинск Тайшет Тулун Усолье-Сибирское Усть-Кут Черемхово Шелехов Бодайбинский Братский Жигаловский Заларинский Зиминский Иркутский Казачинско-Ленский Катангский Качугский Киренский Куйтунский Мамско-Чуйский Нижне-Илимский Нижнеудинский Ольхонский аймак Слюдянский Тайшетский Тулунский Усольский Усть-Кутский Усть-Удинский Черемховский Чунский Аймак Аларский Боханский Эхирит-Булагатский 
dataset/Dataset/data/8369166/table_0|3|114|район|Петушинский Кольчугинский Александровский Киржачский 
dataset/Dataset/data/859360/table_0|2|114|район|Александровский Амвросиевский Бахмутский Великоновоселковский Волновахский Добропольский Константиновский Покровский Лиманский Мангушский Марьинский Никольский Новоазовский Славянский Старобешевский Тельмановский Шахтёрский Ясиноватский 
dataset/Dataset/data/8691645/table_0|0|114|район|Аргаяшский Каслинский Красноармейский Кунашакский Кыштымский Сосновский Далматовский Катайский 
dataset/Dataset/data/869608/table_1|1|114|район|Анадырский Беринговский Билибинский Иультинский Провиденский Чаунский Чукотский Шмидтовский 
dataset/Dataset/data/8726397/table_1|1|114|район|Майкопский Архаринский Зейский Магдагачинский Мазановский Селемджинский Сковородинский Тындинский Шимановский Лешуконский Мезенский Онежский Баргузинский Еравнинский Муйский Северо-Байкальский Каларский Красночикойский Могочинский Сретенский Тунгиро-Олёкминский Тунгокоченский Братский Жигаловский Казачинско-Ленский Киренский Мамско-Чуйский Нижнеилимский Тайшетский Усть-Илимский Усть-Кутский Чунский Зольский Лескенский Майский Нальчик Прохладненский Прохладный Терский Урванский Чегемский Черекский Эльбрусский Алеутский Быстринский Елизовский Карагинский Мильковский Олюторский Пенжинский Соболевский Тигильский Усть-Большерецкий Усть-Камчатский Княжпогостский Троицко-Печорский Богучанский Енисейский Кежемский Мотыгинский Северо-Енисейский Туруханский Эвенкийский Омсукчанский Северо-Эвенский Среднеканский Сусуманский Тенькинский Хасынский Ягоднинский Заполярный Горнозаводский Косинский Кочёвский Красновишерский Чердынский Юсьвинский Дальнереченский Кировский Октябрьский Ольгинский Партизанский Пожарский Тернейский район Ханкайский Черниговский Псковский Кинель-Черкасский Таборинский Александровский Верхнекетский Каргасокский Колпашевский Парабельский Уватский Амурский Аяно-Майский Ванинский Верхнебуреинский имени Полины Осипенко Комсомольский Нанайский Николаевский Охотский Советско-Гаванский Солнечный Тугуро-Чумиканский Ульчский Бейский Таштыпский район Белоярский Берёзовский Кондинский Нефтеюганский Нижневартовский Октябрьский Советский Сургутский Ханты-Мансийский Анадырский Билибинский Иультинский Провиденский Чаунский Чукотский Аллаиховский Верхнеколымский Жиганский Кобяйский Ленский Мегино-Кангаласский Мирнинский Нерюнгринский Оймяконский Оленёкский Таттинский Усть-Алданский Усть-Майский Надымский Пуровский Тазовский Ямальский 
dataset/Dataset/data/88862/table_2|1|114|район|Северный район Ленинградско-Карельский район Западный район Центрально-Промышленный район Центрально-Чернозёмный район Вятский район Уральская область Башкирская АССР Средне-Волжский район Нижне-Волжский район Калмыцкая АО Крымская АССР Северо-Кавказский край Дагестанская АССР Казахская АССР Киргизская АССР Сибирский край Бурят-Монгольская АССР Якутская АССР Дальневосточный край Всего 
dataset/Dataset/data/895805/table_3|2|114|район|Горнозаводский Втузгородок Вторчермет Южный (бывш. посёлок Пивзавода) Пионерский Вторчермет Южный,Сибирский Эльмаш Южный Вторчермет пос. Кольцово Уралмаш Сибирский Уралмаш Лечебный Вокзальный Уралмаш Сортировочный Эльмаш Уралмаш Уралмаш Уктусский Уралмаш Уралмаш Эльмаш Елизавет Уралмаш Уралмаш Уралмаш Уралмаш Эльмаш Семь Ключей Изоплит Эльмаш Сосновый бор Сосновый бор Сортировочный Уралмаш Вторчермет Вторчермет Эльмаш Уралмаш Семь Ключей Центральный Втузгородок Уралмаш Уралмаш Визовский Втузгородок Эльмаш Юго-Западный Эльмаш Палкино Уралмаш Изоплит Изоплит Уралмаш Уралмаш Елизавет Шарташский Уралмаш Уктусский Семь Ключей Пионерский Нижнеисетский Семь Ключей Семь Ключей Нижне-Исетский Горнозаводской Эльмаш Семь Ключей Юго-Западный Уралмаш Эльмаш Уралмаш Семь Ключей Уралмаш Шарташский Вокзальный Уралмаш Елизавет Вторчермет Вторчермет Вторчермет Уралмаш Центральный Эльмаш Семь Ключей Пионерский Эльмаш Семь Ключей ВИЗ Шарташский Центральный Втузгородок Центральный Центральный Эльмаш Центральный Уралмаш Эльмаш Нижнеисетский Южный Заречный Сибирский Центральный Южный промышленный Семь Ключей Шарташский 
dataset/Dataset/data/895805/table_3|1|114|район|Железнодорожный Кировский Чкаловский Октябрьский Кировский Чкаловский Октябрьский Орджоникидзеский Ленинский Чкаловский Кольцовский пос. совет Орджоникидзевский Октябрьский Орджоникидзевский Октябрьский Железнодорожный Орджоникидзевский Чкаловский Верх-Исетский Орджоникидзевский Орджоникидзевский Чкаловский Орджоникидзевский Орджоникидзевский Чкаловский Орджоникидзевский Орджоникидзевский Орджоникидзевский Орджоникидзевский Орджоникидзевский Орджоникидзевский Орджоникидзевский Орджоникидзевский Железнодорожный Кировский Орджоникидзевский Орджоникидзевский Орджоникидзевский Чкаловский Чкаловский Орджоникидзевский Орджоникидзевский Железнодорожный Октябрьский Кировский Орджоникидзевский Орджоникидзевский Верх-Исетский Кировский Орджоникидзевский Верх-Исетский Орджоникидзевский Железнодорожный Орджоникидзевский Кировский Кировский Орджоникидзевский Орджоникидзевский Кировский Орджоникидзевский Чкаловский Железнодорожный Кировский Чкаловский Железнодорожный Железнодорожный Верх-Исетский Чкаловский Железнодорожный Орджоникидзевский Железнодорожный Ленинский Орджоникидзевский Орджоникидзевский Орджоникидзевский Железнодорожный Орджоникидзевский Кировский Железнодорожный Орджоникидзевский Октябрьский Орджоникидзевский Ленинский Орджоникидзевский Железнодорожный Железнодорожный Орджоникидзевский Железнодорожный Верх-Исетский Кировский Ленинский Кировский Верх-Исетский Ленинский Орджоникидзевский Ленинский Кировский Орджоникидзевский Орджоникидзевский Чкаловский Ленинский Верх-Исетский Октябрьский Ленинский Железнодорожный Кировский 
dataset/Dataset/data/895805/table_5|2|114|район|Медный Академический, Широкая Речка Академический Академический Медный Академический Широкая Речка Медный Академический Широкая Речка Академический Компрессорный Академический Академический 
dataset/Dataset/data/895805/table_5|1|114|район|Верх-Исетский Верх-Исетский Ленинский Верх-Исетский Верх-Исетский Верх-Исетский, Ленинский Верх-Исетский Верх-Исетский Ленинский Ленинский Верх-Исетский Верх-Исетский Верх-Исетский Верх-Исетский Верх-Исетский Ленинский Октябрьский Ленинский Верх-Исетский Верх-Исетский Верх-Исетский 
dataset/Dataset/data/935138/table_0|0|114|район|Степанакерт (Ханкенди) Аскеранский Гадрутский Мартакертский Мартунинский Шаумяновский Шушинский Кашатагский 
