table_id|column_id|label_id|label|column_data
dataset/Dataset/data/5886704/table_1|2|114|район|Архангельский дивизионный район ПВО Архангельский дивизионный район ПВО 78-я дивизия ПВО 78-я дивизия ПВО 78-я дивизия ПВО 1-я воздушная истребительная армия ПВО 1-я воздушная истребительная армия ПВО 19-я воздушная истребительная армия ПВО 22-я воздушная истребительная армия ПВО 
dataset/Dataset/data/5887139/table_1|2|114|район|Архангельский дивизионный район ПВО Пензенский бригадный район ПВО Грозненский дивизионный район ПВО Грозненский дивизионный район ПВО Грозненский дивизионный район ПВО Грозненский дивизионный район ПВО 88-я дивизия ПВО 10-й корпус ПВО 11-й корпус ПВО 11-й корпус ПВО 11-й корпус ПВО 85-я дивизия ПВО 85-я дивизия ПВО 85-я дивизия ПВО 21-я воздушная истребительная армия ПВО 34-я воздушная армия 24-я воздушная армия61-й гвардейский истребительный авиационный корпус 16-я воздушная армия61-й гвардейский истребительный авиационный корпус ВВС ГСВГ 71-й истребительный авиационный корпус 16-я воздушная армия 16-я воздушная армия 
dataset/Dataset/data/5923963/table_0|2|114|район|Сталинградский дивизионный район ПВО Сталинградский корпусной район ПВО Сталинградский корпусной район ПВО Сталинградский корпусной район ПВО Сталинградский корпусной район ПВО Сталинградский корпусной район ПВО Сталинградский корпусной район ПВО 
dataset/Dataset/data/5926255/table_0|2|114|район|Бологоевский дивизионный район ПВО Бологоевский дивизионный район ПВО Бологоевский дивизионный район ПВО 2-й корпус ПВО 4-й корпус ПВО 4-й корпус ПВО 4-й корпус ПВО 19-я воздушная истребительная армия ПВО 33-й истребительный авиационный корпус ПВО 88-й истребительный авиационный корпус ПВО 64-я воздушная истребительная армия ПВО 
dataset/Dataset/data/592770/table_0|4|114|район|Нижегородский Нижегородский Автозаводский Автозаводский Канавинский Сормовский Сормовский 
dataset/Dataset/data/606855/table_0|4|114|район|6 4 7 8 4 6 6 6 7 4 8 7 4 7 4 4 5 3 7 5 3 4 5 3 10 4 10 
dataset/Dataset/data/6161160/table_1|2|114|район|10-й корпус ПВО 11-й корпус ПВО 11-й корпус ПВО 21-я воздушная истребительная армия ПВО 21-я воздушная истребительная армия ПВО 66-я воздушная истребительная армия ПВО 32-я воздушная истребительная армия ПВО 
dataset/Dataset/data/624290/table_12|0|114|район|Материковый Степной крымский Подгорный Горный 
dataset/Dataset/data/6383501/table_0|5|114|район|Дрогичинский Докшицкий Бешенковичский(центр района) Крупский Сенненский Оршанский (с 2013); город Орша (до 2013) Берестовицкий(центр района) Гомельский город Новополоцк Брагинский(центр района) Полоцкий Браславский Вороновский(центр района) Поставский Глусский(центр района) Несвижский Барановичский Брестский Дрибинский(центр района) Городокский Осиповичский Щучинский Речицкий Смолевичский Зельвенский(центр района) Воложинский Дятловский Брагинский Петриковский Оршанский Кореличский(центр района) Кормянский(центр района) Железнодорожный (город Гомель) Толочинский Солигорский Краснопольский(центр района) Волковысский Мядельский Лельчицкий(центр района) Лиозненский(центр района) Пинский Лоевский(центр района) Поставский Новогрудский Минский Кореличский Мядельский Дятловский Шумилинский Калинковичский Октябрьский(центр района) Оршанский Верхнедвинский Щучинский Светлогорский Логойский Глубокский Свислочский Пуховичский Молодечненский Вороновский Столинский Россонский(центр района) Волковысский Пуховичский Пружанский Мядельский Пуховичский Червенский Гродненский Светлогорский Солигорский Жлобинский Витебский Осиповичский Ивацевичский Добрушский Буда-Кошелёвский Любанский Ушачский(центр района) Крупский Хотимский(центр района) Шарковщинский(центр района) Пружанский Шумилинский(центр района) Ивьевский Витебский 
dataset/Dataset/data/6452366/table_0|1|114|район|Монако Монте-Карло Сен-Роман Ларвотто Сен-Мишель Ла-Кондамин Ла-Колль Ле-Ревуар Монегетти Фонвьей Ле-Портье Княжество Монако 
dataset/Dataset/data/6488609/table_15|2|114|район|Бусский Старосамборский 
dataset/Dataset/data/6488609/table_6|2|114|район|Апостоловский Апостоловский Апостоловский Васильковский Васильковский Васильковский Васильковский Верхнеднепровский Днепровский Днепровский Днепровский Криворожский Криворожский Криворожский Криворожский Криворожский Криворожский Криворожский Криворожский Криворожский Криничанский Криничанский Криничанский Криничанский Криничанский Криничанский Криничанский Криничанский Криничанский Криничанский Магдалиновский Магдалиновский Магдалиновский Магдалиновский Межевский Межевский Межевский Межевский Никопольский Никопольский Никопольский Никопольский Новомосковский Новомосковский Новомосковский Новомосковский Новомосковский Павлоградский Павлоградский Петриковский Петриковский Петриковский Петропавловский Петропавловский Покровский Покровский Покровский Покровский Покровский Пятихатский Пятихатский Пятихатский Пятихатский Пятихатский Синельниковский Синельниковский Синельниківський Солонянский Солонянский Солонянский Солонянский Солонянский Солонянский Солонянский Солонянский Солонянский Солонянский Солонянский Солонянский Солонянский Солонянский Софиевский Софиевский Софиевский Томаковский Томаковский Томаковский Широковский Широковский Широковский Широковский Широковский Юрьевский Днепродзержинский городской округ Днепропетровский городской округ городской округ Орджоникидзе 
dataset/Dataset/data/6488884/table_10|2|114|район|Бердянский Бердянский Васильевский Весёловский Вольнянский Вольнянский Вольнянский Вольнянский Вільнянський Вольнянский Гуляйпольский Гуляйпольский Гуляйпольский Запорожский Запорожский Запорожский Запорожский Каменско-Днепровский Каменско-Днепровский Бильмакский Бильмакский Бильмакский Мелитопольский Михайловский Ореховский Ореховский Ореховский Ореховский Пологовский Пологовский Пологовский Приазовский Приморский Приморский Розовский Розовский Розовский Розовский Токмакский Токмакский Токмакский Токмакский Токмакский Черниговский Черниговский Акимовский Акимовский Акимовский 
dataset/Dataset/data/6488884/table_12|2|114|район|Бобринецкий Бобринецкий Бобринецкий Бобринецкий Бобринецкий Бобринецкий Бобринецкий Ольшанский Гайворонский Гайворонский Гайворонский Голованевский Голованевский Долинский Долинский Долинский Кировоградский Маловисковский Маловисковский Маловисковский Маловисковский Маловисковский Маловисковский Новомиргородский Новомиргородский Новоукраинский Новоукраинский Александрийский Александрийский Александрийский Александрийский Александрийский Онуфриевский Петровский Светловодский Светловодский Ульяновский Устиновский Устиновский Устиновский Устиновский Кировоградский городской совет Александрийский городской совет 
dataset/Dataset/data/6488884/table_15|2|114|район|Бусский Старосамборский 
dataset/Dataset/data/6488884/table_25|2|114|район|Волочисский Волочисский Дережнянский Дунаевецкий Изяславский Каменец-Подольский Красиловский Красиловский Красиловский Красиловский Новоушицкий Полонский Староконстантиновский Старосинявский Теофипольский Теофипольский Хмельницкий Чемеровецкий 
dataset/Dataset/data/6488884/table_27|2|114|район|Герцаевский 
dataset/Dataset/data/6569492/table_5|0|114|район|Кошехабльский Красногвардейский Понежукайский Тахтамукайский Шовгеновский 
dataset/Dataset/data/6841551/table_0|2|114|район|г. Стародуб, р. Десна. с. Старая Гута. п. Лесное. Красная Полоса, Подровное. 
dataset/Dataset/data/6848594/table_1|2|114|район|Сталинградский корпусной район ПВО Сталинградский корпусной район ПВО Северо-Кавказский дивизионный район ПВО Северо-Кавказский дивизионный район ПВО Северо-Кавказский дивизионный район ПВО 
dataset/Dataset/data/6964518/table_0|3|114|район|Минск, Могилёв 
dataset/Dataset/data/6993134/table_1|0|114|район|Индустриальный Ленинский Октябрьский Первомайский Устиновский 
dataset/Dataset/data/6994577/table_0|0|114|район|Внутреннее Японское море Оминато Филиппинские острова Сингапур 
dataset/Dataset/data/6994579/table_1|0|114|район|Японские острова и острова Рюкю Формоза юго-западный район Китай 
dataset/Dataset/data/7356048/table_7|0|114|район|Гиагинский Кошехабльский Красногвардейский Майкопский Тахтамукайский Теучежский Шовгеновский 
dataset/Dataset/data/7356048/table_9|0|114|район|Майкоп Адыгейск Гиагинский Кошехабльский Красногвардейский Майкопский Тахтамукайский Теучежский Шовгеновский 
dataset/Dataset/data/735792/table_1|1|114|район|Пхранакхон (Phra Nakhon District) Дусит (Dusit District) Нонгчок (Nong Chok District) Банграк (Bang Rak District) Бангкхен (Bang Khen District) Бангкапи (Bang Kapi District) Патхумван (Pathum Wan District) Помпрапсаттрупхай (Pom Prap Sattru Phai District) Пхракханонг (Phra Khanong District) Минбури (Min Buri District) Латкрабанг (Lat Krabang District) Яннава (Yan Nawa District) Сампхантхавонг (Samphanthawong District) Пхаятхай (Phaya Thai District) Тхонбури (Thon Buri District) Бангкок Яй (Bangkok Yai District) Хуайкхванг (Huai Khwang District) Кхлонгсан (Khlong San District) Талингчан (Taling Chan District) Бангкок Ной (Bangkok Noi District) Бангкхунтхиан (Bang Khun Thian District) Пхасичарен (Phasi Charoen District) Нонгкхем (Nong Khaem District) Ратбурана (Rat Burana District) Бангпхлат (Bang Phlat District) 
dataset/Dataset/data/735792/table_1|5|114|район|Динденг (Din Daeng District) Бынгкум (Bueng Kum District) Сатхон (Sathon District) Бангсы (Bang Sue District) Чатучак (Chatuchak District) Бангкхолем (Bang Kho Laem District) Правеет (Prawet District) Кхлонгтей (Khlong Toei District) Суанлуанг (Suan Luang District) Чомтхонг (Chom Thong District) Донмыанг (Don Mueang District) Ратчатхеви (Ratchathewi District) Латпхрао (Lat Phrao District) Ваттхана (Watthana District) Бангкхе (Bang Khae District) Лакси (Lak Si District) Саймай (Sai Mai District) Кханнаяо (Khan Na Yao District) Сапхансунг (Saphan Sung District) Вангтхонгланг (Wang Thonglang District) Кхлонгсамва (Khlong Sam Wa District) Бангна (Bang Na District) Тхавиваттхана (Thawi Watthana District) Тхунгкхру (Thung Khru District) Бангбон (Bang Bon District) 
dataset/Dataset/data/741773/table_0|0|114|район|1-й муниципальный район 2-й муниципальный район 3-й муниципальный район 4-й Муниципальный район 5-й муниципальный район 6-й муниципальный район 7-й муниципальный район 8-й муниципальный район 9-й муниципальный район 10-й муниципальный район 
dataset/Dataset/data/767636/table_1|1|114|район|Усакен (Usaquén) Чапинеро (Chapinero) Санта Фе (Santa Fe) Сан Кристобаль (San Cristóbal) Усме (Usme) Тунхуэлито (Tunjuelito) Боса (Bosa) Кеннеди (Kennedy) Фонтибон (Fontibón) Энгатива (Engativá) Суба (Suba) Барриос Унидос (Barrios Unidos) Теусакильо (Teusaquillo) Лос Мартирес (Los Mártires) Антонио Нариньо (Antonio Nariño) Пуэнте Аранда (Puente Aranda) Ла Канделария (La Candelaria) Рафаэль Урибе Урибе (Rafael Uribe Uribe) Сьюдад Боливар (Ciudad Bolívar) Сумапас (Sumapaz) 
dataset/Dataset/data/7676821/table_0|3|114|район|Центр Перевалка Древлянка Зарека Голиковка Октябрьский Древлянка Центр Центр Центр Центр Зарека, Голиковка Древлянка Зарека, Голиковка Голиковка Центр Древлянка, Перевалка Кукковка Южная промзона Древлянка Центр Центр Зарека Перевалка Ключевая Древлянка Древлянка Кукковка Древлянка Зарека Центр Центр Зарека, Голиковка Центр Перевалка Центр Центр Центр Центр, Голиковка Голиковка Голиковка Голиковка Центр Центр, Древлянка Центр Центр Зарека Голиковка Голиковка Голиковка Древлянка Зарека Голиковка Голиковка 
dataset/Dataset/data/7808737/table_2|4|114|район|Усть-Коксинский Кош-Агачский Онгудайский Турочакский / Чойский Майминский / Чемальский 
