table_id|column_id|label_id|label|column_data
dataset/Dataset/data/7292942/table_1|2|145|театр|Режиссёр Р. Стуруа Д. Бертман Л. Баратов Д. Белов Ю. Лаптев Д. Белов А. Шаврин, М. Швыдкая М. Швыдкая О. Глушков А. Кончаловский М. Швыдкая, С. Солдевилья (Франция-Канада) 
dataset/Dataset/data/7030043/table_6|4|145|театр|"«Московский театр юного зрителя», Москва Театр п/р О. Табакова, Москва Театр п/р О. Табакова, Москва Московский театр юного зрителя, Москва Театр п/р О. Табакова, Москва и фестиваль «Черешневый лес», Москва «Сатирикон», Москва Театр оперы и балета, Новосибирск Театр оперы и балета, Новосибирск Музыкальный театр, Ростов-на-Дону Театр оперы и балета, Новосибирск Большой театр, Москва Театр музыкальной комедии, Новосибирск    Театр музыкальной комедии, Новосибирск Мариинский театр, Санкт-Петербург Эксцентрик-балет Сергея Смирнова, Екатеринбург  ""Мариинский театр"""", Санкт-Петербург"" Мариинский театр, Санкт-Петербург «Кукольный формат», Санкт-Петербург театр «Кукольный формат», Санкт-Петербург Хакасский национальный театр кукол «Сказка», Абакан  Музыкальный театр, Ростов-на-Дону театр «Тень», Москва «Саха академический театр имени П. А. Ойунского», Якутск «Приют Комедианта», Санкт-Петербург театр пластической драмы «ЧелоВЕК», Омск Большой театр, Москва Театр оперы и балета, Новосибирск «Сатирикон», Москва  губернатор Челябинской области Пётр Сумин•«Аэрофлот» "
dataset/Dataset/data/7397218/table_1|3|145|театр|Культурхусет Стадстеатерн 
dataset/Dataset/data/5868989/table_1|2|145|театр|Королевский национальный театр Ройал-Корт Янг-Вик Donmar Warehouse Ройал-Корт English Touring Theatre Буш Театр Этель Бэрримор Королевский национальный театр 
dataset/Dataset/data/4872112/table_1|5|145|театр|Театр им. Ханса Отто Театр им. Ханса Отто 
dataset/Dataset/data/1251810/table_2|3|145|театр|Национальный музыкальный молодёжный театр (англ.)русск. Национальный музыкальный молодёжный театр (англ.)русск. Театр Виндхэм (англ.)русск. Театр Комедии (англ.)русск. 
dataset/Dataset/data/7010150/table_0|3|145|театр|Производство На сцене МХАТ имени А. П. Чехова Театр «Ленком» «Независимая труппа Аллы Сигаловой», совместно с Французским культурным центром, на сцене Московского театра на Таганке МХАТ имени А. П. Чехова Центр «Дайтоп Вилладж» (США) в МХАТ имени А. П. Чехова и в Большом драматическом театре имени Г. Товстоногова На сцене Московского театра на Таганке, совместно с Министерством культуры РФ и Австралийским Советом по культуре Геленджикский драматический театр «Торикос» Театр «Ленком» Театр Et Cetera Театр Et Cetera Народный театр «Иван Вазов», София, Болгария Театр Et Cetera Театр Et Cetera Театр Et Cetera Фестиваль «Черешневый лес», Государственный академический театр имени Моссовета Театр Et Cetera Театр Et Cetera Театр Et Cetera Театр Et Cetera Театр Et Cetera Театр Et Cetera Театр Et Cetera 
dataset/Dataset/data/5813034/table_1|3|145|театр|Arcola Theatre 
dataset/Dataset/data/3616845/table_0|3|145|театр|Театр Ричарда Роджерса Ambassador Theatre Театр Хелен Хейс Театр Джорджа Гершвина Студия 54 Бродвейский театр 
dataset/Dataset/data/6872516/table_0|1|145|театр|Оперный театр Сан-Карло (Неаполь) Гёттинген Опера Гарнье (Париж) Латвийская национальная опера (Рига) Театр Массимо (Палермо) совместная постановка театров Ровиго, Савоны, Бергамо Театр Джузеппе Верди (Триест) Национальная опера Греции театр Савоны Баварская государственная опера (Мюнхен) 62-ой Уэксфордский оперный фестиваль (дебют) Оперный театр Сан-Карло (Неаполь) Латвийская национальная опера (Рига) 63-ой Уэксфордский оперный фестиваль Колон (театр) (Буэнос-Айрес) Барбикан-холл Глайндборнский оперный фестиваль (дебют) Cologne Opera (Кёльн, Германия), (дебют) Оперный театр Лилля (Франция) (дебют) Grand théâtre de Luxembourg (Люксембург) (дебют) Баварская государственная опера Оперный театр Кана (Франция) (дебют) Муниципальный театр Сантьяго (дебют) XXXV Международный оперный фестиваль имени Ф. И. Шаляпина в Казани (дебют) Тонхалле в Цюрихе (Швейцария) Виктория-холл в Женеве (Швейцария) Зал Зернового рынка в Тулузе (Франция) Парижская филармония (Франция) Cologne Opera (Кёльн, Германия) Глайндборнский оперный фестиваль Экс-ан-Прованский оперный фестиваль Международный оперный фестиваль в Савонлинна Международный оперный фестиваль в Савонлинна Большой театр Бордо (дебют) Х Международный музыкальный фестиваль Ю.Башмета (Ярославль) Зальцбургский фестиваль(дебют) Баварская государственная опера Дрезденская государственная опера (дебют) Королевский театр Ковент-Гарден (дебют) Вашингтонская национальная опера (дебют) Зал Зернового рынка в Тулузе (Франция) Лос Анджелес Опера (дебют) Опера Бастилии (дебют) Метрополитен-опера (дебют) Баварская государственная опера Венская государственная опера (дебют) Венская государственная опера 
dataset/Dataset/data/8122481/table_1|3|145|театр|Алмейда Trafalgar Studios Алмейда Алмейда Театр Гарольда Пинтера 
dataset/Dataset/data/538416/table_0|3|145|театр|Театр Ричарда Роджерса Ambassador Theatre Театр Хелен Хейс Театр Джорджа Гершвина Студия 54 Бродвейский театр 
dataset/Dataset/data/8136159/table_0|0|145|театр|Казахский ТЮЗ имени Г. Мусрепова Казахский театр оперы и балета имени Абая Astana Opera Новосибирский театр оперы и балета Татарский театр оперы и балета имени Мусы Джалиля Театр Карло Феличе 
dataset/Dataset/data/175581/table_0|1|145|театр|Театральная гостиная Донбасс Оперы ? Геликон Опера 
dataset/Dataset/data/8671616/table_0|4|145|театр|Учебный театр школы-студии МХАТ Учебный театр школы-студии МХАТ Учебный театр школы-студии МХАТ Учебный театр школы-студии МХАТ Учебный театр школы-студии МХАТ Центр им. Мейерхольда  Учебный театр школы-студии МХАТ Учебный театр школы-студии МХАТ ИюльАнсамбль ИюльАнсамбль Центр им. Мейерхольда Практика Практика ИюльАнсамбль Боярские Палаты ИюльАнсамбль ИюльАнсамбль Пространство n0le 
dataset/Dataset/data/7388344/table_0|4|145|театр|Королевский драматический театр Королевский драматический театр Королевский драматический театр Королевский драматический театр Королевский драматический театр Королевский драматический театр Королевский драматический театр Королевский драматический театр Королевский драматический театр Королевский драматический театр Королевский драматический театр Королевский драматический театр Васатеатерн Королевский драматический театр Васатеатерн Новый театр Бланштеатерн Бланштеатерн Бланштеатерн Новый театр Городской театр Мальмё Новый театр Королевский драматический театр Рикстеатерн Васатеатерн Васатеатерн Скалатеатерн Максимтеатерн Intiman 
dataset/Dataset/data/6448638/table_6|4|145|театр|Александринский театр, Санкт-Петербург Студия театрального искусства, Москва Александринский театр, Санкт-Петербург Александринский театр, Санкт-Петербург Мастерская Петра Фоменко, Москва Большой драматический театр им. Г. А. Товстоногова, Санкт-Петербург «Зазеркалье», Санкт-Петербург Театр оперы и балета им. П. Чайковского, Пермь «Зазеркалье», Санкт-Петербург Мариинский театр, Санкт-Петербург Мариинский театр, Санкт-Петербург МХАТ им. А. П. Чехова, Москва Театр музыкальной комедии, Новосибирск Театр музыкальной комедии, Новосибирск Театр музыкальной комедии, Екатеринбург  «Проект Сергея Даниляна», США — Россия Эксцентрик-балет Сергея Смирнова, Екатеринбург Эксцентрик-балет Сергея Смирнова, Екатеринбург Театр оперы и балета, Новосибирск «Проект Сергея Даниляна», США — Россия Театр оперы и балета, Новосибирск Хакасский национальный театр кукол «Сказка», Абакан Театр-студия «КУБ», Санкт-Петербург Театр-студия «КУБ», Санкт-Петербург Большой театр кукол, Санкт-Петербург Театр оперы и балета им. П. Чайковского, Пермь Театр музыкальной комедии, Екатеринбург Музыкальный театр имени К. С. Станиславского и Вл. И. Немировича-Данченко, Москва Мариинский театр, Санкт-Петербург LIQUID Theatre, Москва-Челябинск РАМТ, Москва Алтайский краевой театр драмы имени В. М. Шукшина, Барнаул Театр оперы и балета Республики Саха, Якутск Большой театр, Москва «Проект Сергея Даниляна», США-Россия Театр им. Йожефа Катоны, Венгрия издательский дом «Коммерсантъ»•губернатор Ханты-Мансийского автономного округа — Югры Александр Филипенко 
dataset/Dataset/data/4436633/table_1|3|145|театр|Silo Theatre, Auckland Circa Theatre Silo Theatre, Auckland Silo Theatre, Auckland Auckland Theatre Company Eleventh Hour Productions 
dataset/Dataset/data/6977452/table_0|1|145|театр|Spoleto Festival (Италия) Метрополитен-Опера (США) Сиэтл Опера (США) Spoleto Festival (Италия) Spoleto Festival (Италия) Spoleto Festival (Италия) Израильская филармония Фламандская опера (Антверпен, Бельгия) Метрополитен-Опера (США) Королевская опера в Ковент-Гарден (Великобритания) Лионская опера (Франция) Опера Комик (Франция) Опера Комик (Франция) Парижская опера Бастиль (Франция) Оперный фестиваль Aix-En-Provence Festival (Франция) Фестиваль Сан-Дени (Франции) Театр Ан дер Вин (Вена, Австрия) Ла Скала (Италия) Опера Миннесоты (США) The Aspen Music Festival (США) Оперный фестиваль Aix-En-Provence Festival (Франция) Павильон Дороти Чендлер (США) Национальная опера Бордо (Франция) Театр Колон (Аргентина) Лионская опера (Франция) Театр Шатле (Франция) Эдинбургский фестивальный театр (Шотландия) Эдинбургский фестивальный театр (Шотландия) Оперный фестиваль Aix-En-Provence Festival (Франция) The Salzburg Easter Festival (Германия) Montreux festival (Швейцария) Theatre du Capitole de Toulouse (Франция) Мюнхенская филармония (Германия) Semper Opera (Дрезден, Германия) Эдинбургский фестивальный театр (Шотландия) Severance Hall (Кливленд, США) Музыкальный театр Амстердама (Нидерланды) Национальная опера Бордо (Франция) Опера Сан-Франциско (США) Опера Сан-Франциско (США) Национальная Рейнская опера (Франция) Театр де Шамп-Элизе (Франция) Фестиваль Россини в Висбальде (Германия) Национальная опера Бордо (Франция) Театр Шатле (Франция) Музыкальный театр Амстердама (Нидерланды) Опера в Ницце (Франция) Opera de Montreal (Канада) Оперный театр Марселя (Франция) Национальная Рейнская опера (Франция) Opera de Montreal (Канада) Королевский театр Torino (Италия) Королевский театр Torino (Италия) Метрополитен-Опера (США) Большой театр Лисеу (Испания) Филармонический оркестр Радио Франции Королевский театр де ла Монне (Бельгия) Гастрольный тур театра Метрополитен-Опера в Японии Муниципальный театр Сантьяго (Чили) Opera de Montreal (Канада) Сиэтл Опера (США) Опера Миннесоты (США) Cincinnati Opera (США) Вашингтонская национальная опера (США) L’Opera de Montreal (Канада) Оперный театр Атланты (США) Дворец спорта Берси́ (Париж, Франция) Арена «Колизей Пепси» (Квебек, Канада) Teatro de la Maestranza (Севилья, Испания) Карнеги-Холл (США) Лирическая опера Чикаго (США) Театр Колон (Аргентина) Оперный театр Питтсбурга (США) Оперный театр Атланты (США) Palm Beach Opera (США) Cincinnati Opera (США) Cincinnati Opera (США) Amigos de la Opera de Pamplona (Испания) The Vancouver Concert Hall (Канада) Cincinnati Opera (США) Муниципальный театр Рио-де-Жанейро (Бразилия) Муниципальный театр Рио-де-Жанейро (Бразилия) Teatro Cervantes (Малага, Испания) Дворец каталонской музыки (Испания) Муниципальный театр Джузеппе Верди в Салерно (Италия) Theatro Municipal De Sao Paulo (Бразилия) Карнеги-Холл (США) Театр в Коста-Меса (США) Карнеги-Холл (США) Theatro da Paz (Бразилия) Theatro Belo Horizonte (Бразилия) Teatro Rio Pedras (Пуэрто-Рико) Карнеги-Холл (США) Theatre Jacksonville (США) Новая израильская опера (Израиль) Theatro da Paz (Бразилия) Опера Ниццы (Франция) Teatro Baluarte (Памплона, Испания) Национальная опера «Эстония» (Таллин, Эстония) Jerusalem Opera Company (Израиль) Ереванская Филармония (Армения) Opéra de Baugé (Франция) Israeli Chamber Orchestra (Израиль) Национальная опера Киргизии (Бишкек, Киркизия) Jerusalem Opera Company (Израиль) Jerusalem Camerata Orchestra (Израиль) Shanghai Symphony orchestra (Китай) Berkeley Symphony (США) Opéra de Baugé (Франция) Opéra de Baugé (Франция) Jerusalem Opera (Израиль) Palacio de Bellas Artes Mexico City (Мексика) Opéra de Baugé (Франция) Jerusalem Baroque Orchestra (Израиль) Opéra de Montreal (Канада) New Israeli Opera (Израиль) Williamsburg Opera (США) Opéra de Baugé (Франция) Opéra de Baugé (Франция) Palacio de Bellas Artes Mexico City (Мексика) Haifa Symphony orchestra (Израиль) Jerusalem Opera (Израиль) 
dataset/Dataset/data/7742302/table_0|3|145|театр|Театр Сиглигеты (венг.)русск. в Сольноке Будапештский театр оперетты Национальный театр в Сегеде Театр под открытым небом (венг.)русск. в Сегеде Театр Játékszín (венг.)русск. в Будапеште 
dataset/Dataset/data/6863870/table_6|4|145|театр|Театр на Литейном, Санкт-Петербург «Мастерская Петра Фоменко», Москва Театр на Литейном, Санкт-Петербург Московский театр юного зрителя, Москва Камерный театр, Воронеж «Сатирикон», Москва «Геликон-опера», Москва «Геликон-опера», Москва «Геликон-опера», Москва «Геликон-опера», Москва Мариинский театр, Санкт-Петербург Московская оперетта, Москва Московская оперетта, Москва Музыкальный театр, Краснодар   Мариинский театр, Санкт-Петербург Театр современного танца, Челябинск «Провинциальные танцы», Екатеринбург Мариинский театр, Санкт-Петербург  «Тень», Москва    «Провинциальные танцы», Екатеринбург «Балет Толстых Евгения Панфилова», Пермь Малый драматический театр — театр Европы, Санкт-Петербург «Ленком», Москва «Арвайден», Владикавказ Оркестр Мариинского театра Национальный хореографический центр Орлеана под руководством Жозефа Наджа, Франция «Балтийский дом» и Формальный театр, Санкт-Петербург Николай Гришко, президент фирмы «Гришко»•Борис Говорин, губернатор Иркутской области 
dataset/Dataset/data/3321094/table_0|2|145|театр|ТЮЗ им. Сац ТЮЗ им. Сац ТЮЗ им. Сац ТЮЗ им. Сац ТЮЗ им. Сац ТЮЗ им. Сац ТЮЗ им. Сац ТЮЗ им. Сац ТЮЗ им. Сац ТЮЗ им. Сац ТЮЗ им. Сац ТЮЗ им. Сац ТЮЗ им. Сац ТЮЗ им. Сац ТЮЗ им. Сац ТЮЗ им. Сац ТЮЗ им. Сац ТЮЗ им. Сац ТЮЗ им. Сац ТЮЗ им. Сац ТЮЗ им. Сац ТЮЗ им. Сац ТЮЗ им. Сац ТЮЗ им. Сац ТЮЗ им. Сац ТЮЗ им. Сац ТЮЗ им. Сац ТЮЗ им. Сац ТЮЗ им. Сац ТЮЗ им. Сац ТЮЗ им. Сац ТЮЗ им. Сац ТЮЗ им. Сац ТЮЗ им. Сац ТЮЗ им. Сац ТЮЗ им. Сац ТЮЗ им. Сац ТЮЗ им. Сац ТЮЗ им. Сац АRTиШОК ГАРТД им. Лермонтова ГАРТД им. Лермонтова ГАРТД им. Лермонтова ГАРТД им. Лермонтова ГАРТД им. Лермонтова ГАРТД им. Лермонтова ГАРТД им. Лермонтова ГАРТД им. Лермонтова ГАРТД им. Лермонтова ГАРТД им. Лермонтова 
dataset/Dataset/data/7838779/table_0|3|145|театр|Oscarsteatern (Стокгольм) Гётеборгская опера Гётеборгская опера Замка Gunnebo (Мёльндаль) Города Borås 
dataset/Dataset/data/7558596/table_1|3|145|театр|Donmar Warehouse Бродвей 
dataset/Dataset/data/7292942/table_1|0|145|театр|Год 1996 1999 2001 2002 2009 2010 2012 2012 2013 2014 2016 2016 
dataset/Dataset/data/7292942/table_1|1|145|театр|Спектакль «Леди Макбет Мценского уезда», концертное исполнение оперы «Видения Иоанна Грозного» С. Слонимского, мировая премьера оперы «Моя fair леди», мюзикл Опера «Борис Годунов» М. Мусоргского на территории Святогорского монастыря, Пушкинские горы, Псковская область «Продюсеры», мюзикл Мэла Брукса «Псковитянка», опера Н. Римского-Корсакова в Псковском кремле «Времена не выбирают», мюзикл «Растратчики», мюзикл М. Леонидова «Жизнь прекрасна!», музыкальное ревю «Всё о Золушке», мюзикл Раймонда Паулса «Преступление и наказание», рок-опера Э. Артемьева и Ю. Ряшенцева «Принцесса цирка», мюзикл 
